Title,Media URL,Link,Description,Pinterest board
Athens in 3 Days — Complete Guide from $50/day,https://images.unsplash.com/photo-1555993539-1732b0258235?w=1000&q=85&fit=crop&ar=2:3,https://www.incredibleitinerary.com/blog/athens-3-days,"Plan your Athens trip with real prices. 3-day itinerary with budget, mid-range & luxury plans — hotel picks, Google Maps routes & insider tips. Free guide!  The Acropolis at 8am before tour groups arrive, Plaka alleyways, rooftop bars with Parthenon views over wine, and souvlaki from the place with the handwritten menu.  #AthensTravel #Athens #GreeceTravel #TravelGuide #TravelItinerary #WorldTravel #TripPlanning #TravelBlog #BudgetTravel #TravelGuide",Europe Travel Guides
3 Things to Know Before Visiting Athens (2026),https://images.unsplash.com/photo-1555993539-1732b0258235?w=1000&q=85&fit=crop&ar=2:3,https://www.incredibleitinerary.com/blog/athens-3-days,"Don't make these mistakes on your Athens trip. Best time to visit, where to stay, what to eat & the tourist traps to avoid. Real traveller tips from our free guide.  #AthensTravel #Athens #GreeceTravel #TravelGuide #TravelItinerary #WorldTravel #TripPlanning #TravelBlog #TravelTips #TravelHacks",Europe Travel Guides
The Perfect 3-Day Athens Itinerary (2026),https://images.unsplash.com/photo-1555993539-1732b0258235?w=1000&q=85&fit=crop&ar=2:3,https://www.incredibleitinerary.com/blog/athens-3-days,"Day-by-day Athens plan with 4 travel styles — budget, couple, adventure & family. Real costs, real routes, real tips from IncredibleItinerary. Plan smarter, travel better!  The Acropolis at 8am before tour groups arrive, Plaka alleyways, rooftop bars with Parthenon views over wine, and souvlaki from the place with the handwritten menu.  #AthensTravel #Athens #GreeceTravel #TravelGuide #TravelItinerary #WorldTravel #TripPlanning #TravelBlog #AthensItinerary #TripPlanning",Europe Travel Guides
Santorini in 4 Days — Complete Guide from $50/day,https://images.unsplash.com/photo-1570077188670-e3a8d69ac5ff?w=1000&q=85&fit=crop&ar=2:3,https://www.incredibleitinerary.com/blog/santorini-4-days,"Plan your Santorini trip with real prices. 4-day itinerary with budget, mid-range & luxury plans — hotel picks, Google Maps routes & insider tips. Free guide!  The most photographed sunset on earth is worth every tourist — if you arrive at Oia's Castle by 5:30pm, not 7pm. Add black sand beaches, wine from volcanic soil, cave hotels.  #SantoriniTravel #Santorini #GreeceTravel #TravelGuide #TravelItinerary #WorldTravel #TripPlanning #TravelBlog #BudgetTravel #TravelGuide",Europe Travel Guides
4 Things to Know Before Visiting Santorini (2026),https://images.unsplash.com/photo-1570077188670-e3a8d69ac5ff?w=1000&q=85&fit=crop&ar=2:3,https://www.incredibleitinerary.com/blog/santorini-4-days,"Don't make these mistakes on your Santorini trip. Best time to visit, where to stay, what to eat & the tourist traps to avoid. Real traveller tips from our free guide.  #SantoriniTravel #Santorini #GreeceTravel #TravelGuide #TravelItinerary #WorldTravel #TripPlanning #TravelBlog #TravelTips #TravelHacks",Europe Travel Guides
The Perfect 4-Day Santorini Itinerary (2026),https://images.unsplash.com/photo-1570077188670-e3a8d69ac5ff?w=1000&q=85&fit=crop&ar=2:3,https://www.incredibleitinerary.com/blog/santorini-4-days,"Day-by-day Santorini plan with 4 travel styles — budget, couple, adventure & family. Real costs, real routes, real tips from IncredibleItinerary. Plan smarter, travel better!  The most photographed sunset on earth is worth every tourist — if you arrive at Oia's Castle by 5:30pm, not 7pm. Add black sand beaches, wine from volcanic soil, cave hotels.  #SantoriniTravel #Santorini #GreeceTravel #TravelGuide #TravelItinerary #WorldTravel #TripPlanning #TravelBlog #SantoriniItinerary #TripPlanning",Europe Travel Guides
Crete in 5 Days — Complete Guide from $50/day,https://images.unsplash.com/photo-1601581875309-fafbf2d3ed3a?w=1000&q=85&fit=crop&ar=2:3,https://www.incredibleitinerary.com/blog/crete-5-days,"Plan your Crete trip with real prices. 5-day itinerary with budget, mid-range & luxury plans — hotel picks, Google Maps routes & insider tips. Free guide!  Greece's largest island has the palace of the Minotaur, Europe's longest gorge, a beach with pink sand, and a lamb dish that's been slow-cooked since dawn.  #CreteTravel #Crete #GreeceTravel #TravelGuide #TravelItinerary #WorldTravel #TripPlanning #TravelBlog #BudgetTravel #TravelGuide",Europe Travel Guides
5 Things to Know Before Visiting Crete (2026),https://images.unsplash.com/photo-1601581875309-fafbf2d3ed3a?w=1000&q=85&fit=crop&ar=2:3,https://www.incredibleitinerary.com/blog/crete-5-days,"Don't make these mistakes on your Crete trip. Best time to visit, where to stay, what to eat & the tourist traps to avoid. Real traveller tips from our free guide.  #CreteTravel #Crete #GreeceTravel #TravelGuide #TravelItinerary #WorldTravel #TripPlanning #TravelBlog #TravelTips #TravelHacks",Europe Travel Guides
The Perfect 5-Day Crete Itinerary (2026),https://images.unsplash.com/photo-1601581875309-fafbf2d3ed3a?w=1000&q=85&fit=crop&ar=2:3,https://www.incredibleitinerary.com/blog/crete-5-days,"Day-by-day Crete plan with 4 travel styles — budget, couple, adventure & family. Real costs, real routes, real tips from IncredibleItinerary. Plan smarter, travel better!  Greece's largest island has the palace of the Minotaur, Europe's longest gorge, a beach with pink sand, and a lamb dish that's been slow-cooked since dawn.  #CreteTravel #Crete #GreeceTravel #TravelGuide #TravelItinerary #WorldTravel #TripPlanning #TravelBlog #CreteItinerary #TripPlanning",Europe Travel Guides
Istanbul in 5 Days — Complete Guide from $50/day,https://images.unsplash.com/photo-1524231757912-21f4fe3a7200?w=1000&q=85&fit=crop&ar=2:3,https://www.incredibleitinerary.com/blog/istanbul-5-days,"Plan your Istanbul trip with real prices. 5-day itinerary with budget, mid-range & luxury plans — hotel picks, Google Maps routes & insider tips. Free guide!  The only city on two continents — Hagia Sophia's dome has stood for 1,500 years, the Grand Bazaar has 4,000 shops, and the ferry across the Bosphorus costs 50 cents.  #IstanbulTravel #Istanbul #TurkeyTravel #TravelGuide #TravelItinerary #WorldTravel #TripPlanning #TravelBlog #BudgetTravel #TravelGuide",Europe Travel Guides
5 Things to Know Before Visiting Istanbul (2026),https://images.unsplash.com/photo-1524231757912-21f4fe3a7200?w=1000&q=85&fit=crop&ar=2:3,https://www.incredibleitinerary.com/blog/istanbul-5-days,"Don't make these mistakes on your Istanbul trip. Best time to visit, where to stay, what to eat & the tourist traps to avoid. Real traveller tips from our free guide.  #IstanbulTravel #Istanbul #TurkeyTravel #TravelGuide #TravelItinerary #WorldTravel #TripPlanning #TravelBlog #TravelTips #TravelHacks",Europe Travel Guides
The Perfect 5-Day Istanbul Itinerary (2026),https://images.unsplash.com/photo-1524231757912-21f4fe3a7200?w=1000&q=85&fit=crop&ar=2:3,https://www.incredibleitinerary.com/blog/istanbul-5-days,"Day-by-day Istanbul plan with 4 travel styles — budget, couple, adventure & family. Real costs, real routes, real tips from IncredibleItinerary. Plan smarter, travel better!  The only city on two continents — Hagia Sophia's dome has stood for 1,500 years, the Grand Bazaar has 4,000 shops, and the ferry across the Bosphorus costs 50 cents.  #IstanbulTravel #Istanbul #TurkeyTravel #TravelGuide #TravelItinerary #WorldTravel #TripPlanning #TravelBlog #IstanbulItinerary #TripPlanning",Europe Travel Guides
Cappadocia in 3 Days — Complete Guide from $50/day,https://images.unsplash.com/photo-1570939274717-7eda259b50ed?w=1000&q=85&fit=crop&ar=2:3,https://www.incredibleitinerary.com/blog/cappadocia-3-days,"Plan your Cappadocia trip with real prices. 3-day itinerary with budget, mid-range & luxury plans — hotel picks, Google Maps routes & insider tips. Free guide!  Dawn balloon flight over 200 floating balloons is the most surreal thing you'll ever see. Add cave hotels carved into rock, underground cities 8 floors deep, and lunar landscapes.  #CappadociaTravel #Cappadocia #TurkeyTravel #TravelGuide #TravelItinerary #WorldTravel #TripPlanning #TravelBlog #BudgetTravel #TravelGuide",Europe Travel Guides
3 Things to Know Before Visiting Cappadocia (2026),https://images.unsplash.com/photo-1570939274717-7eda259b50ed?w=1000&q=85&fit=crop&ar=2:3,https://www.incredibleitinerary.com/blog/cappadocia-3-days,"Don't make these mistakes on your Cappadocia trip. Best time to visit, where to stay, what to eat & the tourist traps to avoid. Real traveller tips from our free guide.  #CappadociaTravel #Cappadocia #TurkeyTravel #TravelGuide #TravelItinerary #WorldTravel #TripPlanning #TravelBlog #TravelTips #TravelHacks",Europe Travel Guides
The Perfect 3-Day Cappadocia Itinerary (2026),https://images.unsplash.com/photo-1570939274717-7eda259b50ed?w=1000&q=85&fit=crop&ar=2:3,https://www.incredibleitinerary.com/blog/cappadocia-3-days,"Day-by-day Cappadocia plan with 4 travel styles — budget, couple, adventure & family. Real costs, real routes, real tips from IncredibleItinerary. Plan smarter, travel better!  Dawn balloon flight over 200 floating balloons is the most surreal thing you'll ever see. Add cave hotels carved into rock, underground cities 8 floors deep, and lunar landscapes.  #CappadociaTravel #Cappadocia #TurkeyTravel #TravelGuide #TravelItinerary #WorldTravel #TripPlanning #TravelBlog #CappadociaItinerary…",Europe Travel Guides
Antalya in 3 Days — Complete Guide from $50/day,https://images.unsplash.com/photo-1589395937658-0557e7d89fad?w=1000&q=85&fit=crop&ar=2:3,https://www.incredibleitinerary.com/blog/antalya-3-days,"Plan your Antalya trip with real prices. 3-day itinerary with budget, mid-range & luxury plans — hotel picks, Google Maps routes & insider tips. Free guide!  The Turkish Riviera where Roman aqueducts meet turquoise water — Kaleiçi old city walls, Düden Waterfall into the sea, boat tours, and beach clubs at a fraction of Greek island prices.  #AntalyaTravel #Antalya #TurkeyTravel #TravelGuide #TravelItinerary #WorldTravel #TripPlanning #TravelBlog #BudgetTravel #TravelGuide",Europe Travel Guides
3 Things to Know Before Visiting Antalya (2026),https://images.unsplash.com/photo-1589395937658-0557e7d89fad?w=1000&q=85&fit=crop&ar=2:3,https://www.incredibleitinerary.com/blog/antalya-3-days,"Don't make these mistakes on your Antalya trip. Best time to visit, where to stay, what to eat & the tourist traps to avoid. Real traveller tips from our free guide.  #AntalyaTravel #Antalya #TurkeyTravel #TravelGuide #TravelItinerary #WorldTravel #TripPlanning #TravelBlog #TravelTips #TravelHacks",Europe Travel Guides
The Perfect 3-Day Antalya Itinerary (2026),https://images.unsplash.com/photo-1589395937658-0557e7d89fad?w=1000&q=85&fit=crop&ar=2:3,https://www.incredibleitinerary.com/blog/antalya-3-days,"Day-by-day Antalya plan with 4 travel styles — budget, couple, adventure & family. Real costs, real routes, real tips from IncredibleItinerary. Plan smarter, travel better!  The Turkish Riviera where Roman aqueducts meet turquoise water — Kaleiçi old city walls, Düden Waterfall into the sea, boat tours, and beach clubs at a fraction of Greek island prices.  #AntalyaTravel #Antalya #TurkeyTravel #TravelGuide #TravelItinerary #WorldTravel #TripPlanning #TravelBlog #AntalyaItinerary #TripPlanning",Europe Travel Guides
Maldives in 5 Days — Complete Guide from $50/day,https://images.unsplash.com/photo-1514282401047-d79a71a590e8?w=1000&q=85&fit=crop&ar=2:3,https://www.incredibleitinerary.com/blog/maldives-5-days,"Plan your Maldives trip with real prices. 5-day itinerary with budget, mid-range & luxury plans — hotel picks, Google Maps routes & insider tips. Free guide!  The world's most Instagrammed destination has a budget version most people don't know about — local islands with white sand beaches for $40/night. This guide covers both.  #MaldivesTravel #Maldives #TravelGuide #TravelItinerary #WorldTravel #TripPlanning #TravelBlog #IndianOcean #BudgetTravel #TravelGuide",Maldives & Island Escapes
5 Things to Know Before Visiting Maldives (2026),https://images.unsplash.com/photo-1514282401047-d79a71a590e8?w=1000&q=85&fit=crop&ar=2:3,https://www.incredibleitinerary.com/blog/maldives-5-days,"Don't make these mistakes on your Maldives trip. Best time to visit, where to stay, what to eat & the tourist traps to avoid. Real traveller tips from our free guide.  #MaldivesTravel #Maldives #TravelGuide #TravelItinerary #WorldTravel #TripPlanning #TravelBlog #IndianOcean #TravelTips #TravelHacks",Maldives & Island Escapes
The Perfect 5-Day Maldives Itinerary (2026),https://images.unsplash.com/photo-1514282401047-d79a71a590e8?w=1000&q=85&fit=crop&ar=2:3,https://www.incredibleitinerary.com/blog/maldives-5-days,"Day-by-day Maldives plan with 4 travel styles — budget, couple, adventure & family. Real costs, real routes, real tips from IncredibleItinerary. Plan smarter, travel better!  The world's most Instagrammed destination has a budget version most people don't know about — local islands with white sand beaches for $40/night. This guide covers both.  #MaldivesTravel #Maldives #TravelGuide #TravelItinerary #WorldTravel #TripPlanning #TravelBlog #IndianOcean #MaldivesItinerary #TripPlanning",Maldives & Island Escapes
Singapore in 3 Days — Complete Guide from $30/day,https://images.unsplash.com/photo-1525625293386-3f8f99389edd?w=1000&q=85&fit=crop&ar=2:3,https://www.incredibleitinerary.com/blog/singapore-3-days,"Plan your Singapore trip with real prices. 3-day itinerary with budget, mid-range & luxury plans — hotel picks, Google Maps routes & insider tips. Free guide!  The world's most efficient city also has the world's best street food — $3 Michelin-starred chicken rice at Maxwell hawker, Gardens by the Bay at night, and zoo that changed zoos.  #SingaporeTravel #Singapore #TravelGuide #TravelItinerary #WorldTravel #TripPlanning #TravelBlog #SoutheastAsia #BudgetTravel #TravelGuide",Southeast Asia Travel
3 Things to Know Before Visiting Singapore (2026),https://images.unsplash.com/photo-1525625293386-3f8f99389edd?w=1000&q=85&fit=crop&ar=2:3,https://www.incredibleitinerary.com/blog/singapore-3-days,"Don't make these mistakes on your Singapore trip. Best time to visit, where to stay, what to eat & the tourist traps to avoid. Real traveller tips from our free guide.  #SingaporeTravel #Singapore #TravelGuide #TravelItinerary #WorldTravel #TripPlanning #TravelBlog #SoutheastAsia #TravelTips #TravelHacks",Southeast Asia Travel
The Perfect 3-Day Singapore Itinerary (2026),https://images.unsplash.com/photo-1525625293386-3f8f99389edd?w=1000&q=85&fit=crop&ar=2:3,https://www.incredibleitinerary.com/blog/singapore-3-days,"Day-by-day Singapore plan with 4 travel styles — budget, couple, adventure & family. Real costs, real routes, real tips from IncredibleItinerary. Plan smarter, travel better!  The world's most efficient city also has the world's best street food — $3 Michelin-starred chicken rice at Maxwell hawker, Gardens by the Bay at night, and zoo that changed zoos.  #SingaporeTravel #Singapore #TravelGuide #TravelItinerary #WorldTravel #TripPlanning #TravelBlog #SoutheastAsia #SingaporeItinerary…",Southeast Asia Travel
Lisbon in 4 Days — Complete Guide from $50/day,https://images.unsplash.com/photo-1555881400-74d7acaacd8b?w=1000&q=85&fit=crop&ar=2:3,https://www.incredibleitinerary.com/blog/lisbon-4-days,"Plan your Lisbon trip with real prices. 4-day itinerary with budget, mid-range & luxury plans — hotel picks, Google Maps routes & insider tips. Free guide!  Europe's sunniest capital is also its most melancholy — Tram 28 through Alfama, fado music in a candlelit bar, pastel de nata warm from the original Belém bakery, and wine for €2.  #LisbonTravel #Lisbon #PortugalTravel #TravelGuide #TravelItinerary #WorldTravel #TripPlanning #TravelBlog #BudgetTravel #TravelGuide",Europe Travel Guides
4 Things to Know Before Visiting Lisbon (2026),https://images.unsplash.com/photo-1555881400-74d7acaacd8b?w=1000&q=85&fit=crop&ar=2:3,https://www.incredibleitinerary.com/blog/lisbon-4-days,"Don't make these mistakes on your Lisbon trip. Best time to visit, where to stay, what to eat & the tourist traps to avoid. Real traveller tips from our free guide.  #LisbonTravel #Lisbon #PortugalTravel #TravelGuide #TravelItinerary #WorldTravel #TripPlanning #TravelBlog #TravelTips #TravelHacks",Europe Travel Guides
The Perfect 4-Day Lisbon Itinerary (2026),https://images.unsplash.com/photo-1555881400-74d7acaacd8b?w=1000&q=85&fit=crop&ar=2:3,https://www.incredibleitinerary.com/blog/lisbon-4-days,"Day-by-day Lisbon plan with 4 travel styles — budget, couple, adventure & family. Real costs, real routes, real tips from IncredibleItinerary. Plan smarter, travel better!  Europe's sunniest capital is also its most melancholy — Tram 28 through Alfama, fado music in a candlelit bar, pastel de nata warm from the original Belém bakery, and wine for €2.  #LisbonTravel #Lisbon #PortugalTravel #TravelGuide #TravelItinerary #WorldTravel #TripPlanning #TravelBlog #LisbonItinerary #TripPlanning",Europe Travel Guides
Porto in 3 Days — Complete Guide from $50/day,https://images.unsplash.com/photo-1548707309-dcebeab9ea9b?w=1000&q=85&fit=crop&ar=2:3,https://www.incredibleitinerary.com/blog/porto-3-days,"Plan your Porto trip with real prices. 3-day itinerary with budget, mid-range & luxury plans — hotel picks, Google Maps routes & insider tips. Free guide!  The city that inspired Harry Potter's Hogwarts — Livraria Lello bookshop, azulejo-covered chapel, six bridges over the Douro, and tasting port wine in a 300-year-old cellar.  #PortoTravel #Porto #PortugalTravel #TravelGuide #TravelItinerary #WorldTravel #TripPlanning #TravelBlog #BudgetTravel #TravelGuide",Europe Travel Guides
3 Things to Know Before Visiting Porto (2026),https://images.unsplash.com/photo-1548707309-dcebeab9ea9b?w=1000&q=85&fit=crop&ar=2:3,https://www.incredibleitinerary.com/blog/porto-3-days,"Don't make these mistakes on your Porto trip. Best time to visit, where to stay, what to eat & the tourist traps to avoid. Real traveller tips from our free guide.  #PortoTravel #Porto #PortugalTravel #TravelGuide #TravelItinerary #WorldTravel #TripPlanning #TravelBlog #TravelTips #TravelHacks",Europe Travel Guides
The Perfect 3-Day Porto Itinerary (2026),https://images.unsplash.com/photo-1548707309-dcebeab9ea9b?w=1000&q=85&fit=crop&ar=2:3,https://www.incredibleitinerary.com/blog/porto-3-days,"Day-by-day Porto plan with 4 travel styles — budget, couple, adventure & family. Real costs, real routes, real tips from IncredibleItinerary. Plan smarter, travel better!  The city that inspired Harry Potter's Hogwarts — Livraria Lello bookshop, azulejo-covered chapel, six bridges over the Douro, and tasting port wine in a 300-year-old cellar.  #PortoTravel #Porto #PortugalTravel #TravelGuide #TravelItinerary #WorldTravel #TripPlanning #TravelBlog #PortoItinerary #TripPlanning",Europe Travel Guides
Algarve in 4 Days — Complete Guide from $50/day,https://images.unsplash.com/photo-1548625361-58a9d86b2c46?w=1000&q=85&fit=crop&ar=2:3,https://www.incredibleitinerary.com/blog/algarve-4-days,"Plan your Algarve trip with real prices. 4-day itinerary with budget, mid-range & luxury plans — hotel picks, Google Maps routes & insider tips. Free guide!  Europe's best coastline — golden limestone arches at Ponta da Piedade, kayak through the Benagil sea cave, surfer town Lagos, and Sagres at the edge of the ancient world.  #AlgarveTravel #Algarve #PortugalTravel #TravelGuide #TravelItinerary #WorldTravel #TripPlanning #TravelBlog #BudgetTravel #TravelGuide",Europe Travel Guides
4 Things to Know Before Visiting Algarve (2026),https://images.unsplash.com/photo-1548625361-58a9d86b2c46?w=1000&q=85&fit=crop&ar=2:3,https://www.incredibleitinerary.com/blog/algarve-4-days,"Don't make these mistakes on your Algarve trip. Best time to visit, where to stay, what to eat & the tourist traps to avoid. Real traveller tips from our free guide.  #AlgarveTravel #Algarve #PortugalTravel #TravelGuide #TravelItinerary #WorldTravel #TripPlanning #TravelBlog #TravelTips #TravelHacks",Europe Travel Guides
The Perfect 4-Day Algarve Itinerary (2026),https://images.unsplash.com/photo-1548625361-58a9d86b2c46?w=1000&q=85&fit=crop&ar=2:3,https://www.incredibleitinerary.com/blog/algarve-4-days,"Day-by-day Algarve plan with 4 travel styles — budget, couple, adventure & family. Real costs, real routes, real tips from IncredibleItinerary. Plan smarter, travel better!  Europe's best coastline — golden limestone arches at Ponta da Piedade, kayak through the Benagil sea cave, surfer town Lagos, and Sagres at the edge of the ancient world.  #AlgarveTravel #Algarve #PortugalTravel #TravelGuide #TravelItinerary #WorldTravel #TripPlanning #TravelBlog #AlgarveItinerary #TripPlanning",Europe Travel Guides
Kuala Lumpur in 3 Days — Complete Guide from $30/day,https://images.unsplash.com/photo-1596422846543-75c6fc197f07?w=1000&q=85&fit=crop&ar=2:3,https://www.incredibleitinerary.com/blog/kuala-lumpur-3-days,"Plan your Kuala Lumpur trip with real prices. 3-day itinerary with budget, mid-range & luxury plans — hotel picks, Google Maps routes & insider tips. Free guide!  The twin towers at night are the best skyline in Asia. Add Hindu Batu Caves at dawn, Chinatown's Jalan Petaling, and a nasi lemak breakfast that costs less than a coffee at Starbucks.  #KualaLumpurTravel #KualaLumpur #MalaysiaTravel #TravelGuide #TravelItinerary #WorldTravel #TripPlanning #TravelBlog #BudgetTravel #TravelGuide",Southeast Asia Travel
3 Things to Know Before Visiting Kuala Lumpur (2026),https://images.unsplash.com/photo-1596422846543-75c6fc197f07?w=1000&q=85&fit=crop&ar=2:3,https://www.incredibleitinerary.com/blog/kuala-lumpur-3-days,"Don't make these mistakes on your Kuala Lumpur trip. Best time to visit, where to stay, what to eat & the tourist traps to avoid. Real traveller tips from our free guide.  #KualaLumpurTravel #KualaLumpur #MalaysiaTravel #TravelGuide #TravelItinerary #WorldTravel #TripPlanning #TravelBlog #TravelTips #TravelHacks",Southeast Asia Travel
The Perfect 3-Day Kuala Lumpur Itinerary (2026),https://images.unsplash.com/photo-1596422846543-75c6fc197f07?w=1000&q=85&fit=crop&ar=2:3,https://www.incredibleitinerary.com/blog/kuala-lumpur-3-days,"Day-by-day Kuala Lumpur plan with 4 travel styles — budget, couple, adventure & family. Real costs, real routes, real tips from IncredibleItinerary. Plan smarter, travel better!  The twin towers at night are the best skyline in Asia. Add Hindu Batu Caves at dawn, Chinatown's Jalan Petaling, and a nasi lemak breakfast that costs less than a coffee at Starbucks.  #KualaLumpurTravel #KualaLumpur #MalaysiaTravel #TravelGuide #TravelItinerary #WorldTravel #TripPlanning #TravelBlog…",Southeast Asia Travel
Langkawi in 3 Days — Complete Guide from $30/day,https://images.unsplash.com/photo-1520250497591-112f2f40a3f4?w=1000&q=85&fit=crop&ar=2:3,https://www.incredibleitinerary.com/blog/langkawi-3-days,"Plan your Langkawi trip with real prices. 3-day itinerary with budget, mid-range & luxury plans — hotel picks, Google Maps routes & insider tips. Free guide!  Malaysia's duty-free island has better beaches than Bali at a third of the price — cable car over the rainforest canopy, mangrove kayaking, and sunsets from the Eagle Square.  #LangkawiTravel #Langkawi #MalaysiaTravel #TravelGuide #TravelItinerary #WorldTravel #TripPlanning #TravelBlog #BudgetTravel #TravelGuide",Southeast Asia Travel
3 Things to Know Before Visiting Langkawi (2026),https://images.unsplash.com/photo-1520250497591-112f2f40a3f4?w=1000&q=85&fit=crop&ar=2:3,https://www.incredibleitinerary.com/blog/langkawi-3-days,"Don't make these mistakes on your Langkawi trip. Best time to visit, where to stay, what to eat & the tourist traps to avoid. Real traveller tips from our free guide.  #LangkawiTravel #Langkawi #MalaysiaTravel #TravelGuide #TravelItinerary #WorldTravel #TripPlanning #TravelBlog #TravelTips #TravelHacks",Southeast Asia Travel
The Perfect 3-Day Langkawi Itinerary (2026),https://images.unsplash.com/photo-1520250497591-112f2f40a3f4?w=1000&q=85&fit=crop&ar=2:3,https://www.incredibleitinerary.com/blog/langkawi-3-days,"Day-by-day Langkawi plan with 4 travel styles — budget, couple, adventure & family. Real costs, real routes, real tips from IncredibleItinerary. Plan smarter, travel better!  Malaysia's duty-free island has better beaches than Bali at a third of the price — cable car over the rainforest canopy, mangrove kayaking, and sunsets from the Eagle Square.  #LangkawiTravel #Langkawi #MalaysiaTravel #TravelGuide #TravelItinerary #WorldTravel #TripPlanning #TravelBlog #LangkawiItinerary #TripPlanning",Southeast Asia Travel
Penang in 3 Days — Complete Guide from $30/day,https://images.unsplash.com/photo-1573108037329-37aa135a142e?w=1000&q=85&fit=crop&ar=2:3,https://www.incredibleitinerary.com/blog/penang-3-days,"Plan your Penang trip with real prices. 3-day itinerary with budget, mid-range & luxury plans — hotel picks, Google Maps routes & insider tips. Free guide!  The food capital of Malaysia and arguably all of Asia — char kway teow from an 80-year-old hawker stall, UNESCO Georgetown's street murals, clan jetties, and colonial heritage.  #PenangTravel #Penang #MalaysiaTravel #TravelGuide #TravelItinerary #WorldTravel #TripPlanning #TravelBlog #BudgetTravel #TravelGuide",Southeast Asia Travel
