Title,Media URL,Link,Description,Pinterest board
3 Things to Know Before Visiting Penang (2026),https://images.unsplash.com/photo-1573108037329-37aa135a142e?w=1000&q=85&fit=crop&ar=2:3,https://www.incredibleitinerary.com/blog/penang-3-days,"Don't make these mistakes on your Penang trip. Best time to visit, where to stay, what to eat & the tourist traps to avoid. Real traveller tips from our free guide.  #PenangTravel #Penang #MalaysiaTravel #TravelGuide #TravelItinerary #WorldTravel #TripPlanning #TravelBlog #TravelTips #TravelHacks",Southeast Asia Travel
The Perfect 3-Day Penang Itinerary (2026),https://images.unsplash.com/photo-1573108037329-37aa135a142e?w=1000&q=85&fit=crop&ar=2:3,https://www.incredibleitinerary.com/blog/penang-3-days,"Day-by-day Penang plan with 4 travel styles — budget, couple, adventure & family. Real costs, real routes, real tips from IncredibleItinerary. Plan smarter, travel better!  The food capital of Malaysia and arguably all of Asia — char kway teow from an 80-year-old hawker stall, UNESCO Georgetown's street murals, clan jetties, and colonial heritage.  #PenangTravel #Penang #MalaysiaTravel #TravelGuide #TravelItinerary #WorldTravel #TripPlanning #TravelBlog #PenangItinerary #TripPlanning",Southeast Asia Travel
Paris in 5 Days — Complete Guide from $50/day,https://images.unsplash.com/photo-1502602898657-3e91760cbb34?w=1000&q=85&fit=crop&ar=2:3,https://www.incredibleitinerary.com/blog/paris-5-days,"Plan your Paris trip with real prices. 5-day itinerary with budget, mid-range & luxury plans — hotel picks, Google Maps routes & insider tips. Free guide!  The Eiffel Tower at dawn, the Louvre without the panic, Montmartre before the crowds — 5 days in Paris done properly. 3 complete plans with real budgets, skip-the-line tips, and the Versailles secret most visitors miss.  #ParisTravel #Paris #FranceTravel #TravelGuide #TravelItinerary #WorldTravel #TripPlanning #TravelBlog #BudgetTravel…",Europe Travel Guides
5 Things to Know Before Visiting Paris (2026),https://images.unsplash.com/photo-1502602898657-3e91760cbb34?w=1000&q=85&fit=crop&ar=2:3,https://www.incredibleitinerary.com/blog/paris-5-days,"Don't make these mistakes on your Paris trip. Best time to visit, where to stay, what to eat & the tourist traps to avoid. Real traveller tips from our free guide.  #ParisTravel #Paris #FranceTravel #TravelGuide #TravelItinerary #WorldTravel #TripPlanning #TravelBlog #TravelTips #TravelHacks",Europe Travel Guides
The Perfect 5-Day Paris Itinerary (2026),https://images.unsplash.com/photo-1502602898657-3e91760cbb34?w=1000&q=85&fit=crop&ar=2:3,https://www.incredibleitinerary.com/blog/paris-5-days,"Day-by-day Paris plan with 4 travel styles — budget, couple, adventure & family. Real costs, real routes, real tips from IncredibleItinerary. Plan smarter, travel better!  The Eiffel Tower at dawn, the Louvre without the panic, Montmartre before the crowds — 5 days in Paris done properly. 3 complete plans with real budgets, skip-the-line tips, and the Versailles secret most visitors miss.  #ParisTravel #Paris #FranceTravel #TravelGuide #TravelItinerary #WorldTravel #TripPlanning #TravelBlog…",Europe Travel Guides
Nice in 3 Days — Complete Guide from $50/day,https://images.unsplash.com/photo-1491557345352-5929e343eb89?w=1000&q=85&fit=crop&ar=2:3,https://www.incredibleitinerary.com/blog/nice-3-days,"Plan your Nice trip with real prices. 3-day itinerary with budget, mid-range & luxury plans — hotel picks, Google Maps routes & insider tips. Free guide!  The Promenade des Anglais at sunrise, a morning in Monaco's principality, the medieval village of Èze — and the best socca in Nice's old town. The Côte d'Azur done in 3 days.  #NiceTravel #Nice #FranceTravel #TravelGuide #TravelItinerary #WorldTravel #TripPlanning #TravelBlog #BudgetTravel #TravelGuide",Europe Travel Guides
3 Things to Know Before Visiting Nice (2026),https://images.unsplash.com/photo-1491557345352-5929e343eb89?w=1000&q=85&fit=crop&ar=2:3,https://www.incredibleitinerary.com/blog/nice-3-days,"Don't make these mistakes on your Nice trip. Best time to visit, where to stay, what to eat & the tourist traps to avoid. Real traveller tips from our free guide.  #NiceTravel #Nice #FranceTravel #TravelGuide #TravelItinerary #WorldTravel #TripPlanning #TravelBlog #TravelTips #TravelHacks",Europe Travel Guides
The Perfect 3-Day Nice Itinerary (2026),https://images.unsplash.com/photo-1491557345352-5929e343eb89?w=1000&q=85&fit=crop&ar=2:3,https://www.incredibleitinerary.com/blog/nice-3-days,"Day-by-day Nice plan with 4 travel styles — budget, couple, adventure & family. Real costs, real routes, real tips from IncredibleItinerary. Plan smarter, travel better!  The Promenade des Anglais at sunrise, a morning in Monaco's principality, the medieval village of Èze — and the best socca in Nice's old town. The Côte d'Azur done in 3 days.  #NiceTravel #Nice #FranceTravel #TravelGuide #TravelItinerary #WorldTravel #TripPlanning #TravelBlog #NiceItinerary #TripPlanning",Europe Travel Guides
Lyon in 3 Days — Complete Guide from $50/day,https://images.unsplash.com/photo-1524484485831-a92ffc0de03f?w=1000&q=85&fit=crop&ar=2:3,https://www.incredibleitinerary.com/blog/lyon-3-days,"Plan your Lyon trip with real prices. 3-day itinerary with budget, mid-range & luxury plans — hotel picks, Google Maps routes & insider tips. Free guide!  The gastronomic capital of France — bouchon lunches, Les Halles Paul Bocuse, traboule passages through Renaissance Vieux Lyon, and a Beaujolais village day trip. 3 days of eating and walking.  #LyonTravel #Lyon #FranceTravel #TravelGuide #TravelItinerary #WorldTravel #TripPlanning #TravelBlog #BudgetTravel #TravelGuide",Europe Travel Guides
3 Things to Know Before Visiting Lyon (2026),https://images.unsplash.com/photo-1524484485831-a92ffc0de03f?w=1000&q=85&fit=crop&ar=2:3,https://www.incredibleitinerary.com/blog/lyon-3-days,"Don't make these mistakes on your Lyon trip. Best time to visit, where to stay, what to eat & the tourist traps to avoid. Real traveller tips from our free guide.  #LyonTravel #Lyon #FranceTravel #TravelGuide #TravelItinerary #WorldTravel #TripPlanning #TravelBlog #TravelTips #TravelHacks",Europe Travel Guides
The Perfect 3-Day Lyon Itinerary (2026),https://images.unsplash.com/photo-1524484485831-a92ffc0de03f?w=1000&q=85&fit=crop&ar=2:3,https://www.incredibleitinerary.com/blog/lyon-3-days,"Day-by-day Lyon plan with 4 travel styles — budget, couple, adventure & family. Real costs, real routes, real tips from IncredibleItinerary. Plan smarter, travel better!  The gastronomic capital of France — bouchon lunches, Les Halles Paul Bocuse, traboule passages through Renaissance Vieux Lyon, and a Beaujolais village day trip. 3 days of eating and walking.  #LyonTravel #Lyon #FranceTravel #TravelGuide #TravelItinerary #WorldTravel #TripPlanning #TravelBlog #LyonItinerary #TripPlanning",Europe Travel Guides
Bordeaux in 3 Days — Complete Guide from $50/day,https://images.unsplash.com/photo-1600011689032-8b628b8a8747?w=1000&q=85&fit=crop&ar=2:3,https://www.incredibleitinerary.com/blog/bordeaux-3-days,"Plan your Bordeaux trip with real prices. 3-day itinerary with budget, mid-range & luxury plans — hotel picks, Google Maps routes & insider tips. Free guide!  The wine capital of the world — La Cité du Vin, Miroir d'Eau water mirror, Place de la Bourse, and a €11 train to Saint-Émilion's medieval vineyards. Budget to luxury, all mapped out.  #BordeauxTravel #Bordeaux #FranceTravel #TravelGuide #TravelItinerary #WorldTravel #TripPlanning #TravelBlog #BudgetTravel #TravelGuide",Europe Travel Guides
3 Things to Know Before Visiting Bordeaux (2026),https://images.unsplash.com/photo-1600011689032-8b628b8a8747?w=1000&q=85&fit=crop&ar=2:3,https://www.incredibleitinerary.com/blog/bordeaux-3-days,"Don't make these mistakes on your Bordeaux trip. Best time to visit, where to stay, what to eat & the tourist traps to avoid. Real traveller tips from our free guide.  #BordeauxTravel #Bordeaux #FranceTravel #TravelGuide #TravelItinerary #WorldTravel #TripPlanning #TravelBlog #TravelTips #TravelHacks",Europe Travel Guides
The Perfect 3-Day Bordeaux Itinerary (2026),https://images.unsplash.com/photo-1600011689032-8b628b8a8747?w=1000&q=85&fit=crop&ar=2:3,https://www.incredibleitinerary.com/blog/bordeaux-3-days,"Day-by-day Bordeaux plan with 4 travel styles — budget, couple, adventure & family. Real costs, real routes, real tips from IncredibleItinerary. Plan smarter, travel better!  The wine capital of the world — La Cité du Vin, Miroir d'Eau water mirror, Place de la Bourse, and a €11 train to Saint-Émilion's medieval vineyards. Budget to luxury, all mapped out.  #BordeauxTravel #Bordeaux #FranceTravel #TravelGuide #TravelItinerary #WorldTravel #TripPlanning #TravelBlog #BordeauxItinerary…",Europe Travel Guides
Provence in 4 Days — Complete Guide from $50/day,https://images.unsplash.com/photo-1595867818082-083862f3d630?w=1000&q=85&fit=crop&ar=2:3,https://www.incredibleitinerary.com/blog/provence-4-days,"Plan your Provence trip with real prices. 4-day itinerary with budget, mid-range & luxury plans — hotel picks, Google Maps routes & insider tips. Free guide!  Lavender fields at dawn, the hilltop village of Gordes, Sénanque Abbey surrounded by purple, Les Baux-de-Provence ruins, and wild Camargue flamingos. The definitive Provence road trip.  #ProvenceTravel #Provence #FranceTravel #TravelGuide #TravelItinerary #WorldTravel #TripPlanning #TravelBlog #BudgetTravel #TravelGuide",Europe Travel Guides
4 Things to Know Before Visiting Provence (2026),https://images.unsplash.com/photo-1595867818082-083862f3d630?w=1000&q=85&fit=crop&ar=2:3,https://www.incredibleitinerary.com/blog/provence-4-days,"Don't make these mistakes on your Provence trip. Best time to visit, where to stay, what to eat & the tourist traps to avoid. Real traveller tips from our free guide.  #ProvenceTravel #Provence #FranceTravel #TravelGuide #TravelItinerary #WorldTravel #TripPlanning #TravelBlog #TravelTips #TravelHacks",Europe Travel Guides
The Perfect 4-Day Provence Itinerary (2026),https://images.unsplash.com/photo-1595867818082-083862f3d630?w=1000&q=85&fit=crop&ar=2:3,https://www.incredibleitinerary.com/blog/provence-4-days,"Day-by-day Provence plan with 4 travel styles — budget, couple, adventure & family. Real costs, real routes, real tips from IncredibleItinerary. Plan smarter, travel better!  Lavender fields at dawn, the hilltop village of Gordes, Sénanque Abbey surrounded by purple, Les Baux-de-Provence ruins, and wild Camargue flamingos. The definitive Provence road trip.  #ProvenceTravel #Provence #FranceTravel #TravelGuide #TravelItinerary #WorldTravel #TripPlanning #TravelBlog #ProvenceItinerary…",Europe Travel Guides
Mont Saint-Michel in 2 Days — Complete Guide from $50/day,https://images.unsplash.com/photo-1571150374697-36a0935e7736?w=1000&q=85&fit=crop&ar=2:3,https://www.incredibleitinerary.com/blog/mont-saint-michel-2-days,"Plan your Mont Saint-Michel trip with real prices. 2-day itinerary with budget, mid-range & luxury plans — hotel picks, Google Maps routes & insider tips. Free guide!  Rising from the sea at high tide, empty at dawn before the tour buses — Mont Saint-Michel is one of France's great wonders. The abbey, the bay crossing with a guide, and where to stay on the island.  #MontSaint-MichelTravel #MontSaint-Michel #FranceTravel #TravelGuide #TravelItinerary #WorldTravel #TripPlanning #TravelBlog…",Europe Travel Guides
2 Things to Know Before Visiting Mont Saint-Michel (2026),https://images.unsplash.com/photo-1571150374697-36a0935e7736?w=1000&q=85&fit=crop&ar=2:3,https://www.incredibleitinerary.com/blog/mont-saint-michel-2-days,"Don't make these mistakes on your Mont Saint-Michel trip. Best time to visit, where to stay, what to eat & the tourist traps to avoid. Real traveller tips from our free guide.  #MontSaint-MichelTravel #MontSaint-Michel #FranceTravel #TravelGuide #TravelItinerary #WorldTravel #TripPlanning #TravelBlog #TravelTips #TravelHacks",Europe Travel Guides
The Perfect 2-Day Mont Saint-Michel Itinerary (2026),https://images.unsplash.com/photo-1571150374697-36a0935e7736?w=1000&q=85&fit=crop&ar=2:3,https://www.incredibleitinerary.com/blog/mont-saint-michel-2-days,"Day-by-day Mont Saint-Michel plan with 4 travel styles — budget, couple, adventure & family. Real costs, real routes, real tips from IncredibleItinerary. Plan smarter, travel better!  Rising from the sea at high tide, empty at dawn before the tour buses — Mont Saint-Michel is one of France's great wonders. The abbey, the bay crossing with a guide, and where to stay on the island.  #MontSaint-MichelTravel #MontSaint-Michel #FranceTravel #TravelGuide #TravelItinerary #WorldTravel #TripPlanning…",Europe Travel Guides
Strasbourg in 3 Days — Complete Guide from $50/day,https://images.unsplash.com/photo-1574857552823-a5f3adcef547?w=1000&q=85&fit=crop&ar=2:3,https://www.incredibleitinerary.com/blog/strasbourg-3-days,"Plan your Strasbourg trip with real prices. 3-day itinerary with budget, mid-range & luxury plans — hotel picks, Google Maps routes & insider tips. Free guide!  Half-timbered houses reflected in the canal at dawn, the Gothic cathedral's astronomical clock at noon, tarte flambée with Riesling — and the oldest Christmas market in France. Alsace done properly.  #StrasbourgTravel #Strasbourg #FranceTravel #TravelGuide #TravelItinerary #WorldTravel #TripPlanning #TravelBlog #BudgetTravel #TravelGuide",Europe Travel Guides
3 Things to Know Before Visiting Strasbourg (2026),https://images.unsplash.com/photo-1574857552823-a5f3adcef547?w=1000&q=85&fit=crop&ar=2:3,https://www.incredibleitinerary.com/blog/strasbourg-3-days,"Don't make these mistakes on your Strasbourg trip. Best time to visit, where to stay, what to eat & the tourist traps to avoid. Real traveller tips from our free guide.  #StrasbourgTravel #Strasbourg #FranceTravel #TravelGuide #TravelItinerary #WorldTravel #TripPlanning #TravelBlog #TravelTips #TravelHacks",Europe Travel Guides
The Perfect 3-Day Strasbourg Itinerary (2026),https://images.unsplash.com/photo-1574857552823-a5f3adcef547?w=1000&q=85&fit=crop&ar=2:3,https://www.incredibleitinerary.com/blog/strasbourg-3-days,"Day-by-day Strasbourg plan with 4 travel styles — budget, couple, adventure & family. Real costs, real routes, real tips from IncredibleItinerary. Plan smarter, travel better!  Half-timbered houses reflected in the canal at dawn, the Gothic cathedral's astronomical clock at noon, tarte flambée with Riesling — and the oldest Christmas market in France. Alsace done properly.  #StrasbourgTravel #Strasbourg #FranceTravel #TravelGuide #TravelItinerary #WorldTravel #TripPlanning #TravelBlog…",Europe Travel Guides
Marseille in 3 Days — Complete Guide from $50/day,https://images.unsplash.com/photo-1571366343168?w=1000&q=85&fit=crop&ar=2:3,https://www.incredibleitinerary.com/blog/marseille-3-days,"Plan your Marseille trip with real prices. 3-day itinerary with budget, mid-range & luxury plans — hotel picks, Google Maps routes & insider tips. Free guide!  France's oldest city — the Vieux-Port fish market at 7am, Notre-Dame de la Garde with panoramic views, Calanques National Park's limestone fjords by boat, and real bouillabaisse. Gritty, beautiful, unmissable.  #MarseilleTravel #Marseille #FranceTravel #TravelGuide #TravelItinerary #WorldTravel #TripPlanning #TravelBlog #BudgetTravel…",Europe Travel Guides
3 Things to Know Before Visiting Marseille (2026),https://images.unsplash.com/photo-1571366343168?w=1000&q=85&fit=crop&ar=2:3,https://www.incredibleitinerary.com/blog/marseille-3-days,"Don't make these mistakes on your Marseille trip. Best time to visit, where to stay, what to eat & the tourist traps to avoid. Real traveller tips from our free guide.  #MarseilleTravel #Marseille #FranceTravel #TravelGuide #TravelItinerary #WorldTravel #TripPlanning #TravelBlog #TravelTips #TravelHacks",Europe Travel Guides
The Perfect 3-Day Marseille Itinerary (2026),https://images.unsplash.com/photo-1571366343168?w=1000&q=85&fit=crop&ar=2:3,https://www.incredibleitinerary.com/blog/marseille-3-days,"Day-by-day Marseille plan with 4 travel styles — budget, couple, adventure & family. Real costs, real routes, real tips from IncredibleItinerary. Plan smarter, travel better!  France's oldest city — the Vieux-Port fish market at 7am, Notre-Dame de la Garde with panoramic views, Calanques National Park's limestone fjords by boat, and real bouillabaisse. Gritty, beautiful, unmissable.  #MarseilleTravel #Marseille #FranceTravel #TravelGuide #TravelItinerary #WorldTravel #TripPlanning #TravelBlog…",Europe Travel Guides
New York City in 5 Days — Complete Guide from $50/day,https://images.unsplash.com/photo-1496442226666-8d4d0e62e6e9?w=1000&q=85&fit=crop&ar=2:3,https://www.incredibleitinerary.com/blog/new-york-5-days,"Plan your New York City trip with real prices. 5-day itinerary with budget, mid-range & luxury plans — hotel picks, Google Maps routes & insider tips. Free guide!  Central Park at dawn, Brooklyn Bridge walk, Statue of Liberty, the High Line, world's best pizza — NYC in 5 days done properly. Real budgets, skip-the-line tips, and what to skip entirely.  #NewYorkCityTravel #NewYorkCity #USATravel #TravelGuide #TravelItinerary #WorldTravel #TripPlanning #TravelBlog #BudgetTravel #TravelGuide",Travel Guides & Itineraries
5 Things to Know Before Visiting New York City (2026),https://images.unsplash.com/photo-1496442226666-8d4d0e62e6e9?w=1000&q=85&fit=crop&ar=2:3,https://www.incredibleitinerary.com/blog/new-york-5-days,"Don't make these mistakes on your New York City trip. Best time to visit, where to stay, what to eat & the tourist traps to avoid. Real traveller tips from our free guide.  #NewYorkCityTravel #NewYorkCity #USATravel #TravelGuide #TravelItinerary #WorldTravel #TripPlanning #TravelBlog #TravelTips #TravelHacks",Travel Guides & Itineraries
The Perfect 5-Day New York City Itinerary (2026),https://images.unsplash.com/photo-1496442226666-8d4d0e62e6e9?w=1000&q=85&fit=crop&ar=2:3,https://www.incredibleitinerary.com/blog/new-york-5-days,"Day-by-day New York City plan with 4 travel styles — budget, couple, adventure & family. Real costs, real routes, real tips from IncredibleItinerary. Plan smarter, travel better!  Central Park at dawn, Brooklyn Bridge walk, Statue of Liberty, the High Line, world's best pizza — NYC in 5 days done properly. Real budgets, skip-the-line tips, and what to skip entirely.  #NewYorkCityTravel #NewYorkCity #USATravel #TravelGuide #TravelItinerary #WorldTravel #TripPlanning #TravelBlog…",Travel Guides & Itineraries
Los Angeles in 5 Days — Complete Guide from $50/day,https://images.unsplash.com/photo-1534190760961-74e8c1c5c3da?w=1000&q=85&fit=crop&ar=2:3,https://www.incredibleitinerary.com/blog/los-angeles-5-days,"Plan your Los Angeles trip with real prices. 5-day itinerary with budget, mid-range & luxury plans — hotel picks, Google Maps routes & insider tips. Free guide!  The Hollywood sign from Griffith Observatory, Venice Beach boardwalk at dawn, Malibu's Pacific Coast Highway, tacos from Mariscos Jalisco — LA done with a car and local knowledge.  #LosAngelesTravel #LosAngeles #USATravel #TravelGuide #TravelItinerary #WorldTravel #TripPlanning #TravelBlog #BudgetTravel #TravelGuide",Travel Guides & Itineraries
5 Things to Know Before Visiting Los Angeles (2026),https://images.unsplash.com/photo-1534190760961-74e8c1c5c3da?w=1000&q=85&fit=crop&ar=2:3,https://www.incredibleitinerary.com/blog/los-angeles-5-days,"Don't make these mistakes on your Los Angeles trip. Best time to visit, where to stay, what to eat & the tourist traps to avoid. Real traveller tips from our free guide.  #LosAngelesTravel #LosAngeles #USATravel #TravelGuide #TravelItinerary #WorldTravel #TripPlanning #TravelBlog #TravelTips #TravelHacks",Travel Guides & Itineraries
The Perfect 5-Day Los Angeles Itinerary (2026),https://images.unsplash.com/photo-1534190760961-74e8c1c5c3da?w=1000&q=85&fit=crop&ar=2:3,https://www.incredibleitinerary.com/blog/los-angeles-5-days,"Day-by-day Los Angeles plan with 4 travel styles — budget, couple, adventure & family. Real costs, real routes, real tips from IncredibleItinerary. Plan smarter, travel better!  The Hollywood sign from Griffith Observatory, Venice Beach boardwalk at dawn, Malibu's Pacific Coast Highway, tacos from Mariscos Jalisco — LA done with a car and local knowledge.  #LosAngelesTravel #LosAngeles #USATravel #TravelGuide #TravelItinerary #WorldTravel #TripPlanning #TravelBlog #LosAngelesItinerary…",Travel Guides & Itineraries
Hawaii in 7 Days — Complete Guide from $50/day,https://images.unsplash.com/photo-1507525428034-b723cf961d3e?w=1000&q=85&fit=crop&ar=2:3,https://www.incredibleitinerary.com/blog/hawaii-7-days,"Plan your Hawaii trip with real prices. 7-day itinerary with budget, mid-range & luxury plans — hotel picks, Google Maps routes & insider tips. Free guide!  Diamond Head at sunrise, Road to Hana's 30+ waterfalls, Haleakala crater, Hanauma Bay snorkeling, Pearl Harbor — Hawaii in 7 days with real costs, island-hopping logistics, and the permits that sell out months ahead.  #HawaiiTravel #Hawaii #USATravel #TravelGuide #TravelItinerary #WorldTravel #TripPlanning #TravelBlog #BudgetTravel…",Travel Guides & Itineraries
7 Things to Know Before Visiting Hawaii (2026),https://images.unsplash.com/photo-1507525428034-b723cf961d3e?w=1000&q=85&fit=crop&ar=2:3,https://www.incredibleitinerary.com/blog/hawaii-7-days,"Don't make these mistakes on your Hawaii trip. Best time to visit, where to stay, what to eat & the tourist traps to avoid. Real traveller tips from our free guide.  #HawaiiTravel #Hawaii #USATravel #TravelGuide #TravelItinerary #WorldTravel #TripPlanning #TravelBlog #TravelTips #TravelHacks",Travel Guides & Itineraries
The Perfect 7-Day Hawaii Itinerary (2026),https://images.unsplash.com/photo-1507525428034-b723cf961d3e?w=1000&q=85&fit=crop&ar=2:3,https://www.incredibleitinerary.com/blog/hawaii-7-days,"Day-by-day Hawaii plan with 4 travel styles — budget, couple, adventure & family. Real costs, real routes, real tips from IncredibleItinerary. Plan smarter, travel better!  Diamond Head at sunrise, Road to Hana's 30+ waterfalls, Haleakala crater, Hanauma Bay snorkeling, Pearl Harbor — Hawaii in 7 days with real costs, island-hopping logistics, and the permits that sell out months ahead.  #HawaiiTravel #Hawaii #USATravel #TravelGuide #TravelItinerary #WorldTravel #TripPlanning #TravelBlog…",Travel Guides & Itineraries
Las Vegas in 4 Days — Complete Guide from $50/day,https://images.unsplash.com/photo-1605833556294-ea5c7a74f57d?w=1000&q=85&fit=crop&ar=2:3,https://www.incredibleitinerary.com/blog/las-vegas-4-days,"Plan your Las Vegas trip with real prices. 4-day itinerary with budget, mid-range & luxury plans — hotel picks, Google Maps routes & insider tips. Free guide!  Bellagio fountains free every 15 minutes, Fremont Street light shows nightly, Grand Canyon 4.5 hours away — Las Vegas on every budget. Resort fees, buffet hacks, and the shows worth paying for.  #LasVegasTravel #LasVegas #USATravel #TravelGuide #TravelItinerary #WorldTravel #TripPlanning #TravelBlog #BudgetTravel #TravelGuide",Travel Guides & Itineraries
4 Things to Know Before Visiting Las Vegas (2026),https://images.unsplash.com/photo-1605833556294-ea5c7a74f57d?w=1000&q=85&fit=crop&ar=2:3,https://www.incredibleitinerary.com/blog/las-vegas-4-days,"Don't make these mistakes on your Las Vegas trip. Best time to visit, where to stay, what to eat & the tourist traps to avoid. Real traveller tips from our free guide.  #LasVegasTravel #LasVegas #USATravel #TravelGuide #TravelItinerary #WorldTravel #TripPlanning #TravelBlog #TravelTips #TravelHacks",Travel Guides & Itineraries
The Perfect 4-Day Las Vegas Itinerary (2026),https://images.unsplash.com/photo-1605833556294-ea5c7a74f57d?w=1000&q=85&fit=crop&ar=2:3,https://www.incredibleitinerary.com/blog/las-vegas-4-days,"Day-by-day Las Vegas plan with 4 travel styles — budget, couple, adventure & family. Real costs, real routes, real tips from IncredibleItinerary. Plan smarter, travel better!  Bellagio fountains free every 15 minutes, Fremont Street light shows nightly, Grand Canyon 4.5 hours away — Las Vegas on every budget. Resort fees, buffet hacks, and the shows worth paying for.  #LasVegasTravel #LasVegas #USATravel #TravelGuide #TravelItinerary #WorldTravel #TripPlanning #TravelBlog #LasVegasItinerary…",Travel Guides & Itineraries
Miami in 4 Days — Complete Guide from $50/day,https://images.unsplash.com/photo-ZFXrgzHu1KU?w=1000&q=85&fit=crop&ar=2:3,https://www.incredibleitinerary.com/blog/miami-4-days,"Plan your Miami trip with real prices. 4-day itinerary with budget, mid-range & luxury plans — hotel picks, Google Maps routes & insider tips. Free guide!  Art Deco Ocean Drive, Wynwood murals, café cubano for $1 in Little Havana, airboat rides through the Everglades — Miami in 4 days with real prices and the best time to visit.  #MiamiTravel #Miami #USATravel #TravelGuide #TravelItinerary #WorldTravel #TripPlanning #TravelBlog #BudgetTravel #TravelGuide",Travel Guides & Itineraries
4 Things to Know Before Visiting Miami (2026),https://images.unsplash.com/photo-ZFXrgzHu1KU?w=1000&q=85&fit=crop&ar=2:3,https://www.incredibleitinerary.com/blog/miami-4-days,"Don't make these mistakes on your Miami trip. Best time to visit, where to stay, what to eat & the tourist traps to avoid. Real traveller tips from our free guide.  #MiamiTravel #Miami #USATravel #TravelGuide #TravelItinerary #WorldTravel #TripPlanning #TravelBlog #TravelTips #TravelHacks",Travel Guides & Itineraries
