Title,Media URL,Link,Description,Pinterest board
Vientiane in 3 Days — Complete Guide from $50/day,https://images.unsplash.com/photo-1566651236484?w=1000&q=85&fit=crop&ar=2:3,https://www.incredibleitinerary.com/blog/vientiane-3-days,"Plan your Vientiane trip with real prices. 3-day itinerary with budget, mid-range & luxury plans — hotel picks, Google Maps routes & insider tips. Free guide!  Watching the golden stupa that is the national symbol of Laos turn copper in the late afternoon sun, wandering a surrealist sculpture garden where a giant pumpkin contains rooms dedicated to heaven, earth, and hell, and sitting on a plastic chair on the Mekong with a Beer Lao while the sky turns every shade of orange simultaneously. …",Travel Guides & Itineraries
3 Things to Know Before Visiting Vientiane (2026),https://images.unsplash.com/photo-1566651236484?w=1000&q=85&fit=crop&ar=2:3,https://www.incredibleitinerary.com/blog/vientiane-3-days,"Don't make these mistakes on your Vientiane trip. Best time to visit, where to stay, what to eat & the tourist traps to avoid. Real traveller tips from our free guide.  #VientianeTravel #Vientiane #LaosTravel #TravelGuide #TravelItinerary #WorldTravel #TripPlanning #TravelBlog #TravelTips #TravelHacks",Travel Guides & Itineraries
The Perfect 3-Day Vientiane Itinerary (2026),https://images.unsplash.com/photo-1566651236484?w=1000&q=85&fit=crop&ar=2:3,https://www.incredibleitinerary.com/blog/vientiane-3-days,"Day-by-day Vientiane plan with 4 travel styles — budget, couple, adventure & family. Real costs, real routes, real tips from IncredibleItinerary. Plan smarter, travel better!  Watching the golden stupa that is the national symbol of Laos turn copper in the late afternoon sun, wandering a surrealist sculpture garden where a giant pumpkin contains rooms dedicated to heaven, earth, and hell, and sitting on a plastic chair on the Mekong with a Beer Lao while the sky turns every shade of orange…",Travel Guides & Itineraries
Havana in 4 Days — Complete Guide from $50/day,https://images.unsplash.com/photo-1553494664-2f5b79a98b23?w=1000&q=85&fit=crop&ar=2:3,https://www.incredibleitinerary.com/blog/havana-cuba-4-days,"Plan your Havana trip with real prices. 4-day itinerary with budget, mid-range & luxury plans — hotel picks, Google Maps routes & insider tips. Free guide!  Riding in a 1957 Chevrolet convertible along a seawall where waves crash over the road, drinking a frozen daiquiri at the bar Hemingway drank at every day for 20 years, watching a salsa dancer spin in a doorway to music that seems to come from every building simultaneously, and driving through a tobacco valley so unchanged it looks like a…",Travel Guides & Itineraries
4 Things to Know Before Visiting Havana (2026),https://images.unsplash.com/photo-1553494664-2f5b79a98b23?w=1000&q=85&fit=crop&ar=2:3,https://www.incredibleitinerary.com/blog/havana-cuba-4-days,"Don't make these mistakes on your Havana trip. Best time to visit, where to stay, what to eat & the tourist traps to avoid. Real traveller tips from our free guide.  #HavanaTravel #Havana #CubaTravel #TravelGuide #TravelItinerary #WorldTravel #TripPlanning #TravelBlog #TravelTips #TravelHacks",Travel Guides & Itineraries
The Perfect 4-Day Havana Itinerary (2026),https://images.unsplash.com/photo-1553494664-2f5b79a98b23?w=1000&q=85&fit=crop&ar=2:3,https://www.incredibleitinerary.com/blog/havana-cuba-4-days,"Day-by-day Havana plan with 4 travel styles — budget, couple, adventure & family. Real costs, real routes, real tips from IncredibleItinerary. Plan smarter, travel better!  Riding in a 1957 Chevrolet convertible along a seawall where waves crash over the road, drinking a frozen daiquiri at the bar Hemingway drank at every day for 20 years, watching a salsa dancer spin in a doorway to music that seems to come from every building simultaneously, and driving through a tobacco valley so unchanged…",Travel Guides & Itineraries