Title,Media URL,Link,Description,Pinterest board
The Perfect 7-Day Kenya Itinerary (2026),https://images.unsplash.com/photo-1516426122078-c23e76319801?w=1000&q=85&fit=crop&ar=2:3,https://www.incredibleitinerary.com/blog/kenya-safari-7-days,"Day-by-day Kenya plan with 4 travel styles — budget, couple, adventure & family. Real costs, real routes, real tips from IncredibleItinerary. Plan smarter, travel better!  Elephants against Kilimanjaro at dawn in Amboseli, a million wildebeest crossing the Mara River, baby elephants at David Sheldrick orphanage — the East Africa safari most people dream about.  #KenyaTravel #Kenya #TravelGuide #TravelItinerary #WorldTravel #TripPlanning #TravelBlog #Africa #KenyaItinerary #TripPlanning",Travel Guides & Itineraries
Tanzania in 7 Days — Complete Guide from $50/day,https://images.unsplash.com/photo-1534177616072-ef7dc120449d?w=1000&q=85&fit=crop&ar=2:3,https://www.incredibleitinerary.com/blog/tanzania-zanzibar-7-days,"Plan your Tanzania trip with real prices. 7-day itinerary with budget, mid-range & luxury plans — hotel picks, Google Maps routes & insider tips. Free guide!  25,000 animals inside a single volcanic crater, elephants silhouetted against Kilimanjaro at dawn, then three days on Zanzibar's white-sand Indian Ocean beaches. East Africa's greatest journey.  #TanzaniaTravel #Tanzania #TravelGuide #TravelItinerary #WorldTravel #TripPlanning #TravelBlog #Africa #BudgetTravel #TravelGuide",Travel Guides & Itineraries
7 Things to Know Before Visiting Tanzania (2026),https://images.unsplash.com/photo-1534177616072-ef7dc120449d?w=1000&q=85&fit=crop&ar=2:3,https://www.incredibleitinerary.com/blog/tanzania-zanzibar-7-days,"Don't make these mistakes on your Tanzania trip. Best time to visit, where to stay, what to eat & the tourist traps to avoid. Real traveller tips from our free guide.  #TanzaniaTravel #Tanzania #TravelGuide #TravelItinerary #WorldTravel #TripPlanning #TravelBlog #Africa #TravelTips #TravelHacks",Travel Guides & Itineraries
The Perfect 7-Day Tanzania Itinerary (2026),https://images.unsplash.com/photo-1534177616072-ef7dc120449d?w=1000&q=85&fit=crop&ar=2:3,https://www.incredibleitinerary.com/blog/tanzania-zanzibar-7-days,"Day-by-day Tanzania plan with 4 travel styles — budget, couple, adventure & family. Real costs, real routes, real tips from IncredibleItinerary. Plan smarter, travel better!  25,000 animals inside a single volcanic crater, elephants silhouetted against Kilimanjaro at dawn, then three days on Zanzibar's white-sand Indian Ocean beaches. East Africa's greatest journey.  #TanzaniaTravel #Tanzania #TravelGuide #TravelItinerary #WorldTravel #TripPlanning #TravelBlog #Africa #TanzaniaItinerary…",Travel Guides & Itineraries
Cape Town in 5 Days — Complete Guide from $50/day,https://images.unsplash.com/photo-1580060839134-75a5edca2e99?w=1000&q=85&fit=crop&ar=2:3,https://www.incredibleitinerary.com/blog/cape-town-5-days,"Plan your Cape Town trip with real prices. 5-day itinerary with budget, mid-range & luxury plans — hotel picks, Google Maps routes & insider tips. Free guide!  Table Mountain at sunrise, penguin colonies at Boulders Beach, wine tasting in Franschhoek's valley, and the cell where Nelson Mandela spent 18 years. South Africa's most beautiful city in 5 days.  #CapeTownTravel #CapeTown #SouthAfricaTravel #TravelGuide #TravelItinerary #WorldTravel #TripPlanning #TravelBlog #BudgetTravel #TravelGuide",Travel Guides & Itineraries
5 Things to Know Before Visiting Cape Town (2026),https://images.unsplash.com/photo-1580060839134-75a5edca2e99?w=1000&q=85&fit=crop&ar=2:3,https://www.incredibleitinerary.com/blog/cape-town-5-days,"Don't make these mistakes on your Cape Town trip. Best time to visit, where to stay, what to eat & the tourist traps to avoid. Real traveller tips from our free guide.  #CapeTownTravel #CapeTown #SouthAfricaTravel #TravelGuide #TravelItinerary #WorldTravel #TripPlanning #TravelBlog #TravelTips #TravelHacks",Travel Guides & Itineraries
The Perfect 5-Day Cape Town Itinerary (2026),https://images.unsplash.com/photo-1580060839134-75a5edca2e99?w=1000&q=85&fit=crop&ar=2:3,https://www.incredibleitinerary.com/blog/cape-town-5-days,"Day-by-day Cape Town plan with 4 travel styles — budget, couple, adventure & family. Real costs, real routes, real tips from IncredibleItinerary. Plan smarter, travel better!  Table Mountain at sunrise, penguin colonies at Boulders Beach, wine tasting in Franschhoek's valley, and the cell where Nelson Mandela spent 18 years. South Africa's most beautiful city in 5 days.  #CapeTownTravel #CapeTown #SouthAfricaTravel #TravelGuide #TravelItinerary #WorldTravel #TripPlanning #TravelBlog…",Travel Guides & Itineraries
Peru in 7 Days — Complete Guide from $50/day,https://images.unsplash.com/photo-1587595431973-160d0d94add1?w=1000&q=85&fit=crop&ar=2:3,https://www.incredibleitinerary.com/blog/peru-machu-picchu-7-days,"Plan your Peru trip with real prices. 7-day itinerary with budget, mid-range & luxury plans — hotel picks, Google Maps routes & insider tips. Free guide!  Machu Picchu at first light with no crowds, Cusco's Inca stonework, Ollantaytambo fortress at sunset, and Lima's ceviche that is genuinely world-class. 7 days of South America's greatest journey.  #PeruTravel #Peru #TravelGuide #TravelItinerary #WorldTravel #TripPlanning #TravelBlog #SouthAmerica #BudgetTravel #TravelGuide",Travel Guides & Itineraries
7 Things to Know Before Visiting Peru (2026),https://images.unsplash.com/photo-1587595431973-160d0d94add1?w=1000&q=85&fit=crop&ar=2:3,https://www.incredibleitinerary.com/blog/peru-machu-picchu-7-days,"Don't make these mistakes on your Peru trip. Best time to visit, where to stay, what to eat & the tourist traps to avoid. Real traveller tips from our free guide.  #PeruTravel #Peru #TravelGuide #TravelItinerary #WorldTravel #TripPlanning #TravelBlog #SouthAmerica #TravelTips #TravelHacks",Travel Guides & Itineraries
The Perfect 7-Day Peru Itinerary (2026),https://images.unsplash.com/photo-1587595431973-160d0d94add1?w=1000&q=85&fit=crop&ar=2:3,https://www.incredibleitinerary.com/blog/peru-machu-picchu-7-days,"Day-by-day Peru plan with 4 travel styles — budget, couple, adventure & family. Real costs, real routes, real tips from IncredibleItinerary. Plan smarter, travel better!  Machu Picchu at first light with no crowds, Cusco's Inca stonework, Ollantaytambo fortress at sunset, and Lima's ceviche that is genuinely world-class. 7 days of South America's greatest journey.  #PeruTravel #Peru #TravelGuide #TravelItinerary #WorldTravel #TripPlanning #TravelBlog #SouthAmerica #PeruItinerary #TripPlanning",Travel Guides & Itineraries
Rio de Janeiro in 5 Days — Complete Guide from $50/day,https://images.unsplash.com/photo-1483729558449-99ef09a8c325?w=1000&q=85&fit=crop&ar=2:3,https://www.incredibleitinerary.com/blog/rio-de-janeiro-5-days,"Plan your Rio de Janeiro trip with real prices. 5-day itinerary with budget, mid-range & luxury plans — hotel picks, Google Maps routes & insider tips. Free guide!  Christ the Redeemer at dawn, Sugarloaf at sunset, samba in Lapa, favela art murals, and Ipanema beach — Rio in 5 days, safety tips included, Carnival planning guide if that's your timing.  #RiodeJaneiroTravel #RiodeJaneiro #BrazilTravel #TravelGuide #TravelItinerary #WorldTravel #TripPlanning #TravelBlog #BudgetTravel #TravelGuide",Travel Guides & Itineraries
5 Things to Know Before Visiting Rio de Janeiro (2026),https://images.unsplash.com/photo-1483729558449-99ef09a8c325?w=1000&q=85&fit=crop&ar=2:3,https://www.incredibleitinerary.com/blog/rio-de-janeiro-5-days,"Don't make these mistakes on your Rio de Janeiro trip. Best time to visit, where to stay, what to eat & the tourist traps to avoid. Real traveller tips from our free guide.  #RiodeJaneiroTravel #RiodeJaneiro #BrazilTravel #TravelGuide #TravelItinerary #WorldTravel #TripPlanning #TravelBlog #TravelTips #TravelHacks",Travel Guides & Itineraries
The Perfect 5-Day Rio de Janeiro Itinerary (2026),https://images.unsplash.com/photo-1483729558449-99ef09a8c325?w=1000&q=85&fit=crop&ar=2:3,https://www.incredibleitinerary.com/blog/rio-de-janeiro-5-days,"Day-by-day Rio de Janeiro plan with 4 travel styles — budget, couple, adventure & family. Real costs, real routes, real tips from IncredibleItinerary. Plan smarter, travel better!  Christ the Redeemer at dawn, Sugarloaf at sunset, samba in Lapa, favela art murals, and Ipanema beach — Rio in 5 days, safety tips included, Carnival planning guide if that's your timing.  #RiodeJaneiroTravel #RiodeJaneiro #BrazilTravel #TravelGuide #TravelItinerary #WorldTravel #TripPlanning #TravelBlog…",Travel Guides & Itineraries
Amsterdam in 4 Days — Complete Guide from $50/day,https://images.unsplash.com/photo-1534351590666-13e3e96b5017?w=1000&q=85&fit=crop&ar=2:3,https://www.incredibleitinerary.com/blog/amsterdam-4-days,"Plan your Amsterdam trip with real prices. 4-day itinerary with budget, mid-range & luxury plans — hotel picks, Google Maps routes & insider tips. Free guide!  Anne Frank House booked months ahead, Rembrandt's Night Watch at 8am, 7 million tulips at Keukenhof, and a canal boat at golden hour — Amsterdam in 4 days with a local's knowledge.  #AmsterdamTravel #Amsterdam #NetherlandsTravel #TravelGuide #TravelItinerary #WorldTravel #TripPlanning #TravelBlog #BudgetTravel #TravelGuide",Europe Travel Guides
4 Things to Know Before Visiting Amsterdam (2026),https://images.unsplash.com/photo-1534351590666-13e3e96b5017?w=1000&q=85&fit=crop&ar=2:3,https://www.incredibleitinerary.com/blog/amsterdam-4-days,"Don't make these mistakes on your Amsterdam trip. Best time to visit, where to stay, what to eat & the tourist traps to avoid. Real traveller tips from our free guide.  #AmsterdamTravel #Amsterdam #NetherlandsTravel #TravelGuide #TravelItinerary #WorldTravel #TripPlanning #TravelBlog #TravelTips #TravelHacks",Europe Travel Guides
The Perfect 4-Day Amsterdam Itinerary (2026),https://images.unsplash.com/photo-1534351590666-13e3e96b5017?w=1000&q=85&fit=crop&ar=2:3,https://www.incredibleitinerary.com/blog/amsterdam-4-days,"Day-by-day Amsterdam plan with 4 travel styles — budget, couple, adventure & family. Real costs, real routes, real tips from IncredibleItinerary. Plan smarter, travel better!  Anne Frank House booked months ahead, Rembrandt's Night Watch at 8am, 7 million tulips at Keukenhof, and a canal boat at golden hour — Amsterdam in 4 days with a local's knowledge.  #AmsterdamTravel #Amsterdam #NetherlandsTravel #TravelGuide #TravelItinerary #WorldTravel #TripPlanning #TravelBlog #AmsterdamItinerary…",Europe Travel Guides
Germany in 7 Days — Complete Guide from $50/day,https://images.unsplash.com/photo-1467269204594-9661b134dd2b?w=1000&q=85&fit=crop&ar=2:3,https://www.incredibleitinerary.com/blog/germany-7-days,"Plan your Germany trip with real prices. 7-day itinerary with budget, mid-range & luxury plans — hotel picks, Google Maps routes & insider tips. Free guide!  Bavaria's fairy-tale castle, the world's most perfect medieval walled city, Cologne Cathedral, and Berlin's East Side Gallery — Germany's greatest hits in 7 days by train.  #GermanyTravel #Germany #TravelGuide #TravelItinerary #WorldTravel #TripPlanning #TravelBlog #Europe #BudgetTravel #TravelGuide",Europe Travel Guides
7 Things to Know Before Visiting Germany (2026),https://images.unsplash.com/photo-1467269204594-9661b134dd2b?w=1000&q=85&fit=crop&ar=2:3,https://www.incredibleitinerary.com/blog/germany-7-days,"Don't make these mistakes on your Germany trip. Best time to visit, where to stay, what to eat & the tourist traps to avoid. Real traveller tips from our free guide.  #GermanyTravel #Germany #TravelGuide #TravelItinerary #WorldTravel #TripPlanning #TravelBlog #Europe #TravelTips #TravelHacks",Europe Travel Guides
The Perfect 7-Day Germany Itinerary (2026),https://images.unsplash.com/photo-1467269204594-9661b134dd2b?w=1000&q=85&fit=crop&ar=2:3,https://www.incredibleitinerary.com/blog/germany-7-days,"Day-by-day Germany plan with 4 travel styles — budget, couple, adventure & family. Real costs, real routes, real tips from IncredibleItinerary. Plan smarter, travel better!  Bavaria's fairy-tale castle, the world's most perfect medieval walled city, Cologne Cathedral, and Berlin's East Side Gallery — Germany's greatest hits in 7 days by train.  #GermanyTravel #Germany #TravelGuide #TravelItinerary #WorldTravel #TripPlanning #TravelBlog #Europe #GermanyItinerary #TripPlanning",Europe Travel Guides
Prague in 4 Days — Complete Guide from $50/day,https://images.unsplash.com/photo-1541849546-216549ae216d?w=1000&q=85&fit=crop&ar=2:3,https://www.incredibleitinerary.com/blog/prague-4-days,"Plan your Prague trip with real prices. 4-day itinerary with budget, mid-range & luxury plans — hotel picks, Google Maps routes & insider tips. Free guide!  Charles Bridge at 5:30am with mist rising over the Vltava, Prague Castle complex the largest in the world, the Bone Church at Kutná Hora, and €1.50 pints — Europe's most beautiful city.  #PragueTravel #Prague #CzechRepublicTravel #TravelGuide #TravelItinerary #WorldTravel #TripPlanning #TravelBlog #BudgetTravel #TravelGuide",Europe Travel Guides
4 Things to Know Before Visiting Prague (2026),https://images.unsplash.com/photo-1541849546-216549ae216d?w=1000&q=85&fit=crop&ar=2:3,https://www.incredibleitinerary.com/blog/prague-4-days,"Don't make these mistakes on your Prague trip. Best time to visit, where to stay, what to eat & the tourist traps to avoid. Real traveller tips from our free guide.  #PragueTravel #Prague #CzechRepublicTravel #TravelGuide #TravelItinerary #WorldTravel #TripPlanning #TravelBlog #TravelTips #TravelHacks",Europe Travel Guides
The Perfect 4-Day Prague Itinerary (2026),https://images.unsplash.com/photo-1541849546-216549ae216d?w=1000&q=85&fit=crop&ar=2:3,https://www.incredibleitinerary.com/blog/prague-4-days,"Day-by-day Prague plan with 4 travel styles — budget, couple, adventure & family. Real costs, real routes, real tips from IncredibleItinerary. Plan smarter, travel better!  Charles Bridge at 5:30am with mist rising over the Vltava, Prague Castle complex the largest in the world, the Bone Church at Kutná Hora, and €1.50 pints — Europe's most beautiful city.  #PragueTravel #Prague #CzechRepublicTravel #TravelGuide #TravelItinerary #WorldTravel #TripPlanning #TravelBlog #PragueItinerary…",Europe Travel Guides
Budapest in 4 Days — Complete Guide from $50/day,https://images.unsplash.com/photo-1551867633-194f125bddfa?w=1000&q=85&fit=crop&ar=2:3,https://www.incredibleitinerary.com/blog/budapest-4-days,"Plan your Budapest trip with real prices. 4-day itinerary with budget, mid-range & luxury plans — hotel picks, Google Maps routes & insider tips. Free guide!  Széchenyi Baths at night in the golden steam, Parliament lit up across the Danube, Szimpla Kert ruin bar, and goulash for €4 — Budapest is Europe's most underrated great city.  #BudapestTravel #Budapest #HungaryTravel #TravelGuide #TravelItinerary #WorldTravel #TripPlanning #TravelBlog #BudgetTravel #TravelGuide",Europe Travel Guides
4 Things to Know Before Visiting Budapest (2026),https://images.unsplash.com/photo-1551867633-194f125bddfa?w=1000&q=85&fit=crop&ar=2:3,https://www.incredibleitinerary.com/blog/budapest-4-days,"Don't make these mistakes on your Budapest trip. Best time to visit, where to stay, what to eat & the tourist traps to avoid. Real traveller tips from our free guide.  #BudapestTravel #Budapest #HungaryTravel #TravelGuide #TravelItinerary #WorldTravel #TripPlanning #TravelBlog #TravelTips #TravelHacks",Europe Travel Guides
The Perfect 4-Day Budapest Itinerary (2026),https://images.unsplash.com/photo-1551867633-194f125bddfa?w=1000&q=85&fit=crop&ar=2:3,https://www.incredibleitinerary.com/blog/budapest-4-days,"Day-by-day Budapest plan with 4 travel styles — budget, couple, adventure & family. Real costs, real routes, real tips from IncredibleItinerary. Plan smarter, travel better!  Széchenyi Baths at night in the golden steam, Parliament lit up across the Danube, Szimpla Kert ruin bar, and goulash for €4 — Budapest is Europe's most underrated great city.  #BudapestTravel #Budapest #HungaryTravel #TravelGuide #TravelItinerary #WorldTravel #TripPlanning #TravelBlog #BudapestItinerary #TripPlanning",Europe Travel Guides
Vienna in 4 Days — Complete Guide from $50/day,https://images.unsplash.com/photo-1516550893923-42d28e5677af?w=1000&q=85&fit=crop&ar=2:3,https://www.incredibleitinerary.com/blog/vienna-4-days,"Plan your Vienna trip with real prices. 4-day itinerary with budget, mid-range & luxury plans — hotel picks, Google Maps routes & insider tips. Free guide!  Standing tickets at the Vienna State Opera for €3, Schönbrunn Palace's 1,441 rooms, Naschmarkt's 120 market stalls, and a day trip to Salzburg's Sound of Music landscapes.  #ViennaTravel #Vienna #AustriaTravel #TravelGuide #TravelItinerary #WorldTravel #TripPlanning #TravelBlog #BudgetTravel #TravelGuide",Europe Travel Guides
4 Things to Know Before Visiting Vienna (2026),https://images.unsplash.com/photo-1516550893923-42d28e5677af?w=1000&q=85&fit=crop&ar=2:3,https://www.incredibleitinerary.com/blog/vienna-4-days,"Don't make these mistakes on your Vienna trip. Best time to visit, where to stay, what to eat & the tourist traps to avoid. Real traveller tips from our free guide.  #ViennaTravel #Vienna #AustriaTravel #TravelGuide #TravelItinerary #WorldTravel #TripPlanning #TravelBlog #TravelTips #TravelHacks",Europe Travel Guides
The Perfect 4-Day Vienna Itinerary (2026),https://images.unsplash.com/photo-1516550893923-42d28e5677af?w=1000&q=85&fit=crop&ar=2:3,https://www.incredibleitinerary.com/blog/vienna-4-days,"Day-by-day Vienna plan with 4 travel styles — budget, couple, adventure & family. Real costs, real routes, real tips from IncredibleItinerary. Plan smarter, travel better!  Standing tickets at the Vienna State Opera for €3, Schönbrunn Palace's 1,441 rooms, Naschmarkt's 120 market stalls, and a day trip to Salzburg's Sound of Music landscapes.  #ViennaTravel #Vienna #AustriaTravel #TravelGuide #TravelItinerary #WorldTravel #TripPlanning #TravelBlog #ViennaItinerary #TripPlanning",Europe Travel Guides
Seoul in 5 Days — Complete Guide from $50/day,https://images.unsplash.com/photo-1538485399081-7191377e8241?w=1000&q=85&fit=crop&ar=2:3,https://www.incredibleitinerary.com/blog/seoul-5-days,"Plan your Seoul trip with real prices. 5-day itinerary with budget, mid-range & luxury plans — hotel picks, Google Maps routes & insider tips. Free guide!  Gyeongbokgung Palace in hanbok at dawn, the DMZ's Joint Security Area one step from North Korea, Korean BBQ samgyeopsal, and the world's most advanced tech city — Seoul in 5 days.  #SeoulTravel #Seoul #SouthKoreaTravel #TravelGuide #TravelItinerary #WorldTravel #TripPlanning #TravelBlog #BudgetTravel #TravelGuide",Japan & East Asia Travel
5 Things to Know Before Visiting Seoul (2026),https://images.unsplash.com/photo-1538485399081-7191377e8241?w=1000&q=85&fit=crop&ar=2:3,https://www.incredibleitinerary.com/blog/seoul-5-days,"Don't make these mistakes on your Seoul trip. Best time to visit, where to stay, what to eat & the tourist traps to avoid. Real traveller tips from our free guide.  #SeoulTravel #Seoul #SouthKoreaTravel #TravelGuide #TravelItinerary #WorldTravel #TripPlanning #TravelBlog #TravelTips #TravelHacks",Japan & East Asia Travel
The Perfect 5-Day Seoul Itinerary (2026),https://images.unsplash.com/photo-1538485399081-7191377e8241?w=1000&q=85&fit=crop&ar=2:3,https://www.incredibleitinerary.com/blog/seoul-5-days,"Day-by-day Seoul plan with 4 travel styles — budget, couple, adventure & family. Real costs, real routes, real tips from IncredibleItinerary. Plan smarter, travel better!  Gyeongbokgung Palace in hanbok at dawn, the DMZ's Joint Security Area one step from North Korea, Korean BBQ samgyeopsal, and the world's most advanced tech city — Seoul in 5 days.  #SeoulTravel #Seoul #SouthKoreaTravel #TravelGuide #TravelItinerary #WorldTravel #TripPlanning #TravelBlog #SeoulItinerary #TripPlanning",Japan & East Asia Travel