Title,Media URL,Link,Description,Pinterest board
Dwarka in 2 Days — Complete Guide from ₹800/day,https://images.unsplash.com/photo-1638717768359-130b8a6e8935?w=1000&q=85&fit=crop&ar=2:3,https://www.incredibleitinerary.com/blog/dwarka-2-days,"Plan your Dwarka trip with real prices. 2-day itinerary with budget, mid-range & luxury plans — hotel picks, Google Maps routes & insider tips. Free guide!  Dawn aarti over the Arabian Sea, Bet Dwarka island frozen in time, and the underwater temple mystery of Krishna's sunken city.  #DwarkaTravel #Dwarka #IncredibleIndia #TravelGuide #TravelItinerary #IndiaTravel #TripPlanning #TravelBlog #BudgetTravel #TravelGuide",Spiritual India
2 Things to Know Before Visiting Dwarka (2026),https://images.unsplash.com/photo-1638717768359-130b8a6e8935?w=1000&q=85&fit=crop&ar=2:3,https://www.incredibleitinerary.com/blog/dwarka-2-days,"Don't make these mistakes on your Dwarka trip. Best time to visit, where to stay, what to eat & the tourist traps to avoid. Real traveller tips from our free guide.  #DwarkaTravel #Dwarka #IncredibleIndia #TravelGuide #TravelItinerary #IndiaTravel #TripPlanning #TravelBlog #TravelTips #TravelHacks",Spiritual India
The Perfect 2-Day Dwarka Itinerary (2026),https://images.unsplash.com/photo-1638717768359-130b8a6e8935?w=1000&q=85&fit=crop&ar=2:3,https://www.incredibleitinerary.com/blog/dwarka-2-days,"Day-by-day Dwarka plan with 4 travel styles — budget, couple, adventure & family. Real costs, real routes, real tips from IncredibleItinerary. Plan smarter, travel better!  Dawn aarti over the Arabian Sea, Bet Dwarka island frozen in time, and the underwater temple mystery of Krishna's sunken city.  #DwarkaTravel #Dwarka #IncredibleIndia #TravelGuide #TravelItinerary #IndiaTravel #TripPlanning #TravelBlog #DwarkaItinerary #TripPlanning",Spiritual India
Lonavala in 2 Days — Complete Guide from ₹800/day,https://images.unsplash.com/photo-1667108971575-c5d7acdabc5a?w=1000&q=85&fit=crop&ar=2:3,https://www.incredibleitinerary.com/blog/lonavala-2-days,"Plan your Lonavala trip with real prices. 2-day itinerary with budget, mid-range & luxury plans — hotel picks, Google Maps routes & insider tips. Free guide!  Mumbai's favourite weekend escape — Rajmachi Fort trek, 2,000-year-old Buddhist caves, and why monsoon Lonavala is a completely different destination.  #LonavalaTravel #Lonavala #IncredibleIndia #TravelGuide #TravelItinerary #IndiaTravel #TripPlanning #TravelBlog #BudgetTravel #TravelGuide",Himalayan Adventures
2 Things to Know Before Visiting Lonavala (2026),https://images.unsplash.com/photo-1667108971575-c5d7acdabc5a?w=1000&q=85&fit=crop&ar=2:3,https://www.incredibleitinerary.com/blog/lonavala-2-days,"Don't make these mistakes on your Lonavala trip. Best time to visit, where to stay, what to eat & the tourist traps to avoid. Real traveller tips from our free guide.  #LonavalaTravel #Lonavala #IncredibleIndia #TravelGuide #TravelItinerary #IndiaTravel #TripPlanning #TravelBlog #TravelTips #TravelHacks",Himalayan Adventures
The Perfect 2-Day Lonavala Itinerary (2026),https://images.unsplash.com/photo-1667108971575-c5d7acdabc5a?w=1000&q=85&fit=crop&ar=2:3,https://www.incredibleitinerary.com/blog/lonavala-2-days,"Day-by-day Lonavala plan with 4 travel styles — budget, couple, adventure & family. Real costs, real routes, real tips from IncredibleItinerary. Plan smarter, travel better!  Mumbai's favourite weekend escape — Rajmachi Fort trek, 2,000-year-old Buddhist caves, and why monsoon Lonavala is a completely different destination.  #LonavalaTravel #Lonavala #IncredibleIndia #TravelGuide #TravelItinerary #IndiaTravel #TripPlanning #TravelBlog #LonavalaItinerary #TripPlanning",Himalayan Adventures
Kaziranga in 3 Days — Complete Guide from ₹800/day,https://images.unsplash.com/photo-1670099355126-2561c8a08d7c?w=1000&q=85&fit=crop&ar=2:3,https://www.incredibleitinerary.com/blog/kaziranga-3-days,"Plan your Kaziranga trip with real prices. 3-day itinerary with budget, mid-range & luxury plans — hotel picks, Google Maps routes & insider tips. Free guide!  Two-thirds of the world's one-horned rhinos live here. Elephant safari at dawn in the Central Range is the single best wildlife experience in India.  #KazirangaTravel #Kaziranga #IncredibleIndia #TravelGuide #TravelItinerary #IndiaTravel #TripPlanning #TravelBlog #BudgetTravel #TravelGuide",Northeast India
3 Things to Know Before Visiting Kaziranga (2026),https://images.unsplash.com/photo-1670099355126-2561c8a08d7c?w=1000&q=85&fit=crop&ar=2:3,https://www.incredibleitinerary.com/blog/kaziranga-3-days,"Don't make these mistakes on your Kaziranga trip. Best time to visit, where to stay, what to eat & the tourist traps to avoid. Real traveller tips from our free guide.  #KazirangaTravel #Kaziranga #IncredibleIndia #TravelGuide #TravelItinerary #IndiaTravel #TripPlanning #TravelBlog #TravelTips #TravelHacks",Northeast India
The Perfect 3-Day Kaziranga Itinerary (2026),https://images.unsplash.com/photo-1670099355126-2561c8a08d7c?w=1000&q=85&fit=crop&ar=2:3,https://www.incredibleitinerary.com/blog/kaziranga-3-days,"Day-by-day Kaziranga plan with 4 travel styles — budget, couple, adventure & family. Real costs, real routes, real tips from IncredibleItinerary. Plan smarter, travel better!  Two-thirds of the world's one-horned rhinos live here. Elephant safari at dawn in the Central Range is the single best wildlife experience in India.  #KazirangaTravel #Kaziranga #IncredibleIndia #TravelGuide #TravelItinerary #IndiaTravel #TripPlanning #TravelBlog #KazirangaItinerary #TripPlanning",Northeast India
Shillong in 3 Days — Complete Guide from ₹800/day,https://images.unsplash.com/photo-1665551896704-b0f439e7087d?w=1000&q=85&fit=crop&ar=2:3,https://www.incredibleitinerary.com/blog/shillong-3-days,"Plan your Shillong trip with real prices. 3-day itinerary with budget, mid-range & luxury plans — hotel picks, Google Maps routes & insider tips. Free guide!  India's rock music capital, Laitlum Canyons at the end of the earth, 7-story tribal museum, and Mawphlang Sacred Forest where nothing has been removed for centuries.  #ShillongTravel #Shillong #IncredibleIndia #TravelGuide #TravelItinerary #IndiaTravel #TripPlanning #TravelBlog #BudgetTravel #TravelGuide",Northeast India
3 Things to Know Before Visiting Shillong (2026),https://images.unsplash.com/photo-1665551896704-b0f439e7087d?w=1000&q=85&fit=crop&ar=2:3,https://www.incredibleitinerary.com/blog/shillong-3-days,"Don't make these mistakes on your Shillong trip. Best time to visit, where to stay, what to eat & the tourist traps to avoid. Real traveller tips from our free guide.  #ShillongTravel #Shillong #IncredibleIndia #TravelGuide #TravelItinerary #IndiaTravel #TripPlanning #TravelBlog #TravelTips #TravelHacks",Northeast India
The Perfect 3-Day Shillong Itinerary (2026),https://images.unsplash.com/photo-1665551896704-b0f439e7087d?w=1000&q=85&fit=crop&ar=2:3,https://www.incredibleitinerary.com/blog/shillong-3-days,"Day-by-day Shillong plan with 4 travel styles — budget, couple, adventure & family. Real costs, real routes, real tips from IncredibleItinerary. Plan smarter, travel better!  India's rock music capital, Laitlum Canyons at the end of the earth, 7-story tribal museum, and Mawphlang Sacred Forest where nothing has been removed for centuries.  #ShillongTravel #Shillong #IncredibleIndia #TravelGuide #TravelItinerary #IndiaTravel #TripPlanning #TravelBlog #ShillongItinerary #TripPlanning",Northeast India
Mahabaleshwar in 2 Days — Complete Guide from ₹800/day,https://images.unsplash.com/photo-1598528831787-6a3a98049990?w=1000&q=85&fit=crop&ar=2:3,https://www.incredibleitinerary.com/blog/mahabaleshwar-2-days,"Plan your Mahabaleshwar trip with real prices. 2-day itinerary with budget, mid-range & luxury plans — hotel picks, Google Maps routes & insider tips. Free guide!  India's most dramatic cliff edge at 600m vertical drop, Shivaji's Pratapgad Fort, strawberry farms, and why monsoon Mahabaleshwar is a different planet.  #MahabaleshwarTravel #Mahabaleshwar #IncredibleIndia #TravelGuide #TravelItinerary #IndiaTravel #TripPlanning #TravelBlog #BudgetTravel #TravelGuide",Himalayan Adventures
2 Things to Know Before Visiting Mahabaleshwar (2026),https://images.unsplash.com/photo-1598528831787-6a3a98049990?w=1000&q=85&fit=crop&ar=2:3,https://www.incredibleitinerary.com/blog/mahabaleshwar-2-days,"Don't make these mistakes on your Mahabaleshwar trip. Best time to visit, where to stay, what to eat & the tourist traps to avoid. Real traveller tips from our free guide.  #MahabaleshwarTravel #Mahabaleshwar #IncredibleIndia #TravelGuide #TravelItinerary #IndiaTravel #TripPlanning #TravelBlog #TravelTips #TravelHacks",Himalayan Adventures
The Perfect 2-Day Mahabaleshwar Itinerary (2026),https://images.unsplash.com/photo-1598528831787-6a3a98049990?w=1000&q=85&fit=crop&ar=2:3,https://www.incredibleitinerary.com/blog/mahabaleshwar-2-days,"Day-by-day Mahabaleshwar plan with 4 travel styles — budget, couple, adventure & family. Real costs, real routes, real tips from IncredibleItinerary. Plan smarter, travel better!  India's most dramatic cliff edge at 600m vertical drop, Shivaji's Pratapgad Fort, strawberry farms, and why monsoon Mahabaleshwar is a different planet.  #MahabaleshwarTravel #Mahabaleshwar #IncredibleIndia #TravelGuide #TravelItinerary #IndiaTravel #TripPlanning #TravelBlog #MahabaleshwarItinerary #TripPlanning",Himalayan Adventures
Tawang in 4 Days — Complete Guide from ₹800/day,https://images.unsplash.com/photo-1628443266300-e8490ee38875?w=1000&q=85&fit=crop&ar=2:3,https://www.incredibleitinerary.com/blog/tawang-4-days,"Plan your Tawang trip with real prices. 4-day itinerary with budget, mid-range & luxury plans — hotel picks, Google Maps routes & insider tips. Free guide!  India's largest Buddhist monastery, Sela Pass at 13,700 feet with frozen prayer flags, Madhuri Lake, and the actual India-China border at Bumla Pass.  #TawangTravel #Tawang #IncredibleIndia #TravelGuide #TravelItinerary #IndiaTravel #TripPlanning #TravelBlog #BudgetTravel #TravelGuide",Northeast India
4 Things to Know Before Visiting Tawang (2026),https://images.unsplash.com/photo-1628443266300-e8490ee38875?w=1000&q=85&fit=crop&ar=2:3,https://www.incredibleitinerary.com/blog/tawang-4-days,"Don't make these mistakes on your Tawang trip. Best time to visit, where to stay, what to eat & the tourist traps to avoid. Real traveller tips from our free guide.  #TawangTravel #Tawang #IncredibleIndia #TravelGuide #TravelItinerary #IndiaTravel #TripPlanning #TravelBlog #TravelTips #TravelHacks",Northeast India
The Perfect 4-Day Tawang Itinerary (2026),https://images.unsplash.com/photo-1628443266300-e8490ee38875?w=1000&q=85&fit=crop&ar=2:3,https://www.incredibleitinerary.com/blog/tawang-4-days,"Day-by-day Tawang plan with 4 travel styles — budget, couple, adventure & family. Real costs, real routes, real tips from IncredibleItinerary. Plan smarter, travel better!  India's largest Buddhist monastery, Sela Pass at 13,700 feet with frozen prayer flags, Madhuri Lake, and the actual India-China border at Bumla Pass.  #TawangTravel #Tawang #IncredibleIndia #TravelGuide #TravelItinerary #IndiaTravel #TripPlanning #TravelBlog #TawangItinerary #TripPlanning",Northeast India
Sundarbans in 3 Days — Complete Guide from ₹800/day,https://images.unsplash.com/photo-1674235750425-0356dfae67a0?w=1000&q=85&fit=crop&ar=2:3,https://www.incredibleitinerary.com/blog/sundarbans-3-days,"Plan your Sundarbans trip with real prices. 3-day itinerary with budget, mid-range & luxury plans — hotel picks, Google Maps routes & insider tips. Free guide!  The rarest wildlife sighting in India — Royal Bengal Tigers swimming through mangroves. Canopy walks over crocodile water. Dawn silence that exists nowhere else.  #SundarbansTravel #Sundarbans #IncredibleIndia #TravelGuide #TravelItinerary #IndiaTravel #TripPlanning #TravelBlog #BudgetTravel #TravelGuide",India Travel Guides
3 Things to Know Before Visiting Sundarbans (2026),https://images.unsplash.com/photo-1674235750425-0356dfae67a0?w=1000&q=85&fit=crop&ar=2:3,https://www.incredibleitinerary.com/blog/sundarbans-3-days,"Don't make these mistakes on your Sundarbans trip. Best time to visit, where to stay, what to eat & the tourist traps to avoid. Real traveller tips from our free guide.  #SundarbansTravel #Sundarbans #IncredibleIndia #TravelGuide #TravelItinerary #IndiaTravel #TripPlanning #TravelBlog #TravelTips #TravelHacks",India Travel Guides
The Perfect 3-Day Sundarbans Itinerary (2026),https://images.unsplash.com/photo-1674235750425-0356dfae67a0?w=1000&q=85&fit=crop&ar=2:3,https://www.incredibleitinerary.com/blog/sundarbans-3-days,"Day-by-day Sundarbans plan with 4 travel styles — budget, couple, adventure & family. Real costs, real routes, real tips from IncredibleItinerary. Plan smarter, travel better!  The rarest wildlife sighting in India — Royal Bengal Tigers swimming through mangroves. Canopy walks over crocodile water. Dawn silence that exists nowhere else.  #SundarbansTravel #Sundarbans #IncredibleIndia #TravelGuide #TravelItinerary #IndiaTravel #TripPlanning #TravelBlog #SundarbansItinerary #TripPlanning",India Travel Guides
Valley of Flowers in 4 Days — Complete Guide from ₹800/day,https://images.unsplash.com/photo-1720965859956-c1ece6d29c87?w=1000&q=85&fit=crop&ar=2:3,https://www.incredibleitinerary.com/blog/valley-of-flowers-4-days,"Plan your Valley of Flowers trip with real prices. 4-day itinerary with budget, mid-range & luxury plans — hotel picks, Google Maps routes & insider tips. Free guide!  A 4-day window in late July when 600 species of wildflowers carpet a glacial valley. The most beautiful thing in India, open only 4 months a year.  #ValleyofFlowersTravel #ValleyofFlowers #IncredibleIndia #TravelGuide #TravelItinerary #IndiaTravel #TripPlanning #TravelBlog #BudgetTravel #TravelGuide",Himalayan Adventures
4 Things to Know Before Visiting Valley of Flowers (2026),https://images.unsplash.com/photo-1720965859956-c1ece6d29c87?w=1000&q=85&fit=crop&ar=2:3,https://www.incredibleitinerary.com/blog/valley-of-flowers-4-days,"Don't make these mistakes on your Valley of Flowers trip. Best time to visit, where to stay, what to eat & the tourist traps to avoid. Real traveller tips from our free guide.  #ValleyofFlowersTravel #ValleyofFlowers #IncredibleIndia #TravelGuide #TravelItinerary #IndiaTravel #TripPlanning #TravelBlog #TravelTips #TravelHacks",Himalayan Adventures
The Perfect 4-Day Valley of Flowers Itinerary (2026),https://images.unsplash.com/photo-1720965859956-c1ece6d29c87?w=1000&q=85&fit=crop&ar=2:3,https://www.incredibleitinerary.com/blog/valley-of-flowers-4-days,"Day-by-day Valley of Flowers plan with 4 travel styles — budget, couple, adventure & family. Real costs, real routes, real tips from IncredibleItinerary. Plan smarter, travel better!  A 4-day window in late July when 600 species of wildflowers carpet a glacial valley. The most beautiful thing in India, open only 4 months a year.  #ValleyofFlowersTravel #ValleyofFlowers #IncredibleIndia #TravelGuide #TravelItinerary #IndiaTravel #TripPlanning #TravelBlog #ValleyofFlowersItinerary #TripPlanning",Himalayan Adventures
Majuli in 3 Days — Complete Guide from ₹800/day,https://images.unsplash.com/photo-1759738101611-07ef8510f0cb?w=1000&q=85&fit=crop&ar=2:3,https://www.incredibleitinerary.com/blog/majuli-3-days,"Plan your Majuli trip with real prices. 3-day itinerary with budget, mid-range & luxury plans — hotel picks, Google Maps routes & insider tips. Free guide!  The world's largest river island is shrinking every monsoon. 500-year-old mask artisans, monastery dance-dramas, and a ferry across the Brahmaputra that's the only way in.  #MajuliTravel #Majuli #IncredibleIndia #TravelGuide #TravelItinerary #IndiaTravel #TripPlanning #TravelBlog #BudgetTravel #TravelGuide",Northeast India
3 Things to Know Before Visiting Majuli (2026),https://images.unsplash.com/photo-1759738101611-07ef8510f0cb?w=1000&q=85&fit=crop&ar=2:3,https://www.incredibleitinerary.com/blog/majuli-3-days,"Don't make these mistakes on your Majuli trip. Best time to visit, where to stay, what to eat & the tourist traps to avoid. Real traveller tips from our free guide.  #MajuliTravel #Majuli #IncredibleIndia #TravelGuide #TravelItinerary #IndiaTravel #TripPlanning #TravelBlog #TravelTips #TravelHacks",Northeast India
The Perfect 3-Day Majuli Itinerary (2026),https://images.unsplash.com/photo-1759738101611-07ef8510f0cb?w=1000&q=85&fit=crop&ar=2:3,https://www.incredibleitinerary.com/blog/majuli-3-days,"Day-by-day Majuli plan with 4 travel styles — budget, couple, adventure & family. Real costs, real routes, real tips from IncredibleItinerary. Plan smarter, travel better!  The world's largest river island is shrinking every monsoon. 500-year-old mask artisans, monastery dance-dramas, and a ferry across the Brahmaputra that's the only way in.  #MajuliTravel #Majuli #IncredibleIndia #TravelGuide #TravelItinerary #IndiaTravel #TripPlanning #TravelBlog #MajuliItinerary #TripPlanning",Northeast India
Mumbai in 3 Days — Complete Guide from ₹800/day,https://images.unsplash.com/photo-1529253355930-ddbe423a2ac7?w=1000&q=85&fit=crop&ar=2:3,https://www.incredibleitinerary.com/blog/mumbai-3-days,"Plan your Mumbai trip with real prices. 3-day itinerary with budget, mid-range & luxury plans — hotel picks, Google Maps routes & insider tips. Free guide!  Colonial grandeur, Dharavi lanes, Bollywood backdrops, and the world's best street food — India's maximum city in 3 days.  #MumbaiTravel #Mumbai #IncredibleIndia #TravelGuide #TravelItinerary #IndiaTravel #TripPlanning #TravelBlog #BudgetTravel #TravelGuide",India Travel Guides
3 Things to Know Before Visiting Mumbai (2026),https://images.unsplash.com/photo-1529253355930-ddbe423a2ac7?w=1000&q=85&fit=crop&ar=2:3,https://www.incredibleitinerary.com/blog/mumbai-3-days,"Don't make these mistakes on your Mumbai trip. Best time to visit, where to stay, what to eat & the tourist traps to avoid. Real traveller tips from our free guide.  #MumbaiTravel #Mumbai #IncredibleIndia #TravelGuide #TravelItinerary #IndiaTravel #TripPlanning #TravelBlog #TravelTips #TravelHacks",India Travel Guides
The Perfect 3-Day Mumbai Itinerary (2026),https://images.unsplash.com/photo-1529253355930-ddbe423a2ac7?w=1000&q=85&fit=crop&ar=2:3,https://www.incredibleitinerary.com/blog/mumbai-3-days,"Day-by-day Mumbai plan with 4 travel styles — budget, couple, adventure & family. Real costs, real routes, real tips from IncredibleItinerary. Plan smarter, travel better!  Colonial grandeur, Dharavi lanes, Bollywood backdrops, and the world's best street food — India's maximum city in 3 days.  #MumbaiTravel #Mumbai #IncredibleIndia #TravelGuide #TravelItinerary #IndiaTravel #TripPlanning #TravelBlog #MumbaiItinerary #TripPlanning",India Travel Guides
Kolkata in 3 Days — Complete Guide from ₹800/day,https://images.unsplash.com/photo-1558431382-27e303142255?w=1000&q=85&fit=crop&ar=2:3,https://www.incredibleitinerary.com/blog/kolkata-3-days,"Plan your Kolkata trip with real prices. 3-day itinerary with budget, mid-range & luxury plans — hotel picks, Google Maps routes & insider tips. Free guide!  Victoria Memorial, Howrah Bridge, College Street bookshops, Durga Puja heritage, and the finest Bengali cuisine in the world.  #KolkataTravel #Kolkata #IncredibleIndia #TravelGuide #TravelItinerary #IndiaTravel #TripPlanning #TravelBlog #BudgetTravel #TravelGuide",Indian Heritage & Culture
3 Things to Know Before Visiting Kolkata (2026),https://images.unsplash.com/photo-1558431382-27e303142255?w=1000&q=85&fit=crop&ar=2:3,https://www.incredibleitinerary.com/blog/kolkata-3-days,"Don't make these mistakes on your Kolkata trip. Best time to visit, where to stay, what to eat & the tourist traps to avoid. Real traveller tips from our free guide.  #KolkataTravel #Kolkata #IncredibleIndia #TravelGuide #TravelItinerary #IndiaTravel #TripPlanning #TravelBlog #TravelTips #TravelHacks",Indian Heritage & Culture
The Perfect 3-Day Kolkata Itinerary (2026),https://images.unsplash.com/photo-1558431382-27e303142255?w=1000&q=85&fit=crop&ar=2:3,https://www.incredibleitinerary.com/blog/kolkata-3-days,"Day-by-day Kolkata plan with 4 travel styles — budget, couple, adventure & family. Real costs, real routes, real tips from IncredibleItinerary. Plan smarter, travel better!  Victoria Memorial, Howrah Bridge, College Street bookshops, Durga Puja heritage, and the finest Bengali cuisine in the world.  #KolkataTravel #Kolkata #IncredibleIndia #TravelGuide #TravelItinerary #IndiaTravel #TripPlanning #TravelBlog #KolkataItinerary #TripPlanning",Indian Heritage & Culture
Delhi in 3 Days — Complete Guide from ₹800/day,https://images.unsplash.com/photo-1587474260584-136574528ed5?w=1000&q=85&fit=crop&ar=2:3,https://www.incredibleitinerary.com/blog/delhi-3-days,"Plan your Delhi trip with real prices. 3-day itinerary with budget, mid-range & luxury plans — hotel picks, Google Maps routes & insider tips. Free guide!  Red Fort, Humayun's Tomb, Chandni Chowk, Lodhi Garden, and the world's greatest street food — 3 days in India's layered capital.  #DelhiTravel #Delhi #IncredibleIndia #TravelGuide #TravelItinerary #IndiaTravel #TripPlanning #TravelBlog #BudgetTravel #TravelGuide",Indian Heritage & Culture
3 Things to Know Before Visiting Delhi (2026),https://images.unsplash.com/photo-1587474260584-136574528ed5?w=1000&q=85&fit=crop&ar=2:3,https://www.incredibleitinerary.com/blog/delhi-3-days,"Don't make these mistakes on your Delhi trip. Best time to visit, where to stay, what to eat & the tourist traps to avoid. Real traveller tips from our free guide.  #DelhiTravel #Delhi #IncredibleIndia #TravelGuide #TravelItinerary #IndiaTravel #TripPlanning #TravelBlog #TravelTips #TravelHacks",Indian Heritage & Culture
The Perfect 3-Day Delhi Itinerary (2026),https://images.unsplash.com/photo-1587474260584-136574528ed5?w=1000&q=85&fit=crop&ar=2:3,https://www.incredibleitinerary.com/blog/delhi-3-days,"Day-by-day Delhi plan with 4 travel styles — budget, couple, adventure & family. Real costs, real routes, real tips from IncredibleItinerary. Plan smarter, travel better!  Red Fort, Humayun's Tomb, Chandni Chowk, Lodhi Garden, and the world's greatest street food — 3 days in India's layered capital.  #DelhiTravel #Delhi #IncredibleIndia #TravelGuide #TravelItinerary #IndiaTravel #TripPlanning #TravelBlog #DelhiItinerary #TripPlanning",Indian Heritage & Culture
Bangalore in 3 Days — Complete Guide from ₹800/day,https://images.unsplash.com/photo-1596176530529-78163a4f7af2?w=1000&q=85&fit=crop&ar=2:3,https://www.incredibleitinerary.com/blog/bangalore-3-days,"Plan your Bangalore trip with real prices. 3-day itinerary with budget, mid-range & luxury plans — hotel picks, Google Maps routes & insider tips. Free guide!  Lalbagh, Cubbon Park, craft beer lanes, Tipu Sultan's Summer Palace, and the best craft coffee in India — India's most cosmopolitan city.  #BangaloreTravel #Bangalore #IncredibleIndia #TravelGuide #TravelItinerary #IndiaTravel #TripPlanning #TravelBlog #BudgetTravel #TravelGuide",India Travel Guides
3 Things to Know Before Visiting Bangalore (2026),https://images.unsplash.com/photo-1596176530529-78163a4f7af2?w=1000&q=85&fit=crop&ar=2:3,https://www.incredibleitinerary.com/blog/bangalore-3-days,"Don't make these mistakes on your Bangalore trip. Best time to visit, where to stay, what to eat & the tourist traps to avoid. Real traveller tips from our free guide.  #BangaloreTravel #Bangalore #IncredibleIndia #TravelGuide #TravelItinerary #IndiaTravel #TripPlanning #TravelBlog #TravelTips #TravelHacks",India Travel Guides
The Perfect 3-Day Bangalore Itinerary (2026),https://images.unsplash.com/photo-1596176530529-78163a4f7af2?w=1000&q=85&fit=crop&ar=2:3,https://www.incredibleitinerary.com/blog/bangalore-3-days,"Day-by-day Bangalore plan with 4 travel styles — budget, couple, adventure & family. Real costs, real routes, real tips from IncredibleItinerary. Plan smarter, travel better!  Lalbagh, Cubbon Park, craft beer lanes, Tipu Sultan's Summer Palace, and the best craft coffee in India — India's most cosmopolitan city.  #BangaloreTravel #Bangalore #IncredibleIndia #TravelGuide #TravelItinerary #IndiaTravel #TripPlanning #TravelBlog #BangaloreItinerary #TripPlanning",India Travel Guides
Varkala in 3 Days — Complete Guide from ₹800/day,https://images.unsplash.com/photo-1512343879784-a960bf40e7f2?w=1000&q=85&fit=crop&ar=2:3,https://www.incredibleitinerary.com/blog/varkala-3-days,"Plan your Varkala trip with real prices. 3-day itinerary with budget, mid-range & luxury plans — hotel picks, Google Maps routes & insider tips. Free guide!  The red laterite cliffs over the Arabian Sea, Papanasam beach, yoga shalas, and the most laid-back Kerala vibe you'll find anywhere.  #VarkalaTravel #Varkala #IncredibleIndia #TravelGuide #TravelItinerary #IndiaTravel #TripPlanning #TravelBlog #BudgetTravel #TravelGuide",Spiritual India
3 Things to Know Before Visiting Varkala (2026),https://images.unsplash.com/photo-1512343879784-a960bf40e7f2?w=1000&q=85&fit=crop&ar=2:3,https://www.incredibleitinerary.com/blog/varkala-3-days,"Don't make these mistakes on your Varkala trip. Best time to visit, where to stay, what to eat & the tourist traps to avoid. Real traveller tips from our free guide.  #VarkalaTravel #Varkala #IncredibleIndia #TravelGuide #TravelItinerary #IndiaTravel #TripPlanning #TravelBlog #TravelTips #TravelHacks",Spiritual India
