Title,Media URL,Link,Description,Pinterest board
The Perfect 4-Day Miami Itinerary (2026),https://images.unsplash.com/photo-ZFXrgzHu1KU?w=1000&q=85&fit=crop&ar=2:3,https://www.incredibleitinerary.com/blog/miami-4-days,"Day-by-day Miami plan with 4 travel styles — budget, couple, adventure & family. Real costs, real routes, real tips from IncredibleItinerary. Plan smarter, travel better!  Art Deco Ocean Drive, Wynwood murals, café cubano for $1 in Little Havana, airboat rides through the Everglades — Miami in 4 days with real prices and the best time to visit.  #MiamiTravel #Miami #USATravel #TravelGuide #TravelItinerary #WorldTravel #TripPlanning #TravelBlog #MiamiItinerary #TripPlanning",Travel Guides & Itineraries
Grand Canyon in 3 Days — Complete Guide from $50/day,https://images.unsplash.com/photo-1474044159687-1ee9f3a51722?w=1000&q=85&fit=crop&ar=2:3,https://www.incredibleitinerary.com/blog/grand-canyon-3-days,"Plan your Grand Canyon trip with real prices. 3-day itinerary with budget, mid-range & luxury plans — hotel picks, Google Maps routes & insider tips. Free guide!  Mather Point at sunrise, the Bright Angel Trail to the 1.5-Mile Resthouse, Desert View Drive's 8 viewpoints, and helicopter tours — Grand Canyon in 3 days without making the hike that kills people every year.  #GrandCanyonTravel #GrandCanyon #USATravel #TravelGuide #TravelItinerary #WorldTravel #TripPlanning #TravelBlog #BudgetTravel…",Travel Guides & Itineraries
3 Things to Know Before Visiting Grand Canyon (2026),https://images.unsplash.com/photo-1474044159687-1ee9f3a51722?w=1000&q=85&fit=crop&ar=2:3,https://www.incredibleitinerary.com/blog/grand-canyon-3-days,"Don't make these mistakes on your Grand Canyon trip. Best time to visit, where to stay, what to eat & the tourist traps to avoid. Real traveller tips from our free guide.  #GrandCanyonTravel #GrandCanyon #USATravel #TravelGuide #TravelItinerary #WorldTravel #TripPlanning #TravelBlog #TravelTips #TravelHacks",Travel Guides & Itineraries
The Perfect 3-Day Grand Canyon Itinerary (2026),https://images.unsplash.com/photo-1474044159687-1ee9f3a51722?w=1000&q=85&fit=crop&ar=2:3,https://www.incredibleitinerary.com/blog/grand-canyon-3-days,"Day-by-day Grand Canyon plan with 4 travel styles — budget, couple, adventure & family. Real costs, real routes, real tips from IncredibleItinerary. Plan smarter, travel better!  Mather Point at sunrise, the Bright Angel Trail to the 1.5-Mile Resthouse, Desert View Drive's 8 viewpoints, and helicopter tours — Grand Canyon in 3 days without making the hike that kills people every year.  #GrandCanyonTravel #GrandCanyon #USATravel #TravelGuide #TravelItinerary #WorldTravel #TripPlanning…",Travel Guides & Itineraries
London in 5 Days — Complete Guide from $50/day,https://images.unsplash.com/photo-1513635269975-59663e0ac1ad?w=1000&q=85&fit=crop&ar=2:3,https://www.incredibleitinerary.com/blog/london-5-days,"Plan your London trip with real prices. 5-day itinerary with budget, mid-range & luxury plans — hotel picks, Google Maps routes & insider tips. Free guide!  The British Museum, Natural History Museum, Tate Modern, National Gallery — all free. Add Borough Market, Tower Bridge, and a Windsor day trip. London in 5 days without breaking the bank.  #LondonTravel #London #UKTravel #TravelGuide #TravelItinerary #WorldTravel #TripPlanning #TravelBlog #BudgetTravel #TravelGuide",Europe Travel Guides
5 Things to Know Before Visiting London (2026),https://images.unsplash.com/photo-1513635269975-59663e0ac1ad?w=1000&q=85&fit=crop&ar=2:3,https://www.incredibleitinerary.com/blog/london-5-days,"Don't make these mistakes on your London trip. Best time to visit, where to stay, what to eat & the tourist traps to avoid. Real traveller tips from our free guide.  #LondonTravel #London #UKTravel #TravelGuide #TravelItinerary #WorldTravel #TripPlanning #TravelBlog #TravelTips #TravelHacks",Europe Travel Guides
The Perfect 5-Day London Itinerary (2026),https://images.unsplash.com/photo-1513635269975-59663e0ac1ad?w=1000&q=85&fit=crop&ar=2:3,https://www.incredibleitinerary.com/blog/london-5-days,"Day-by-day London plan with 4 travel styles — budget, couple, adventure & family. Real costs, real routes, real tips from IncredibleItinerary. Plan smarter, travel better!  The British Museum, Natural History Museum, Tate Modern, National Gallery — all free. Add Borough Market, Tower Bridge, and a Windsor day trip. London in 5 days without breaking the bank.  #LondonTravel #London #UKTravel #TravelGuide #TravelItinerary #WorldTravel #TripPlanning #TravelBlog #LondonItinerary #TripPlanning",Europe Travel Guides
Edinburgh in 4 Days — Complete Guide from $50/day,https://images.unsplash.com/photo-1603197396060?w=1000&q=85&fit=crop&ar=2:3,https://www.incredibleitinerary.com/blog/edinburgh-4-days,"Plan your Edinburgh trip with real prices. 4-day itinerary with budget, mid-range & luxury plans — hotel picks, Google Maps routes & insider tips. Free guide!  Edinburgh Castle at sunrise, Arthur's Seat volcanic peak, a day trip to Loch Ness, Victoria Street's Harry Potter lanes, and the best Scotch in a proper whisky bar. Scotland's capital in 4 days.  #EdinburghTravel #Edinburgh #UKTravel #TravelGuide #TravelItinerary #WorldTravel #TripPlanning #TravelBlog #BudgetTravel #TravelGuide",Europe Travel Guides
4 Things to Know Before Visiting Edinburgh (2026),https://images.unsplash.com/photo-1603197396060?w=1000&q=85&fit=crop&ar=2:3,https://www.incredibleitinerary.com/blog/edinburgh-4-days,"Don't make these mistakes on your Edinburgh trip. Best time to visit, where to stay, what to eat & the tourist traps to avoid. Real traveller tips from our free guide.  #EdinburghTravel #Edinburgh #UKTravel #TravelGuide #TravelItinerary #WorldTravel #TripPlanning #TravelBlog #TravelTips #TravelHacks",Europe Travel Guides
The Perfect 4-Day Edinburgh Itinerary (2026),https://images.unsplash.com/photo-1603197396060?w=1000&q=85&fit=crop&ar=2:3,https://www.incredibleitinerary.com/blog/edinburgh-4-days,"Day-by-day Edinburgh plan with 4 travel styles — budget, couple, adventure & family. Real costs, real routes, real tips from IncredibleItinerary. Plan smarter, travel better!  Edinburgh Castle at sunrise, Arthur's Seat volcanic peak, a day trip to Loch Ness, Victoria Street's Harry Potter lanes, and the best Scotch in a proper whisky bar. Scotland's capital in 4 days.  #EdinburghTravel #Edinburgh #UKTravel #TravelGuide #TravelItinerary #WorldTravel #TripPlanning #TravelBlog #EdinburghItinerary…",Europe Travel Guides
Bath in 2 Days — Complete Guide from $50/day,https://images.unsplash.com/photo-1580674684081-7617fbf3d745?w=1000&q=85&fit=crop&ar=2:3,https://www.incredibleitinerary.com/blog/bath-2-days,"Plan your Bath trip with real prices. 2-day itinerary with budget, mid-range & luxury plans — hotel picks, Google Maps routes & insider tips. Free guide!  Bathing in 2,000-year-old Roman waters, soaking in a rooftop thermal spa with views of the Georgian skyline, then Stonehenge at dawn — all from UNESCO World Heritage Bath in just 2 days.  #BathTravel #Bath #UKTravel #TravelGuide #TravelItinerary #WorldTravel #TripPlanning #TravelBlog #BudgetTravel #TravelGuide",Europe Travel Guides
2 Things to Know Before Visiting Bath (2026),https://images.unsplash.com/photo-1580674684081-7617fbf3d745?w=1000&q=85&fit=crop&ar=2:3,https://www.incredibleitinerary.com/blog/bath-2-days,"Don't make these mistakes on your Bath trip. Best time to visit, where to stay, what to eat & the tourist traps to avoid. Real traveller tips from our free guide.  #BathTravel #Bath #UKTravel #TravelGuide #TravelItinerary #WorldTravel #TripPlanning #TravelBlog #TravelTips #TravelHacks",Europe Travel Guides
The Perfect 2-Day Bath Itinerary (2026),https://images.unsplash.com/photo-1580674684081-7617fbf3d745?w=1000&q=85&fit=crop&ar=2:3,https://www.incredibleitinerary.com/blog/bath-2-days,"Day-by-day Bath plan with 4 travel styles — budget, couple, adventure & family. Real costs, real routes, real tips from IncredibleItinerary. Plan smarter, travel better!  Bathing in 2,000-year-old Roman waters, soaking in a rooftop thermal spa with views of the Georgian skyline, then Stonehenge at dawn — all from UNESCO World Heritage Bath in just 2 days.  #BathTravel #Bath #UKTravel #TravelGuide #TravelItinerary #WorldTravel #TripPlanning #TravelBlog #BathItinerary #TripPlanning",Europe Travel Guides
Cotswolds in 3 Days — Complete Guide from $50/day,https://images.unsplash.com/photo-1548695607-9c73430aa1e0?w=1000&q=85&fit=crop&ar=2:3,https://www.incredibleitinerary.com/blog/cotswolds-3-days,"Plan your Cotswolds trip with real prices. 3-day itinerary with budget, mid-range & luxury plans — hotel picks, Google Maps routes & insider tips. Free guide!  Bibury's Arlington Row at 6am before the tour buses, Chipping Campden's honey-stone perfection, Broadway Tower's 16-county views — the Cotswolds road trip done properly, village by village.  #CotswoldsTravel #Cotswolds #UKTravel #TravelGuide #TravelItinerary #WorldTravel #TripPlanning #TravelBlog #BudgetTravel #TravelGuide",Europe Travel Guides
3 Things to Know Before Visiting Cotswolds (2026),https://images.unsplash.com/photo-1548695607-9c73430aa1e0?w=1000&q=85&fit=crop&ar=2:3,https://www.incredibleitinerary.com/blog/cotswolds-3-days,"Don't make these mistakes on your Cotswolds trip. Best time to visit, where to stay, what to eat & the tourist traps to avoid. Real traveller tips from our free guide.  #CotswoldsTravel #Cotswolds #UKTravel #TravelGuide #TravelItinerary #WorldTravel #TripPlanning #TravelBlog #TravelTips #TravelHacks",Europe Travel Guides
The Perfect 3-Day Cotswolds Itinerary (2026),https://images.unsplash.com/photo-1548695607-9c73430aa1e0?w=1000&q=85&fit=crop&ar=2:3,https://www.incredibleitinerary.com/blog/cotswolds-3-days,"Day-by-day Cotswolds plan with 4 travel styles — budget, couple, adventure & family. Real costs, real routes, real tips from IncredibleItinerary. Plan smarter, travel better!  Bibury's Arlington Row at 6am before the tour buses, Chipping Campden's honey-stone perfection, Broadway Tower's 16-county views — the Cotswolds road trip done properly, village by village.  #CotswoldsTravel #Cotswolds #UKTravel #TravelGuide #TravelItinerary #WorldTravel #TripPlanning #TravelBlog #CotswoldsItinerary…",Europe Travel Guides
Sydney in 5 Days — Complete Guide from $50/day,https://images.unsplash.com/photo-PjRnF3aYPeg?w=1000&q=85&fit=crop&ar=2:3,https://www.incredibleitinerary.com/blog/sydney-5-days,"Plan your Sydney trip with real prices. 5-day itinerary with budget, mid-range & luxury plans — hotel picks, Google Maps routes & insider tips. Free guide!  The Bondi to Coogee coastal walk at dawn, Blue Mountains' Three Sisters, Manly ferry for A$6.50 instead of a tour, and the world's most photographed harbour. Sydney's greatest hits with real costs.  #SydneyTravel #Sydney #AustraliaTravel #TravelGuide #TravelItinerary #WorldTravel #TripPlanning #TravelBlog #BudgetTravel #TravelGuide",Travel Guides & Itineraries
5 Things to Know Before Visiting Sydney (2026),https://images.unsplash.com/photo-PjRnF3aYPeg?w=1000&q=85&fit=crop&ar=2:3,https://www.incredibleitinerary.com/blog/sydney-5-days,"Don't make these mistakes on your Sydney trip. Best time to visit, where to stay, what to eat & the tourist traps to avoid. Real traveller tips from our free guide.  #SydneyTravel #Sydney #AustraliaTravel #TravelGuide #TravelItinerary #WorldTravel #TripPlanning #TravelBlog #TravelTips #TravelHacks",Travel Guides & Itineraries
The Perfect 5-Day Sydney Itinerary (2026),https://images.unsplash.com/photo-PjRnF3aYPeg?w=1000&q=85&fit=crop&ar=2:3,https://www.incredibleitinerary.com/blog/sydney-5-days,"Day-by-day Sydney plan with 4 travel styles — budget, couple, adventure & family. Real costs, real routes, real tips from IncredibleItinerary. Plan smarter, travel better!  The Bondi to Coogee coastal walk at dawn, Blue Mountains' Three Sisters, Manly ferry for A$6.50 instead of a tour, and the world's most photographed harbour. Sydney's greatest hits with real costs.  #SydneyTravel #Sydney #AustraliaTravel #TravelGuide #TravelItinerary #WorldTravel #TripPlanning #TravelBlog #SydneyItinerary…",Travel Guides & Itineraries
Melbourne in 4 Days — Complete Guide from $50/day,https://images.unsplash.com/photo-1514395462725-fb4566210144?w=1000&q=85&fit=crop&ar=2:3,https://www.incredibleitinerary.com/blog/melbourne-4-days,"Plan your Melbourne trip with real prices. 4-day itinerary with budget, mid-range & luxury plans — hotel picks, Google Maps routes & insider tips. Free guide!  The Twelve Apostles at sunrise, Hosier Lane street art, wild penguins at St Kilda, a proper flat white in a laneway café — Melbourne in 4 days, the city that locals say is better than Sydney.  #MelbourneTravel #Melbourne #AustraliaTravel #TravelGuide #TravelItinerary #WorldTravel #TripPlanning #TravelBlog #BudgetTravel #TravelGuide",Travel Guides & Itineraries
4 Things to Know Before Visiting Melbourne (2026),https://images.unsplash.com/photo-1514395462725-fb4566210144?w=1000&q=85&fit=crop&ar=2:3,https://www.incredibleitinerary.com/blog/melbourne-4-days,"Don't make these mistakes on your Melbourne trip. Best time to visit, where to stay, what to eat & the tourist traps to avoid. Real traveller tips from our free guide.  #MelbourneTravel #Melbourne #AustraliaTravel #TravelGuide #TravelItinerary #WorldTravel #TripPlanning #TravelBlog #TravelTips #TravelHacks",Travel Guides & Itineraries
The Perfect 4-Day Melbourne Itinerary (2026),https://images.unsplash.com/photo-1514395462725-fb4566210144?w=1000&q=85&fit=crop&ar=2:3,https://www.incredibleitinerary.com/blog/melbourne-4-days,"Day-by-day Melbourne plan with 4 travel styles — budget, couple, adventure & family. Real costs, real routes, real tips from IncredibleItinerary. Plan smarter, travel better!  The Twelve Apostles at sunrise, Hosier Lane street art, wild penguins at St Kilda, a proper flat white in a laneway café — Melbourne in 4 days, the city that locals say is better than Sydney.  #MelbourneTravel #Melbourne #AustraliaTravel #TravelGuide #TravelItinerary #WorldTravel #TripPlanning #TravelBlog…",Travel Guides & Itineraries
Great Barrier Reef in 4 Days — Complete Guide from $50/day,https://images.unsplash.com/photo-1559128010-7c1ad6e1b6a5?w=1000&q=85&fit=crop&ar=2:3,https://www.incredibleitinerary.com/blog/great-barrier-reef-4-days,"Plan your Great Barrier Reef trip with real prices. 4-day itinerary with budget, mid-range & luxury plans — hotel picks, Google Maps routes & insider tips. Free guide!  Outer reef snorkeling with manta rays, Daintree Rainforest where reef meets rainforest (the only place on Earth), skydiving over the Coral Sea — the Great Barrier Reef done properly from Cairns.  #GreatBarrierReefTravel #GreatBarrierReef #AustraliaTravel #TravelGuide #TravelItinerary #WorldTravel #TripPlanning #TravelBlog…",Travel Guides & Itineraries
4 Things to Know Before Visiting Great Barrier Reef (2026),https://images.unsplash.com/photo-1559128010-7c1ad6e1b6a5?w=1000&q=85&fit=crop&ar=2:3,https://www.incredibleitinerary.com/blog/great-barrier-reef-4-days,"Don't make these mistakes on your Great Barrier Reef trip. Best time to visit, where to stay, what to eat & the tourist traps to avoid. Real traveller tips from our free guide.  #GreatBarrierReefTravel #GreatBarrierReef #AustraliaTravel #TravelGuide #TravelItinerary #WorldTravel #TripPlanning #TravelBlog #TravelTips #TravelHacks",Travel Guides & Itineraries
The Perfect 4-Day Great Barrier Reef Itinerary (2026),https://images.unsplash.com/photo-1559128010-7c1ad6e1b6a5?w=1000&q=85&fit=crop&ar=2:3,https://www.incredibleitinerary.com/blog/great-barrier-reef-4-days,"Day-by-day Great Barrier Reef plan with 4 travel styles — budget, couple, adventure & family. Real costs, real routes, real tips from IncredibleItinerary. Plan smarter, travel better!  Outer reef snorkeling with manta rays, Daintree Rainforest where reef meets rainforest (the only place on Earth), skydiving over the Coral Sea — the Great Barrier Reef done properly from Cairns.  #GreatBarrierReefTravel #GreatBarrierReef #AustraliaTravel #TravelGuide #TravelItinerary #WorldTravel #TripPlanning…",Travel Guides & Itineraries
Uluru in 3 Days — Complete Guide from $50/day,https://images.unsplash.com/photo-1529108190281-9a4f620bc2d8?w=1000&q=85&fit=crop&ar=2:3,https://www.incredibleitinerary.com/blog/uluru-3-days,"Plan your Uluru trip with real prices. 3-day itinerary with budget, mid-range & luxury plans — hotel picks, Google Maps routes & insider tips. Free guide!  Uluru at sunrise turning from black to blazing red, the Valley of the Winds through Kata Tjuta's ancient gorges, and 50,000 illuminated stems under the Milky Way. Australia's most spiritual landscape.  #UluruTravel #Uluru #AustraliaTravel #TravelGuide #TravelItinerary #WorldTravel #TripPlanning #TravelBlog #BudgetTravel #TravelGuide",Travel Guides & Itineraries
3 Things to Know Before Visiting Uluru (2026),https://images.unsplash.com/photo-1529108190281-9a4f620bc2d8?w=1000&q=85&fit=crop&ar=2:3,https://www.incredibleitinerary.com/blog/uluru-3-days,"Don't make these mistakes on your Uluru trip. Best time to visit, where to stay, what to eat & the tourist traps to avoid. Real traveller tips from our free guide.  #UluruTravel #Uluru #AustraliaTravel #TravelGuide #TravelItinerary #WorldTravel #TripPlanning #TravelBlog #TravelTips #TravelHacks",Travel Guides & Itineraries
The Perfect 3-Day Uluru Itinerary (2026),https://images.unsplash.com/photo-1529108190281-9a4f620bc2d8?w=1000&q=85&fit=crop&ar=2:3,https://www.incredibleitinerary.com/blog/uluru-3-days,"Day-by-day Uluru plan with 4 travel styles — budget, couple, adventure & family. Real costs, real routes, real tips from IncredibleItinerary. Plan smarter, travel better!  Uluru at sunrise turning from black to blazing red, the Valley of the Winds through Kata Tjuta's ancient gorges, and 50,000 illuminated stems under the Milky Way. Australia's most spiritual landscape.  #UluruTravel #Uluru #AustraliaTravel #TravelGuide #TravelItinerary #WorldTravel #TripPlanning #TravelBlog #UluruItinerary…",Travel Guides & Itineraries
Hiroshima in 2 Days — Complete Guide from $50/day,https://images.unsplash.com/photo-1570521462033-3015e76e7432?w=1000&q=85&fit=crop&ar=2:3,https://www.incredibleitinerary.com/blog/hiroshima-2-days,"Plan your Hiroshima trip with real prices. 2-day itinerary with budget, mid-range & luxury plans — hotel picks, Google Maps routes & insider tips. Free guide!  The Peace Memorial Museum that will change how you see the world, the A-Bomb Dome at dusk, then Miyajima Island's floating torii gate at high tide — Hiroshima in 2 profound days.  #HiroshimaTravel #Hiroshima #JapanTravel #TravelGuide #TravelItinerary #WorldTravel #TripPlanning #TravelBlog #BudgetTravel #TravelGuide",Japan & East Asia Travel
2 Things to Know Before Visiting Hiroshima (2026),https://images.unsplash.com/photo-1570521462033-3015e76e7432?w=1000&q=85&fit=crop&ar=2:3,https://www.incredibleitinerary.com/blog/hiroshima-2-days,"Don't make these mistakes on your Hiroshima trip. Best time to visit, where to stay, what to eat & the tourist traps to avoid. Real traveller tips from our free guide.  #HiroshimaTravel #Hiroshima #JapanTravel #TravelGuide #TravelItinerary #WorldTravel #TripPlanning #TravelBlog #TravelTips #TravelHacks",Japan & East Asia Travel
The Perfect 2-Day Hiroshima Itinerary (2026),https://images.unsplash.com/photo-1570521462033-3015e76e7432?w=1000&q=85&fit=crop&ar=2:3,https://www.incredibleitinerary.com/blog/hiroshima-2-days,"Day-by-day Hiroshima plan with 4 travel styles — budget, couple, adventure & family. Real costs, real routes, real tips from IncredibleItinerary. Plan smarter, travel better!  The Peace Memorial Museum that will change how you see the world, the A-Bomb Dome at dusk, then Miyajima Island's floating torii gate at high tide — Hiroshima in 2 profound days.  #HiroshimaTravel #Hiroshima #JapanTravel #TravelGuide #TravelItinerary #WorldTravel #TripPlanning #TravelBlog #HiroshimaItinerary #TripPlanning",Japan & East Asia Travel
Hokkaido in 5 Days — Complete Guide from $50/day,https://images.unsplash.com/photo-1542051841857-5f90071e7989?w=1000&q=85&fit=crop&ar=2:3,https://www.incredibleitinerary.com/blog/hokkaido-5-days,"Plan your Hokkaido trip with real prices. 5-day itinerary with budget, mid-range & luxury plans — hotel picks, Google Maps routes & insider tips. Free guide!  Farm Tomita's lavender rows at dawn, Shirogane's milky-turquoise Blue Pond, Otaru's glass-blowing canal district, and sea urchin rice bowls at Nijo Market — Japan's north island in 5 days.  #HokkaidoTravel #Hokkaido #JapanTravel #TravelGuide #TravelItinerary #WorldTravel #TripPlanning #TravelBlog #BudgetTravel #TravelGuide",Japan & East Asia Travel
5 Things to Know Before Visiting Hokkaido (2026),https://images.unsplash.com/photo-1542051841857-5f90071e7989?w=1000&q=85&fit=crop&ar=2:3,https://www.incredibleitinerary.com/blog/hokkaido-5-days,"Don't make these mistakes on your Hokkaido trip. Best time to visit, where to stay, what to eat & the tourist traps to avoid. Real traveller tips from our free guide.  #HokkaidoTravel #Hokkaido #JapanTravel #TravelGuide #TravelItinerary #WorldTravel #TripPlanning #TravelBlog #TravelTips #TravelHacks",Japan & East Asia Travel
The Perfect 5-Day Hokkaido Itinerary (2026),https://images.unsplash.com/photo-1542051841857-5f90071e7989?w=1000&q=85&fit=crop&ar=2:3,https://www.incredibleitinerary.com/blog/hokkaido-5-days,"Day-by-day Hokkaido plan with 4 travel styles — budget, couple, adventure & family. Real costs, real routes, real tips from IncredibleItinerary. Plan smarter, travel better!  Farm Tomita's lavender rows at dawn, Shirogane's milky-turquoise Blue Pond, Otaru's glass-blowing canal district, and sea urchin rice bowls at Nijo Market — Japan's north island in 5 days.  #HokkaidoTravel #Hokkaido #JapanTravel #TravelGuide #TravelItinerary #WorldTravel #TripPlanning #TravelBlog #HokkaidoItinerary…",Japan & East Asia Travel
Morocco in 7 Days — Complete Guide from $50/day,https://images.unsplash.com/photo-1548813395-84fe1ba7a58e?w=1000&q=85&fit=crop&ar=2:3,https://www.incredibleitinerary.com/blog/morocco-7-days,"Plan your Morocco trip with real prices. 7-day itinerary with budget, mid-range & luxury plans — hotel picks, Google Maps routes & insider tips. Free guide!  Djemaa el-Fna at dusk with 200 food stalls, the world's largest medieval medina in Fes, camel sunset in the Sahara, and the blue-painted city of Chefchaouen — Morocco in 7 incredible days.  #MoroccoTravel #Morocco #TravelGuide #TravelItinerary #WorldTravel #TripPlanning #TravelBlog #Africa #BudgetTravel #TravelGuide",Travel Guides & Itineraries
7 Things to Know Before Visiting Morocco (2026),https://images.unsplash.com/photo-1548813395-84fe1ba7a58e?w=1000&q=85&fit=crop&ar=2:3,https://www.incredibleitinerary.com/blog/morocco-7-days,"Don't make these mistakes on your Morocco trip. Best time to visit, where to stay, what to eat & the tourist traps to avoid. Real traveller tips from our free guide.  #MoroccoTravel #Morocco #TravelGuide #TravelItinerary #WorldTravel #TripPlanning #TravelBlog #Africa #TravelTips #TravelHacks",Travel Guides & Itineraries
The Perfect 7-Day Morocco Itinerary (2026),https://images.unsplash.com/photo-1548813395-84fe1ba7a58e?w=1000&q=85&fit=crop&ar=2:3,https://www.incredibleitinerary.com/blog/morocco-7-days,"Day-by-day Morocco plan with 4 travel styles — budget, couple, adventure & family. Real costs, real routes, real tips from IncredibleItinerary. Plan smarter, travel better!  Djemaa el-Fna at dusk with 200 food stalls, the world's largest medieval medina in Fes, camel sunset in the Sahara, and the blue-painted city of Chefchaouen — Morocco in 7 incredible days.  #MoroccoTravel #Morocco #TravelGuide #TravelItinerary #WorldTravel #TripPlanning #TravelBlog #Africa #MoroccoItinerary #TripPlanning",Travel Guides & Itineraries
Kenya in 7 Days — Complete Guide from $50/day,https://images.unsplash.com/photo-1516426122078-c23e76319801?w=1000&q=85&fit=crop&ar=2:3,https://www.incredibleitinerary.com/blog/kenya-safari-7-days,"Plan your Kenya trip with real prices. 7-day itinerary with budget, mid-range & luxury plans — hotel picks, Google Maps routes & insider tips. Free guide!  Elephants against Kilimanjaro at dawn in Amboseli, a million wildebeest crossing the Mara River, baby elephants at David Sheldrick orphanage — the East Africa safari most people dream about.  #KenyaTravel #Kenya #TravelGuide #TravelItinerary #WorldTravel #TripPlanning #TravelBlog #Africa #BudgetTravel #TravelGuide",Travel Guides & Itineraries
7 Things to Know Before Visiting Kenya (2026),https://images.unsplash.com/photo-1516426122078-c23e76319801?w=1000&q=85&fit=crop&ar=2:3,https://www.incredibleitinerary.com/blog/kenya-safari-7-days,"Don't make these mistakes on your Kenya trip. Best time to visit, where to stay, what to eat & the tourist traps to avoid. Real traveller tips from our free guide.  #KenyaTravel #Kenya #TravelGuide #TravelItinerary #WorldTravel #TripPlanning #TravelBlog #Africa #TravelTips #TravelHacks",Travel Guides & Itineraries
