Title,Media URL,Link,Description,Pinterest board
Cherrapunji in 2 Days — Complete Guide from ₹800/day,https://images.unsplash.com/photo-1698429358246-807d8972da9a?w=1000&q=85&fit=crop&ar=2:3,https://www.incredibleitinerary.com/blog/cherrapunji-2-days,"Plan your Cherrapunji trip with real prices. 2-day itinerary with budget, mid-range & luxury plans — hotel picks, Google Maps routes & insider tips. Free guide!  Nohkalikai Falls plunges 340m into a turquoise pool. Living root bridges built over 500 years, Seven Sisters waterfall view, and the cloud line you can see from the plateau.  #CherrapunjiTravel #Cherrapunji #IncredibleIndia #TravelGuide #TravelItinerary #IndiaTravel #TripPlanning #TravelBlog #BudgetTravel #TravelGuide",Northeast India
2 Things to Know Before Visiting Cherrapunji (2026),https://images.unsplash.com/photo-1698429358246-807d8972da9a?w=1000&q=85&fit=crop&ar=2:3,https://www.incredibleitinerary.com/blog/cherrapunji-2-days,"Don't make these mistakes on your Cherrapunji trip. Best time to visit, where to stay, what to eat & the tourist traps to avoid. Real traveller tips from our free guide.  #CherrapunjiTravel #Cherrapunji #IncredibleIndia #TravelGuide #TravelItinerary #IndiaTravel #TripPlanning #TravelBlog #TravelTips #TravelHacks",Northeast India
The Perfect 2-Day Cherrapunji Itinerary (2026),https://images.unsplash.com/photo-1698429358246-807d8972da9a?w=1000&q=85&fit=crop&ar=2:3,https://www.incredibleitinerary.com/blog/cherrapunji-2-days,"Day-by-day Cherrapunji plan with 4 travel styles — budget, couple, adventure & family. Real costs, real routes, real tips from IncredibleItinerary. Plan smarter, travel better!  Nohkalikai Falls plunges 340m into a turquoise pool. Living root bridges built over 500 years, Seven Sisters waterfall view, and the cloud line you can see from the plateau.  #CherrapunjiTravel #Cherrapunji #IncredibleIndia #TravelGuide #TravelItinerary #IndiaTravel #TripPlanning #TravelBlog #CherrapunjiItinerary…",Northeast India
Coimbatore in 2 Days — Complete Guide from ₹800/day,https://images.unsplash.com/photo-VBbXycfXy-w?w=1000&q=85&fit=crop&ar=2:3,https://www.incredibleitinerary.com/blog/coimbatore-2-days,"Plan your Coimbatore trip with real prices. 2-day itinerary with budget, mid-range & luxury plans — hotel picks, Google Maps routes & insider tips. Free guide!  Isha Yoga Center's 34m Adiyogi statue, Marudamalai temple, Kovai Kutralam Falls, and the best filter coffee and kothu parotta you'll find in Tamil Nadu.  #CoimbatoreTravel #Coimbatore #IncredibleIndia #TravelGuide #TravelItinerary #IndiaTravel #TripPlanning #TravelBlog #BudgetTravel #TravelGuide",Spiritual India
2 Things to Know Before Visiting Coimbatore (2026),https://images.unsplash.com/photo-VBbXycfXy-w?w=1000&q=85&fit=crop&ar=2:3,https://www.incredibleitinerary.com/blog/coimbatore-2-days,"Don't make these mistakes on your Coimbatore trip. Best time to visit, where to stay, what to eat & the tourist traps to avoid. Real traveller tips from our free guide.  #CoimbatoreTravel #Coimbatore #IncredibleIndia #TravelGuide #TravelItinerary #IndiaTravel #TripPlanning #TravelBlog #TravelTips #TravelHacks",Spiritual India
The Perfect 2-Day Coimbatore Itinerary (2026),https://images.unsplash.com/photo-VBbXycfXy-w?w=1000&q=85&fit=crop&ar=2:3,https://www.incredibleitinerary.com/blog/coimbatore-2-days,"Day-by-day Coimbatore plan with 4 travel styles — budget, couple, adventure & family. Real costs, real routes, real tips from IncredibleItinerary. Plan smarter, travel better!  Isha Yoga Center's 34m Adiyogi statue, Marudamalai temple, Kovai Kutralam Falls, and the best filter coffee and kothu parotta you'll find in Tamil Nadu.  #CoimbatoreTravel #Coimbatore #IncredibleIndia #TravelGuide #TravelItinerary #IndiaTravel #TripPlanning #TravelBlog #CoimbatoreItinerary #TripPlanning",Spiritual India
Bangkok in 4 Days — Complete Guide from $30/day,https://images.unsplash.com/photo-1563492065599-3520f775eeed?w=1000&q=85&fit=crop&ar=2:3,https://www.incredibleitinerary.com/blog/bangkok-4-days,"Plan your Bangkok trip with real prices. 4-day itinerary with budget, mid-range & luxury plans — hotel picks, Google Maps routes & insider tips. Free guide!  Grand Palace at dawn, Chatuchak's 15,000 stalls, rooftop bars over the Chao Phraya, and street food that ruins every Thai restaurant you'll visit at home.  #BangkokTravel #Bangkok #ThailandTravel #TravelGuide #TravelItinerary #WorldTravel #TripPlanning #TravelBlog #BudgetTravel #TravelGuide",Southeast Asia Travel
4 Things to Know Before Visiting Bangkok (2026),https://images.unsplash.com/photo-1563492065599-3520f775eeed?w=1000&q=85&fit=crop&ar=2:3,https://www.incredibleitinerary.com/blog/bangkok-4-days,"Don't make these mistakes on your Bangkok trip. Best time to visit, where to stay, what to eat & the tourist traps to avoid. Real traveller tips from our free guide.  #BangkokTravel #Bangkok #ThailandTravel #TravelGuide #TravelItinerary #WorldTravel #TripPlanning #TravelBlog #TravelTips #TravelHacks",Southeast Asia Travel
The Perfect 4-Day Bangkok Itinerary (2026),https://images.unsplash.com/photo-1563492065599-3520f775eeed?w=1000&q=85&fit=crop&ar=2:3,https://www.incredibleitinerary.com/blog/bangkok-4-days,"Day-by-day Bangkok plan with 4 travel styles — budget, couple, adventure & family. Real costs, real routes, real tips from IncredibleItinerary. Plan smarter, travel better!  Grand Palace at dawn, Chatuchak's 15,000 stalls, rooftop bars over the Chao Phraya, and street food that ruins every Thai restaurant you'll visit at home.  #BangkokTravel #Bangkok #ThailandTravel #TravelGuide #TravelItinerary #WorldTravel #TripPlanning #TravelBlog #BangkokItinerary #TripPlanning",Southeast Asia Travel
Phuket in 5 Days — Complete Guide from $30/day,https://images.unsplash.com/photo-1589394815804-964ed0be2eb5?w=1000&q=85&fit=crop&ar=2:3,https://www.incredibleitinerary.com/blog/phuket-5-days,"Plan your Phuket trip with real prices. 5-day itinerary with budget, mid-range & luxury plans — hotel picks, Google Maps routes & insider tips. Free guide!  Phi Phi by speedboat, Old Phuket Town's Sino-Portuguese charm, Big Buddha at sunset, and why Rawai beats Patong for anyone who wants actual sleep.  #PhuketTravel #Phuket #ThailandTravel #TravelGuide #TravelItinerary #WorldTravel #TripPlanning #TravelBlog #BudgetTravel #TravelGuide",Southeast Asia Travel
5 Things to Know Before Visiting Phuket (2026),https://images.unsplash.com/photo-1589394815804-964ed0be2eb5?w=1000&q=85&fit=crop&ar=2:3,https://www.incredibleitinerary.com/blog/phuket-5-days,"Don't make these mistakes on your Phuket trip. Best time to visit, where to stay, what to eat & the tourist traps to avoid. Real traveller tips from our free guide.  #PhuketTravel #Phuket #ThailandTravel #TravelGuide #TravelItinerary #WorldTravel #TripPlanning #TravelBlog #TravelTips #TravelHacks",Southeast Asia Travel
The Perfect 5-Day Phuket Itinerary (2026),https://images.unsplash.com/photo-1589394815804-964ed0be2eb5?w=1000&q=85&fit=crop&ar=2:3,https://www.incredibleitinerary.com/blog/phuket-5-days,"Day-by-day Phuket plan with 4 travel styles — budget, couple, adventure & family. Real costs, real routes, real tips from IncredibleItinerary. Plan smarter, travel better!  Phi Phi by speedboat, Old Phuket Town's Sino-Portuguese charm, Big Buddha at sunset, and why Rawai beats Patong for anyone who wants actual sleep.  #PhuketTravel #Phuket #ThailandTravel #TravelGuide #TravelItinerary #WorldTravel #TripPlanning #TravelBlog #PhuketItinerary #TripPlanning",Southeast Asia Travel
Chiang Mai in 4 Days — Complete Guide from $30/day,https://images.unsplash.com/photo-1598935898639-81586f7d2129?w=1000&q=85&fit=crop&ar=2:3,https://www.incredibleitinerary.com/blog/chiang-mai-4-days,"Plan your Chiang Mai trip with real prices. 4-day itinerary with budget, mid-range & luxury plans — hotel picks, Google Maps routes & insider tips. Free guide!  Doi Suthep at sunrise, Sunday Night Market's mile-long food crawl, ethical elephant encounters, and a khao soi that changes your definition of curry.  #ChiangMaiTravel #ChiangMai #ThailandTravel #TravelGuide #TravelItinerary #WorldTravel #TripPlanning #TravelBlog #BudgetTravel #TravelGuide",Southeast Asia Travel
4 Things to Know Before Visiting Chiang Mai (2026),https://images.unsplash.com/photo-1598935898639-81586f7d2129?w=1000&q=85&fit=crop&ar=2:3,https://www.incredibleitinerary.com/blog/chiang-mai-4-days,"Don't make these mistakes on your Chiang Mai trip. Best time to visit, where to stay, what to eat & the tourist traps to avoid. Real traveller tips from our free guide.  #ChiangMaiTravel #ChiangMai #ThailandTravel #TravelGuide #TravelItinerary #WorldTravel #TripPlanning #TravelBlog #TravelTips #TravelHacks",Southeast Asia Travel
The Perfect 4-Day Chiang Mai Itinerary (2026),https://images.unsplash.com/photo-1598935898639-81586f7d2129?w=1000&q=85&fit=crop&ar=2:3,https://www.incredibleitinerary.com/blog/chiang-mai-4-days,"Day-by-day Chiang Mai plan with 4 travel styles — budget, couple, adventure & family. Real costs, real routes, real tips from IncredibleItinerary. Plan smarter, travel better!  Doi Suthep at sunrise, Sunday Night Market's mile-long food crawl, ethical elephant encounters, and a khao soi that changes your definition of curry.  #ChiangMaiTravel #ChiangMai #ThailandTravel #TravelGuide #TravelItinerary #WorldTravel #TripPlanning #TravelBlog #ChiangMaiItinerary #TripPlanning",Southeast Asia Travel
Tokyo in 5 Days — Complete Guide from $50/day,https://images.unsplash.com/photo-1540959733332-eab4deabeeaf?w=1000&q=85&fit=crop&ar=2:3,https://www.incredibleitinerary.com/blog/tokyo-5-days,"Plan your Tokyo trip with real prices. 5-day itinerary with budget, mid-range & luxury plans — hotel picks, Google Maps routes & insider tips. Free guide!  Shibuya Crossing at midnight, Tsukiji tuna auction, TeamLab borderless, konbini culture, and why a 7-Eleven onigiri at 2am is a peak Japan moment.  #TokyoTravel #Tokyo #JapanTravel #TravelGuide #TravelItinerary #WorldTravel #TripPlanning #TravelBlog #BudgetTravel #TravelGuide",Japan & East Asia Travel
5 Things to Know Before Visiting Tokyo (2026),https://images.unsplash.com/photo-1540959733332-eab4deabeeaf?w=1000&q=85&fit=crop&ar=2:3,https://www.incredibleitinerary.com/blog/tokyo-5-days,"Don't make these mistakes on your Tokyo trip. Best time to visit, where to stay, what to eat & the tourist traps to avoid. Real traveller tips from our free guide.  #TokyoTravel #Tokyo #JapanTravel #TravelGuide #TravelItinerary #WorldTravel #TripPlanning #TravelBlog #TravelTips #TravelHacks",Japan & East Asia Travel
The Perfect 5-Day Tokyo Itinerary (2026),https://images.unsplash.com/photo-1540959733332-eab4deabeeaf?w=1000&q=85&fit=crop&ar=2:3,https://www.incredibleitinerary.com/blog/tokyo-5-days,"Day-by-day Tokyo plan with 4 travel styles — budget, couple, adventure & family. Real costs, real routes, real tips from IncredibleItinerary. Plan smarter, travel better!  Shibuya Crossing at midnight, Tsukiji tuna auction, TeamLab borderless, konbini culture, and why a 7-Eleven onigiri at 2am is a peak Japan moment.  #TokyoTravel #Tokyo #JapanTravel #TravelGuide #TravelItinerary #WorldTravel #TripPlanning #TravelBlog #TokyoItinerary #TripPlanning",Japan & East Asia Travel
Kyoto in 4 Days — Complete Guide from $50/day,https://images.unsplash.com/photo-1493976040374-85c8e12f0c0e?w=1000&q=85&fit=crop&ar=2:3,https://www.incredibleitinerary.com/blog/kyoto-4-days,"Plan your Kyoto trip with real prices. 4-day itinerary with budget, mid-range & luxury plans — hotel picks, Google Maps routes & insider tips. Free guide!  Fushimi Inari at 6am with nobody there, Arashiyama bamboo in morning mist, a Gion evening walk where time stops, and the tea ceremony that recalibrates your brain.  #KyotoTravel #Kyoto #JapanTravel #TravelGuide #TravelItinerary #WorldTravel #TripPlanning #TravelBlog #BudgetTravel #TravelGuide",Japan & East Asia Travel
4 Things to Know Before Visiting Kyoto (2026),https://images.unsplash.com/photo-1493976040374-85c8e12f0c0e?w=1000&q=85&fit=crop&ar=2:3,https://www.incredibleitinerary.com/blog/kyoto-4-days,"Don't make these mistakes on your Kyoto trip. Best time to visit, where to stay, what to eat & the tourist traps to avoid. Real traveller tips from our free guide.  #KyotoTravel #Kyoto #JapanTravel #TravelGuide #TravelItinerary #WorldTravel #TripPlanning #TravelBlog #TravelTips #TravelHacks",Japan & East Asia Travel
The Perfect 4-Day Kyoto Itinerary (2026),https://images.unsplash.com/photo-1493976040374-85c8e12f0c0e?w=1000&q=85&fit=crop&ar=2:3,https://www.incredibleitinerary.com/blog/kyoto-4-days,"Day-by-day Kyoto plan with 4 travel styles — budget, couple, adventure & family. Real costs, real routes, real tips from IncredibleItinerary. Plan smarter, travel better!  Fushimi Inari at 6am with nobody there, Arashiyama bamboo in morning mist, a Gion evening walk where time stops, and the tea ceremony that recalibrates your brain.  #KyotoTravel #Kyoto #JapanTravel #TravelGuide #TravelItinerary #WorldTravel #TripPlanning #TravelBlog #KyotoItinerary #TripPlanning",Japan & East Asia Travel
Osaka in 3 Days — Complete Guide from $50/day,https://images.unsplash.com/photo-1590559899731-a382839e5549?w=1000&q=85&fit=crop&ar=2:3,https://www.incredibleitinerary.com/blog/osaka-3-days,"Plan your Osaka trip with real prices. 3-day itinerary with budget, mid-range & luxury plans — hotel picks, Google Maps routes & insider tips. Free guide!  Japan's kitchen — takoyaki from the stall that invented it, Dotonbori neon at night, Osaka Castle in cherry blossom, and why Osakans are Japan's funniest people.  #OsakaTravel #Osaka #JapanTravel #TravelGuide #TravelItinerary #WorldTravel #TripPlanning #TravelBlog #BudgetTravel #TravelGuide",Japan & East Asia Travel
3 Things to Know Before Visiting Osaka (2026),https://images.unsplash.com/photo-1590559899731-a382839e5549?w=1000&q=85&fit=crop&ar=2:3,https://www.incredibleitinerary.com/blog/osaka-3-days,"Don't make these mistakes on your Osaka trip. Best time to visit, where to stay, what to eat & the tourist traps to avoid. Real traveller tips from our free guide.  #OsakaTravel #Osaka #JapanTravel #TravelGuide #TravelItinerary #WorldTravel #TripPlanning #TravelBlog #TravelTips #TravelHacks",Japan & East Asia Travel
The Perfect 3-Day Osaka Itinerary (2026),https://images.unsplash.com/photo-1590559899731-a382839e5549?w=1000&q=85&fit=crop&ar=2:3,https://www.incredibleitinerary.com/blog/osaka-3-days,"Day-by-day Osaka plan with 4 travel styles — budget, couple, adventure & family. Real costs, real routes, real tips from IncredibleItinerary. Plan smarter, travel better!  Japan's kitchen — takoyaki from the stall that invented it, Dotonbori neon at night, Osaka Castle in cherry blossom, and why Osakans are Japan's funniest people.  #OsakaTravel #Osaka #JapanTravel #TravelGuide #TravelItinerary #WorldTravel #TripPlanning #TravelBlog #OsakaItinerary #TripPlanning",Japan & East Asia Travel
Rome in 4 Days — Complete Guide from $50/day,https://images.unsplash.com/photo-1552832230-c0197dd311b5?w=1000&q=85&fit=crop&ar=2:3,https://www.incredibleitinerary.com/blog/rome-4-days,"Plan your Rome trip with real prices. 4-day itinerary with budget, mid-range & luxury plans — hotel picks, Google Maps routes & insider tips. Free guide!  Colosseum at first entry, Sistine Chapel before the crowds, Trastevere food crawl at midnight, and why pizza al taglio from a hole-in-the-wall beats every restaurant.  #RomeTravel #Rome #ItalyTravel #TravelGuide #TravelItinerary #WorldTravel #TripPlanning #TravelBlog #BudgetTravel #TravelGuide",Europe Travel Guides
4 Things to Know Before Visiting Rome (2026),https://images.unsplash.com/photo-1552832230-c0197dd311b5?w=1000&q=85&fit=crop&ar=2:3,https://www.incredibleitinerary.com/blog/rome-4-days,"Don't make these mistakes on your Rome trip. Best time to visit, where to stay, what to eat & the tourist traps to avoid. Real traveller tips from our free guide.  #RomeTravel #Rome #ItalyTravel #TravelGuide #TravelItinerary #WorldTravel #TripPlanning #TravelBlog #TravelTips #TravelHacks",Europe Travel Guides
The Perfect 4-Day Rome Itinerary (2026),https://images.unsplash.com/photo-1552832230-c0197dd311b5?w=1000&q=85&fit=crop&ar=2:3,https://www.incredibleitinerary.com/blog/rome-4-days,"Day-by-day Rome plan with 4 travel styles — budget, couple, adventure & family. Real costs, real routes, real tips from IncredibleItinerary. Plan smarter, travel better!  Colosseum at first entry, Sistine Chapel before the crowds, Trastevere food crawl at midnight, and why pizza al taglio from a hole-in-the-wall beats every restaurant.  #RomeTravel #Rome #ItalyTravel #TravelGuide #TravelItinerary #WorldTravel #TripPlanning #TravelBlog #RomeItinerary #TripPlanning",Europe Travel Guides
Florence in 3 Days — Complete Guide from $50/day,https://images.unsplash.com/photo-1541370976299-4d24ebbc9077?w=1000&q=85&fit=crop&ar=2:3,https://www.incredibleitinerary.com/blog/florence-3-days,"Plan your Florence trip with real prices. 3-day itinerary with budget, mid-range & luxury plans — hotel picks, Google Maps routes & insider tips. Free guide!  Brunelleschi's Dome from inside, David in person, Piazzale Michelangelo at sunset with a glass of Chianti, and a lampredotto sandwich that changes everything.  #FlorenceTravel #Florence #ItalyTravel #TravelGuide #TravelItinerary #WorldTravel #TripPlanning #TravelBlog #BudgetTravel #TravelGuide",Europe Travel Guides
3 Things to Know Before Visiting Florence (2026),https://images.unsplash.com/photo-1541370976299-4d24ebbc9077?w=1000&q=85&fit=crop&ar=2:3,https://www.incredibleitinerary.com/blog/florence-3-days,"Don't make these mistakes on your Florence trip. Best time to visit, where to stay, what to eat & the tourist traps to avoid. Real traveller tips from our free guide.  #FlorenceTravel #Florence #ItalyTravel #TravelGuide #TravelItinerary #WorldTravel #TripPlanning #TravelBlog #TravelTips #TravelHacks",Europe Travel Guides
The Perfect 3-Day Florence Itinerary (2026),https://images.unsplash.com/photo-1541370976299-4d24ebbc9077?w=1000&q=85&fit=crop&ar=2:3,https://www.incredibleitinerary.com/blog/florence-3-days,"Day-by-day Florence plan with 4 travel styles — budget, couple, adventure & family. Real costs, real routes, real tips from IncredibleItinerary. Plan smarter, travel better!  Brunelleschi's Dome from inside, David in person, Piazzale Michelangelo at sunset with a glass of Chianti, and a lampredotto sandwich that changes everything.  #FlorenceTravel #Florence #ItalyTravel #TravelGuide #TravelItinerary #WorldTravel #TripPlanning #TravelBlog #FlorenceItinerary #TripPlanning",Europe Travel Guides
Amalfi Coast in 4 Days — Complete Guide from $50/day,https://images.unsplash.com/photo-1533104816931-20fa691ff6ca?w=1000&q=85&fit=crop&ar=2:3,https://www.incredibleitinerary.com/blog/amalfi-coast-4-days,"Plan your Amalfi Coast trip with real prices. 4-day itinerary with budget, mid-range & luxury plans — hotel picks, Google Maps routes & insider tips. Free guide!  Positano tumbling into the sea, Path of the Gods trek above the clouds, Capri by ferry, Ravello's infinity gardens, and why the SITA bus is both terrifying and essential.  #AmalfiCoastTravel #AmalfiCoast #ItalyTravel #TravelGuide #TravelItinerary #WorldTravel #TripPlanning #TravelBlog #BudgetTravel #TravelGuide",Europe Travel Guides
4 Things to Know Before Visiting Amalfi Coast (2026),https://images.unsplash.com/photo-1533104816931-20fa691ff6ca?w=1000&q=85&fit=crop&ar=2:3,https://www.incredibleitinerary.com/blog/amalfi-coast-4-days,"Don't make these mistakes on your Amalfi Coast trip. Best time to visit, where to stay, what to eat & the tourist traps to avoid. Real traveller tips from our free guide.  #AmalfiCoastTravel #AmalfiCoast #ItalyTravel #TravelGuide #TravelItinerary #WorldTravel #TripPlanning #TravelBlog #TravelTips #TravelHacks",Europe Travel Guides
The Perfect 4-Day Amalfi Coast Itinerary (2026),https://images.unsplash.com/photo-1533104816931-20fa691ff6ca?w=1000&q=85&fit=crop&ar=2:3,https://www.incredibleitinerary.com/blog/amalfi-coast-4-days,"Day-by-day Amalfi Coast plan with 4 travel styles — budget, couple, adventure & family. Real costs, real routes, real tips from IncredibleItinerary. Plan smarter, travel better!  Positano tumbling into the sea, Path of the Gods trek above the clouds, Capri by ferry, Ravello's infinity gardens, and why the SITA bus is both terrifying and essential.  #AmalfiCoastTravel #AmalfiCoast #ItalyTravel #TravelGuide #TravelItinerary #WorldTravel #TripPlanning #TravelBlog #AmalfiCoastItinerary #TripPlanning",Europe Travel Guides
Bali in 5 Days — Complete Guide from $30/day,https://images.unsplash.com/photo-1537996194471-e657df975ab4?w=1000&q=85&fit=crop&ar=2:3,https://www.incredibleitinerary.com/blog/bali-5-days,"Plan your Bali trip with real prices. 5-day itinerary with budget, mid-range & luxury plans — hotel picks, Google Maps routes & insider tips. Free guide!  Tegallalang rice terraces at sunrise, Uluwatu fire dance at sunset, Ubud's monkey forest, and why Canggu is overrated but Sidemen is life-changing.  #BaliTravel #Bali #IndonesiaTravel #TravelGuide #TravelItinerary #WorldTravel #TripPlanning #TravelBlog #BudgetTravel #TravelGuide",Southeast Asia Travel
5 Things to Know Before Visiting Bali (2026),https://images.unsplash.com/photo-1537996194471-e657df975ab4?w=1000&q=85&fit=crop&ar=2:3,https://www.incredibleitinerary.com/blog/bali-5-days,"Don't make these mistakes on your Bali trip. Best time to visit, where to stay, what to eat & the tourist traps to avoid. Real traveller tips from our free guide.  #BaliTravel #Bali #IndonesiaTravel #TravelGuide #TravelItinerary #WorldTravel #TripPlanning #TravelBlog #TravelTips #TravelHacks",Southeast Asia Travel
The Perfect 5-Day Bali Itinerary (2026),https://images.unsplash.com/photo-1537996194471-e657df975ab4?w=1000&q=85&fit=crop&ar=2:3,https://www.incredibleitinerary.com/blog/bali-5-days,"Day-by-day Bali plan with 4 travel styles — budget, couple, adventure & family. Real costs, real routes, real tips from IncredibleItinerary. Plan smarter, travel better!  Tegallalang rice terraces at sunrise, Uluwatu fire dance at sunset, Ubud's monkey forest, and why Canggu is overrated but Sidemen is life-changing.  #BaliTravel #Bali #IndonesiaTravel #TravelGuide #TravelItinerary #WorldTravel #TripPlanning #TravelBlog #BaliItinerary #TripPlanning",Southeast Asia Travel
Ubud in 3 Days — Complete Guide from $30/day,https://images.unsplash.com/photo-1555400038-63f5ba517a47?w=1000&q=85&fit=crop&ar=2:3,https://www.incredibleitinerary.com/blog/ubud-3-days,"Plan your Ubud trip with real prices. 3-day itinerary with budget, mid-range & luxury plans — hotel picks, Google Maps routes & insider tips. Free guide!  Bali's cultural heart — morning yoga overlooking a river valley, Sacred Monkey Forest, Tegallalang terraces, and art galleries that make you rethink what Bali is.  #UbudTravel #Ubud #IndonesiaTravel #TravelGuide #TravelItinerary #WorldTravel #TripPlanning #TravelBlog #BudgetTravel #TravelGuide",Southeast Asia Travel
3 Things to Know Before Visiting Ubud (2026),https://images.unsplash.com/photo-1555400038-63f5ba517a47?w=1000&q=85&fit=crop&ar=2:3,https://www.incredibleitinerary.com/blog/ubud-3-days,"Don't make these mistakes on your Ubud trip. Best time to visit, where to stay, what to eat & the tourist traps to avoid. Real traveller tips from our free guide.  #UbudTravel #Ubud #IndonesiaTravel #TravelGuide #TravelItinerary #WorldTravel #TripPlanning #TravelBlog #TravelTips #TravelHacks",Southeast Asia Travel
The Perfect 3-Day Ubud Itinerary (2026),https://images.unsplash.com/photo-1555400038-63f5ba517a47?w=1000&q=85&fit=crop&ar=2:3,https://www.incredibleitinerary.com/blog/ubud-3-days,"Day-by-day Ubud plan with 4 travel styles — budget, couple, adventure & family. Real costs, real routes, real tips from IncredibleItinerary. Plan smarter, travel better!  Bali's cultural heart — morning yoga overlooking a river valley, Sacred Monkey Forest, Tegallalang terraces, and art galleries that make you rethink what Bali is.  #UbudTravel #Ubud #IndonesiaTravel #TravelGuide #TravelItinerary #WorldTravel #TripPlanning #TravelBlog #UbudItinerary #TripPlanning",Southeast Asia Travel
Lombok in 4 Days — Complete Guide from $30/day,https://images.unsplash.com/photo-1570789210967-2cac24e2beee?w=1000&q=85&fit=crop&ar=2:3,https://www.incredibleitinerary.com/blog/lombok-4-days,"Plan your Lombok trip with real prices. 4-day itinerary with budget, mid-range & luxury plans — hotel picks, Google Maps routes & insider tips. Free guide!  What Bali was 20 years ago — Gili Trawangan snorkeling, pink sand beaches, Mount Rinjani views, and zero traffic jams. Lombok is Bali without the crowds.  #LombokTravel #Lombok #IndonesiaTravel #TravelGuide #TravelItinerary #WorldTravel #TripPlanning #TravelBlog #BudgetTravel #TravelGuide",Southeast Asia Travel
4 Things to Know Before Visiting Lombok (2026),https://images.unsplash.com/photo-1570789210967-2cac24e2beee?w=1000&q=85&fit=crop&ar=2:3,https://www.incredibleitinerary.com/blog/lombok-4-days,"Don't make these mistakes on your Lombok trip. Best time to visit, where to stay, what to eat & the tourist traps to avoid. Real traveller tips from our free guide.  #LombokTravel #Lombok #IndonesiaTravel #TravelGuide #TravelItinerary #WorldTravel #TripPlanning #TravelBlog #TravelTips #TravelHacks",Southeast Asia Travel
