Title,Media URL,Link,Description,Pinterest board
The Perfect 4-Day Lombok Itinerary (2026),https://images.unsplash.com/photo-1570789210967-2cac24e2beee?w=1000&q=85&fit=crop&ar=2:3,https://www.incredibleitinerary.com/blog/lombok-4-days,"Day-by-day Lombok plan with 4 travel styles — budget, couple, adventure & family. Real costs, real routes, real tips from IncredibleItinerary. Plan smarter, travel better!  What Bali was 20 years ago — Gili Trawangan snorkeling, pink sand beaches, Mount Rinjani views, and zero traffic jams. Lombok is Bali without the crowds.  #LombokTravel #Lombok #IndonesiaTravel #TravelGuide #TravelItinerary #WorldTravel #TripPlanning #TravelBlog #LombokItinerary #TripPlanning",Southeast Asia Travel
Dubai in 4 Days — Complete Guide from $80/day,https://images.unsplash.com/photo-1512453979798-5ea266f8880c?w=1000&q=85&fit=crop&ar=2:3,https://www.incredibleitinerary.com/blog/dubai-4-days,"Plan your Dubai trip with real prices. 4-day itinerary with budget, mid-range & luxury plans — hotel picks, Google Maps routes & insider tips. Free guide!  Burj Khalifa at sunrise before the crowds, desert safari at sunset, Old Dubai spice walks, and why the Dubai Frame is the most underrated attraction in the city.  #DubaiTravel #Dubai #UAETravel #TravelGuide #TravelItinerary #WorldTravel #TripPlanning #TravelBlog #BudgetTravel #TravelGuide",Middle East Travel
4 Things to Know Before Visiting Dubai (2026),https://images.unsplash.com/photo-1512453979798-5ea266f8880c?w=1000&q=85&fit=crop&ar=2:3,https://www.incredibleitinerary.com/blog/dubai-4-days,"Don't make these mistakes on your Dubai trip. Best time to visit, where to stay, what to eat & the tourist traps to avoid. Real traveller tips from our free guide.  #DubaiTravel #Dubai #UAETravel #TravelGuide #TravelItinerary #WorldTravel #TripPlanning #TravelBlog #TravelTips #TravelHacks",Middle East Travel
The Perfect 4-Day Dubai Itinerary (2026),https://images.unsplash.com/photo-1512453979798-5ea266f8880c?w=1000&q=85&fit=crop&ar=2:3,https://www.incredibleitinerary.com/blog/dubai-4-days,"Day-by-day Dubai plan with 4 travel styles — budget, couple, adventure & family. Real costs, real routes, real tips from IncredibleItinerary. Plan smarter, travel better!  Burj Khalifa at sunrise before the crowds, desert safari at sunset, Old Dubai spice walks, and why the Dubai Frame is the most underrated attraction in the city.  #DubaiTravel #Dubai #UAETravel #TravelGuide #TravelItinerary #WorldTravel #TripPlanning #TravelBlog #DubaiItinerary #TripPlanning",Middle East Travel
Abu Dhabi in 3 Days — Complete Guide from $80/day,https://images.unsplash.com/photo-1512632578888-169bbbc64f33?w=1000&q=85&fit=crop&ar=2:3,https://www.incredibleitinerary.com/blog/abu-dhabi-3-days,"Plan your Abu Dhabi trip with real prices. 3-day itinerary with budget, mid-range & luxury plans — hotel picks, Google Maps routes & insider tips. Free guide!  Sheikh Zayed Grand Mosque at golden hour is the most beautiful building in the Middle East. Add the Louvre Abu Dhabi, Yas Island, and a desert overnight.  #AbuDhabiTravel #AbuDhabi #UAETravel #TravelGuide #TravelItinerary #WorldTravel #TripPlanning #TravelBlog #BudgetTravel #TravelGuide",Middle East Travel
3 Things to Know Before Visiting Abu Dhabi (2026),https://images.unsplash.com/photo-1512632578888-169bbbc64f33?w=1000&q=85&fit=crop&ar=2:3,https://www.incredibleitinerary.com/blog/abu-dhabi-3-days,"Don't make these mistakes on your Abu Dhabi trip. Best time to visit, where to stay, what to eat & the tourist traps to avoid. Real traveller tips from our free guide.  #AbuDhabiTravel #AbuDhabi #UAETravel #TravelGuide #TravelItinerary #WorldTravel #TripPlanning #TravelBlog #TravelTips #TravelHacks",Middle East Travel
The Perfect 3-Day Abu Dhabi Itinerary (2026),https://images.unsplash.com/photo-1512632578888-169bbbc64f33?w=1000&q=85&fit=crop&ar=2:3,https://www.incredibleitinerary.com/blog/abu-dhabi-3-days,"Day-by-day Abu Dhabi plan with 4 travel styles — budget, couple, adventure & family. Real costs, real routes, real tips from IncredibleItinerary. Plan smarter, travel better!  Sheikh Zayed Grand Mosque at golden hour is the most beautiful building in the Middle East. Add the Louvre Abu Dhabi, Yas Island, and a desert overnight.  #AbuDhabiTravel #AbuDhabi #UAETravel #TravelGuide #TravelItinerary #WorldTravel #TripPlanning #TravelBlog #AbuDhabiItinerary #TripPlanning",Middle East Travel
Muscat in 3 Days — Complete Guide from $80/day,https://images.unsplash.com/photo-1587974928442-77dc3e0748b1?w=1000&q=85&fit=crop&ar=2:3,https://www.incredibleitinerary.com/blog/muscat-3-days,"Plan your Muscat trip with real prices. 3-day itinerary with budget, mid-range & luxury plans — hotel picks, Google Maps routes & insider tips. Free guide!  The Middle East without the glitz — dramatic wadis, the Sultan Qaboos Grand Mosque, frankincense souks, and an Arabian hospitality that puts Dubai to shame.  #MuscatTravel #Muscat #OmanTravel #TravelGuide #TravelItinerary #WorldTravel #TripPlanning #TravelBlog #BudgetTravel #TravelGuide",Middle East Travel
3 Things to Know Before Visiting Muscat (2026),https://images.unsplash.com/photo-1587974928442-77dc3e0748b1?w=1000&q=85&fit=crop&ar=2:3,https://www.incredibleitinerary.com/blog/muscat-3-days,"Don't make these mistakes on your Muscat trip. Best time to visit, where to stay, what to eat & the tourist traps to avoid. Real traveller tips from our free guide.  #MuscatTravel #Muscat #OmanTravel #TravelGuide #TravelItinerary #WorldTravel #TripPlanning #TravelBlog #TravelTips #TravelHacks",Middle East Travel
The Perfect 3-Day Muscat Itinerary (2026),https://images.unsplash.com/photo-1587974928442-77dc3e0748b1?w=1000&q=85&fit=crop&ar=2:3,https://www.incredibleitinerary.com/blog/muscat-3-days,"Day-by-day Muscat plan with 4 travel styles — budget, couple, adventure & family. Real costs, real routes, real tips from IncredibleItinerary. Plan smarter, travel better!  The Middle East without the glitz — dramatic wadis, the Sultan Qaboos Grand Mosque, frankincense souks, and an Arabian hospitality that puts Dubai to shame.  #MuscatTravel #Muscat #OmanTravel #TravelGuide #TravelItinerary #WorldTravel #TripPlanning #TravelBlog #MuscatItinerary #TripPlanning",Middle East Travel
Barcelona in 4 Days — Complete Guide from $50/day,https://images.unsplash.com/photo-1583422409516-2895a77efded?w=1000&q=85&fit=crop&ar=2:3,https://www.incredibleitinerary.com/blog/barcelona-4-days,"Plan your Barcelona trip with real prices. 4-day itinerary with budget, mid-range & luxury plans — hotel picks, Google Maps routes & insider tips. Free guide!  Gaudi's unfinished masterpiece, Gothic Quarter maze walks, Barceloneta beach, La Boqueria market, and why the best tapas are 3 streets away from Las Ramblas.  #BarcelonaTravel #Barcelona #SpainTravel #TravelGuide #TravelItinerary #WorldTravel #TripPlanning #TravelBlog #BudgetTravel #TravelGuide",Europe Travel Guides
4 Things to Know Before Visiting Barcelona (2026),https://images.unsplash.com/photo-1583422409516-2895a77efded?w=1000&q=85&fit=crop&ar=2:3,https://www.incredibleitinerary.com/blog/barcelona-4-days,"Don't make these mistakes on your Barcelona trip. Best time to visit, where to stay, what to eat & the tourist traps to avoid. Real traveller tips from our free guide.  #BarcelonaTravel #Barcelona #SpainTravel #TravelGuide #TravelItinerary #WorldTravel #TripPlanning #TravelBlog #TravelTips #TravelHacks",Europe Travel Guides
The Perfect 4-Day Barcelona Itinerary (2026),https://images.unsplash.com/photo-1583422409516-2895a77efded?w=1000&q=85&fit=crop&ar=2:3,https://www.incredibleitinerary.com/blog/barcelona-4-days,"Day-by-day Barcelona plan with 4 travel styles — budget, couple, adventure & family. Real costs, real routes, real tips from IncredibleItinerary. Plan smarter, travel better!  Gaudi's unfinished masterpiece, Gothic Quarter maze walks, Barceloneta beach, La Boqueria market, and why the best tapas are 3 streets away from Las Ramblas.  #BarcelonaTravel #Barcelona #SpainTravel #TravelGuide #TravelItinerary #WorldTravel #TripPlanning #TravelBlog #BarcelonaItinerary #TripPlanning",Europe Travel Guides
Madrid in 3 Days — Complete Guide from $50/day,https://images.unsplash.com/photo-1539037116277-4db20889f2d4?w=1000&q=85&fit=crop&ar=2:3,https://www.incredibleitinerary.com/blog/madrid-3-days,"Plan your Madrid trip with real prices. 3-day itinerary with budget, mid-range & luxury plans — hotel picks, Google Maps routes & insider tips. Free guide!  The Prado at opening, Royal Palace grandeur, a midnight tapas crawl through La Latina, and a flamenco show that explains why Spain stays up past midnight.  #MadridTravel #Madrid #SpainTravel #TravelGuide #TravelItinerary #WorldTravel #TripPlanning #TravelBlog #BudgetTravel #TravelGuide",Europe Travel Guides
3 Things to Know Before Visiting Madrid (2026),https://images.unsplash.com/photo-1539037116277-4db20889f2d4?w=1000&q=85&fit=crop&ar=2:3,https://www.incredibleitinerary.com/blog/madrid-3-days,"Don't make these mistakes on your Madrid trip. Best time to visit, where to stay, what to eat & the tourist traps to avoid. Real traveller tips from our free guide.  #MadridTravel #Madrid #SpainTravel #TravelGuide #TravelItinerary #WorldTravel #TripPlanning #TravelBlog #TravelTips #TravelHacks",Europe Travel Guides
The Perfect 3-Day Madrid Itinerary (2026),https://images.unsplash.com/photo-1539037116277-4db20889f2d4?w=1000&q=85&fit=crop&ar=2:3,https://www.incredibleitinerary.com/blog/madrid-3-days,"Day-by-day Madrid plan with 4 travel styles — budget, couple, adventure & family. Real costs, real routes, real tips from IncredibleItinerary. Plan smarter, travel better!  The Prado at opening, Royal Palace grandeur, a midnight tapas crawl through La Latina, and a flamenco show that explains why Spain stays up past midnight.  #MadridTravel #Madrid #SpainTravel #TravelGuide #TravelItinerary #WorldTravel #TripPlanning #TravelBlog #MadridItinerary #TripPlanning",Europe Travel Guides
Seville in 3 Days — Complete Guide from $50/day,https://images.unsplash.com/photo-1515443961218-a51367888e4b?w=1000&q=85&fit=crop&ar=2:3,https://www.incredibleitinerary.com/blog/seville-3-days,"Plan your Seville trip with real prices. 3-day itinerary with budget, mid-range & luxury plans — hotel picks, Google Maps routes & insider tips. Free guide!  The Real Alcazar is the most beautiful palace in Europe and nobody outside Spain knows it. Add Plaza de Espana, authentic flamenco, and streets lined with orange trees.  #SevilleTravel #Seville #SpainTravel #TravelGuide #TravelItinerary #WorldTravel #TripPlanning #TravelBlog #BudgetTravel #TravelGuide",Europe Travel Guides
3 Things to Know Before Visiting Seville (2026),https://images.unsplash.com/photo-1515443961218-a51367888e4b?w=1000&q=85&fit=crop&ar=2:3,https://www.incredibleitinerary.com/blog/seville-3-days,"Don't make these mistakes on your Seville trip. Best time to visit, where to stay, what to eat & the tourist traps to avoid. Real traveller tips from our free guide.  #SevilleTravel #Seville #SpainTravel #TravelGuide #TravelItinerary #WorldTravel #TripPlanning #TravelBlog #TravelTips #TravelHacks",Europe Travel Guides
The Perfect 3-Day Seville Itinerary (2026),https://images.unsplash.com/photo-1515443961218-a51367888e4b?w=1000&q=85&fit=crop&ar=2:3,https://www.incredibleitinerary.com/blog/seville-3-days,"Day-by-day Seville plan with 4 travel styles — budget, couple, adventure & family. Real costs, real routes, real tips from IncredibleItinerary. Plan smarter, travel better!  The Real Alcazar is the most beautiful palace in Europe and nobody outside Spain knows it. Add Plaza de Espana, authentic flamenco, and streets lined with orange trees.  #SevilleTravel #Seville #SpainTravel #TravelGuide #TravelItinerary #WorldTravel #TripPlanning #TravelBlog #SevilleItinerary #TripPlanning",Europe Travel Guides
Hanoi in 3 Days — Complete Guide from $30/day,https://images.unsplash.com/photo-1559592413-7cec4d0cae2b?w=1000&q=85&fit=crop&ar=2:3,https://www.incredibleitinerary.com/blog/hanoi-3-days,"Plan your Hanoi trip with real prices. 3-day itinerary with budget, mid-range & luxury plans — hotel picks, Google Maps routes & insider tips. Free guide!  Vietnam's capital rewards slow walkers — Hoan Kiem Lake at dawn, 36 streets of the Old Quarter, egg coffee in a hidden rooftop cafe, and pho at 7am with locals.  #HanoiTravel #Hanoi #VietnamTravel #TravelGuide #TravelItinerary #WorldTravel #TripPlanning #TravelBlog #BudgetTravel #TravelGuide",Southeast Asia Travel
3 Things to Know Before Visiting Hanoi (2026),https://images.unsplash.com/photo-1559592413-7cec4d0cae2b?w=1000&q=85&fit=crop&ar=2:3,https://www.incredibleitinerary.com/blog/hanoi-3-days,"Don't make these mistakes on your Hanoi trip. Best time to visit, where to stay, what to eat & the tourist traps to avoid. Real traveller tips from our free guide.  #HanoiTravel #Hanoi #VietnamTravel #TravelGuide #TravelItinerary #WorldTravel #TripPlanning #TravelBlog #TravelTips #TravelHacks",Southeast Asia Travel
The Perfect 3-Day Hanoi Itinerary (2026),https://images.unsplash.com/photo-1559592413-7cec4d0cae2b?w=1000&q=85&fit=crop&ar=2:3,https://www.incredibleitinerary.com/blog/hanoi-3-days,"Day-by-day Hanoi plan with 4 travel styles — budget, couple, adventure & family. Real costs, real routes, real tips from IncredibleItinerary. Plan smarter, travel better!  Vietnam's capital rewards slow walkers — Hoan Kiem Lake at dawn, 36 streets of the Old Quarter, egg coffee in a hidden rooftop cafe, and pho at 7am with locals.  #HanoiTravel #Hanoi #VietnamTravel #TravelGuide #TravelItinerary #WorldTravel #TripPlanning #TravelBlog #HanoiItinerary #TripPlanning",Southeast Asia Travel
Ho Chi Minh City in 3 Days — Complete Guide from $30/day,https://images.unsplash.com/photo-1583417319070-4a69db38a482?w=1000&q=85&fit=crop&ar=2:3,https://www.incredibleitinerary.com/blog/ho-chi-minh-city-3-days,"Plan your Ho Chi Minh City trip with real prices. 3-day itinerary with budget, mid-range & luxury plans — hotel picks, Google Maps routes & insider tips. Free guide!  Saigon never sleeps — Cu Chi Tunnels underground, War Remnants Museum, Ben Thanh Market chaos, and banh mi from the cart that's been on the same corner for 30 years.  #HoChiMinhCityTravel #HoChiMinhCity #VietnamTravel #TravelGuide #TravelItinerary #WorldTravel #TripPlanning #TravelBlog #BudgetTravel #TravelGuide",Southeast Asia Travel
3 Things to Know Before Visiting Ho Chi Minh City (2026),https://images.unsplash.com/photo-1583417319070-4a69db38a482?w=1000&q=85&fit=crop&ar=2:3,https://www.incredibleitinerary.com/blog/ho-chi-minh-city-3-days,"Don't make these mistakes on your Ho Chi Minh City trip. Best time to visit, where to stay, what to eat & the tourist traps to avoid. Real traveller tips from our free guide.  #HoChiMinhCityTravel #HoChiMinhCity #VietnamTravel #TravelGuide #TravelItinerary #WorldTravel #TripPlanning #TravelBlog #TravelTips #TravelHacks",Southeast Asia Travel
The Perfect 3-Day Ho Chi Minh City Itinerary (2026),https://images.unsplash.com/photo-1583417319070-4a69db38a482?w=1000&q=85&fit=crop&ar=2:3,https://www.incredibleitinerary.com/blog/ho-chi-minh-city-3-days,"Day-by-day Ho Chi Minh City plan with 4 travel styles — budget, couple, adventure & family. Real costs, real routes, real tips from IncredibleItinerary. Plan smarter, travel better!  Saigon never sleeps — Cu Chi Tunnels underground, War Remnants Museum, Ben Thanh Market chaos, and banh mi from the cart that's been on the same corner for 30 years.  #HoChiMinhCityTravel #HoChiMinhCity #VietnamTravel #TravelGuide #TravelItinerary #WorldTravel #TripPlanning #TravelBlog #HoChiMinhCityItinerary…",Southeast Asia Travel
Ha Long Bay in 3 Days — Complete Guide from $30/day,https://images.unsplash.com/photo-1573270689103-d7a4e42b609a?w=1000&q=85&fit=crop&ar=2:3,https://www.incredibleitinerary.com/blog/ha-long-bay-3-days,"Plan your Ha Long Bay trip with real prices. 3-day itinerary with budget, mid-range & luxury plans — hotel picks, Google Maps routes & insider tips. Free guide!  2,000 limestone islands rising from emerald water — kayak through hidden lagoons, sleep on a junk boat, watch sunrise over karsts, and find the cave nobody's heard of.  #HaLongBayTravel #HaLongBay #VietnamTravel #TravelGuide #TravelItinerary #WorldTravel #TripPlanning #TravelBlog #BudgetTravel #TravelGuide",Southeast Asia Travel
3 Things to Know Before Visiting Ha Long Bay (2026),https://images.unsplash.com/photo-1573270689103-d7a4e42b609a?w=1000&q=85&fit=crop&ar=2:3,https://www.incredibleitinerary.com/blog/ha-long-bay-3-days,"Don't make these mistakes on your Ha Long Bay trip. Best time to visit, where to stay, what to eat & the tourist traps to avoid. Real traveller tips from our free guide.  #HaLongBayTravel #HaLongBay #VietnamTravel #TravelGuide #TravelItinerary #WorldTravel #TripPlanning #TravelBlog #TravelTips #TravelHacks",Southeast Asia Travel
The Perfect 3-Day Ha Long Bay Itinerary (2026),https://images.unsplash.com/photo-1573270689103-d7a4e42b609a?w=1000&q=85&fit=crop&ar=2:3,https://www.incredibleitinerary.com/blog/ha-long-bay-3-days,"Day-by-day Ha Long Bay plan with 4 travel styles — budget, couple, adventure & family. Real costs, real routes, real tips from IncredibleItinerary. Plan smarter, travel better!  2,000 limestone islands rising from emerald water — kayak through hidden lagoons, sleep on a junk boat, watch sunrise over karsts, and find the cave nobody's heard of.  #HaLongBayTravel #HaLongBay #VietnamTravel #TravelGuide #TravelItinerary #WorldTravel #TripPlanning #TravelBlog #HaLongBayItinerary #TripPlanning",Southeast Asia Travel