Title,Media URL,Link,Description,Pinterest board
The Perfect 3-Day Varkala Itinerary (2026),https://images.unsplash.com/photo-1512343879784-a960bf40e7f2?w=1000&q=85&fit=crop&ar=2:3,https://www.incredibleitinerary.com/blog/varkala-3-days,"Day-by-day Varkala plan with 4 travel styles — budget, couple, adventure & family. Real costs, real routes, real tips from IncredibleItinerary. Plan smarter, travel better!  The red laterite cliffs over the Arabian Sea, Papanasam beach, yoga shalas, and the most laid-back Kerala vibe you'll find anywhere.  #VarkalaTravel #Varkala #IncredibleIndia #TravelGuide #TravelItinerary #IndiaTravel #TripPlanning #TravelBlog #VarkalaItinerary #TripPlanning",Spiritual India
Thekkady in 3 Days — Complete Guide from ₹800/day,https://images.unsplash.com/photo-1544117519-31a4b719223d?w=1000&q=85&fit=crop&ar=2:3,https://www.incredibleitinerary.com/blog/thekkady-3-days,"Plan your Thekkady trip with real prices. 3-day itinerary with budget, mid-range & luxury plans — hotel picks, Google Maps routes & insider tips. Free guide!  Periyar Tiger Reserve boat safari, spice plantation walks, tribal homestays, and a bamboo rafting experience you won't find anywhere else in India.  #ThekkadyTravel #Thekkady #IncredibleIndia #TravelGuide #TravelItinerary #IndiaTravel #TripPlanning #TravelBlog #BudgetTravel #TravelGuide",India Travel Guides
3 Things to Know Before Visiting Thekkady (2026),https://images.unsplash.com/photo-1544117519-31a4b719223d?w=1000&q=85&fit=crop&ar=2:3,https://www.incredibleitinerary.com/blog/thekkady-3-days,"Don't make these mistakes on your Thekkady trip. Best time to visit, where to stay, what to eat & the tourist traps to avoid. Real traveller tips from our free guide.  #ThekkadyTravel #Thekkady #IncredibleIndia #TravelGuide #TravelItinerary #IndiaTravel #TripPlanning #TravelBlog #TravelTips #TravelHacks",India Travel Guides
The Perfect 3-Day Thekkady Itinerary (2026),https://images.unsplash.com/photo-1544117519-31a4b719223d?w=1000&q=85&fit=crop&ar=2:3,https://www.incredibleitinerary.com/blog/thekkady-3-days,"Day-by-day Thekkady plan with 4 travel styles — budget, couple, adventure & family. Real costs, real routes, real tips from IncredibleItinerary. Plan smarter, travel better!  Periyar Tiger Reserve boat safari, spice plantation walks, tribal homestays, and a bamboo rafting experience you won't find anywhere else in India.  #ThekkadyTravel #Thekkady #IncredibleIndia #TravelGuide #TravelItinerary #IndiaTravel #TripPlanning #TravelBlog #ThekkadyItinerary #TripPlanning",India Travel Guides
Chikmagalur in 3 Days — Complete Guide from ₹800/day,https://images.unsplash.com/photo-1561361058-c24cecae35ca?w=1000&q=85&fit=crop&ar=2:3,https://www.incredibleitinerary.com/blog/chikmagalur-3-days,"Plan your Chikmagalur trip with real prices. 3-day itinerary with budget, mid-range & luxury plans — hotel picks, Google Maps routes & insider tips. Free guide!  India's coffee heartland — Mullayanagiri peak, Baba Budangiri caves, cloud-wrapped coffee estates, and sunrises that make waking up at 5am worth it.  #ChikmagalurTravel #Chikmagalur #IncredibleIndia #TravelGuide #TravelItinerary #IndiaTravel #TripPlanning #TravelBlog #BudgetTravel #TravelGuide",Himalayan Adventures
3 Things to Know Before Visiting Chikmagalur (2026),https://images.unsplash.com/photo-1561361058-c24cecae35ca?w=1000&q=85&fit=crop&ar=2:3,https://www.incredibleitinerary.com/blog/chikmagalur-3-days,"Don't make these mistakes on your Chikmagalur trip. Best time to visit, where to stay, what to eat & the tourist traps to avoid. Real traveller tips from our free guide.  #ChikmagalurTravel #Chikmagalur #IncredibleIndia #TravelGuide #TravelItinerary #IndiaTravel #TripPlanning #TravelBlog #TravelTips #TravelHacks",Himalayan Adventures
The Perfect 3-Day Chikmagalur Itinerary (2026),https://images.unsplash.com/photo-1561361058-c24cecae35ca?w=1000&q=85&fit=crop&ar=2:3,https://www.incredibleitinerary.com/blog/chikmagalur-3-days,"Day-by-day Chikmagalur plan with 4 travel styles — budget, couple, adventure & family. Real costs, real routes, real tips from IncredibleItinerary. Plan smarter, travel better!  India's coffee heartland — Mullayanagiri peak, Baba Budangiri caves, cloud-wrapped coffee estates, and sunrises that make waking up at 5am worth it.  #ChikmagalurTravel #Chikmagalur #IncredibleIndia #TravelGuide #TravelItinerary #IndiaTravel #TripPlanning #TravelBlog #ChikmagalurItinerary #TripPlanning",Himalayan Adventures
Mahabalipuram in 2 Days — Complete Guide from ₹800/day,https://images.unsplash.com/photo-1602928321679-560bb453f190?w=1000&q=85&fit=crop&ar=2:3,https://www.incredibleitinerary.com/blog/mahabalipuram-2-days,"Plan your Mahabalipuram trip with real prices. 2-day itinerary with budget, mid-range & luxury plans — hotel picks, Google Maps routes & insider tips. Free guide!  The Shore Temple stands in the Bay of Bengal surf — 1,300 years old. Arjuna's Penance, the Five Rathas, and a beach so photogenic it barely looks real.  #MahabalipuramTravel #Mahabalipuram #IncredibleIndia #TravelGuide #TravelItinerary #IndiaTravel #TripPlanning #TravelBlog #BudgetTravel #TravelGuide",Spiritual India
2 Things to Know Before Visiting Mahabalipuram (2026),https://images.unsplash.com/photo-1602928321679-560bb453f190?w=1000&q=85&fit=crop&ar=2:3,https://www.incredibleitinerary.com/blog/mahabalipuram-2-days,"Don't make these mistakes on your Mahabalipuram trip. Best time to visit, where to stay, what to eat & the tourist traps to avoid. Real traveller tips from our free guide.  #MahabalipuramTravel #Mahabalipuram #IncredibleIndia #TravelGuide #TravelItinerary #IndiaTravel #TripPlanning #TravelBlog #TravelTips #TravelHacks",Spiritual India
The Perfect 2-Day Mahabalipuram Itinerary (2026),https://images.unsplash.com/photo-1602928321679-560bb453f190?w=1000&q=85&fit=crop&ar=2:3,https://www.incredibleitinerary.com/blog/mahabalipuram-2-days,"Day-by-day Mahabalipuram plan with 4 travel styles — budget, couple, adventure & family. Real costs, real routes, real tips from IncredibleItinerary. Plan smarter, travel better!  The Shore Temple stands in the Bay of Bengal surf — 1,300 years old. Arjuna's Penance, the Five Rathas, and a beach so photogenic it barely looks real.  #MahabalipuramTravel #Mahabalipuram #IncredibleIndia #TravelGuide #TravelItinerary #IndiaTravel #TripPlanning #TravelBlog #MahabalipuramItinerary #TripPlanning",Spiritual India
Tirupati in 2 Days — Complete Guide from ₹800/day,https://images.unsplash.com/photo-1624555130581-1d9cca783bc0?w=1000&q=85&fit=crop&ar=2:3,https://www.incredibleitinerary.com/blog/tirupati-2-days,"Plan your Tirupati trip with real prices. 2-day itinerary with budget, mid-range & luxury plans — hotel picks, Google Maps routes & insider tips. Free guide!  The world's most visited religious site — 80,000 pilgrims per day. Exactly how to book darshan, what time to arrive, which line to join, and what to do in Tirumala.  #TirupatiTravel #Tirupati #IncredibleIndia #TravelGuide #TravelItinerary #IndiaTravel #TripPlanning #TravelBlog #BudgetTravel #TravelGuide",Spiritual India
2 Things to Know Before Visiting Tirupati (2026),https://images.unsplash.com/photo-1624555130581-1d9cca783bc0?w=1000&q=85&fit=crop&ar=2:3,https://www.incredibleitinerary.com/blog/tirupati-2-days,"Don't make these mistakes on your Tirupati trip. Best time to visit, where to stay, what to eat & the tourist traps to avoid. Real traveller tips from our free guide.  #TirupatiTravel #Tirupati #IncredibleIndia #TravelGuide #TravelItinerary #IndiaTravel #TripPlanning #TravelBlog #TravelTips #TravelHacks",Spiritual India
The Perfect 2-Day Tirupati Itinerary (2026),https://images.unsplash.com/photo-1624555130581-1d9cca783bc0?w=1000&q=85&fit=crop&ar=2:3,https://www.incredibleitinerary.com/blog/tirupati-2-days,"Day-by-day Tirupati plan with 4 travel styles — budget, couple, adventure & family. Real costs, real routes, real tips from IncredibleItinerary. Plan smarter, travel better!  The world's most visited religious site — 80,000 pilgrims per day. Exactly how to book darshan, what time to arrive, which line to join, and what to do in Tirumala.  #TirupatiTravel #Tirupati #IncredibleIndia #TravelGuide #TravelItinerary #IndiaTravel #TripPlanning #TravelBlog #TirupatiItinerary #TripPlanning",Spiritual India
Puri in 3 Days — Complete Guide from ₹800/day,https://images.unsplash.com/photo-1625819718540-f6e8c65e06d7?w=1000&q=85&fit=crop&ar=2:3,https://www.incredibleitinerary.com/blog/puri-3-days,"Plan your Puri trip with real prices. 3-day itinerary with budget, mid-range & luxury plans — hotel picks, Google Maps routes & insider tips. Free guide!  One of India's four sacred dhams, a wide golden beach, and the Sun Temple at Konark just 35km away — Odisha's coast in 3 perfect days.  #PuriTravel #Puri #IncredibleIndia #TravelGuide #TravelItinerary #IndiaTravel #TripPlanning #TravelBlog #BudgetTravel #TravelGuide",Spiritual India
3 Things to Know Before Visiting Puri (2026),https://images.unsplash.com/photo-1625819718540-f6e8c65e06d7?w=1000&q=85&fit=crop&ar=2:3,https://www.incredibleitinerary.com/blog/puri-3-days,"Don't make these mistakes on your Puri trip. Best time to visit, where to stay, what to eat & the tourist traps to avoid. Real traveller tips from our free guide.  #PuriTravel #Puri #IncredibleIndia #TravelGuide #TravelItinerary #IndiaTravel #TripPlanning #TravelBlog #TravelTips #TravelHacks",Spiritual India
The Perfect 3-Day Puri Itinerary (2026),https://images.unsplash.com/photo-1625819718540-f6e8c65e06d7?w=1000&q=85&fit=crop&ar=2:3,https://www.incredibleitinerary.com/blog/puri-3-days,"Day-by-day Puri plan with 4 travel styles — budget, couple, adventure & family. Real costs, real routes, real tips from IncredibleItinerary. Plan smarter, travel better!  One of India's four sacred dhams, a wide golden beach, and the Sun Temple at Konark just 35km away — Odisha's coast in 3 perfect days.  #PuriTravel #Puri #IncredibleIndia #TravelGuide #TravelItinerary #IndiaTravel #TripPlanning #TravelBlog #PuriItinerary #TripPlanning",Spiritual India
Bhubaneswar in 3 Days — Complete Guide from ₹800/day,https://images.unsplash.com/photo-1558431382-27e303142255?w=1000&q=85&fit=crop&ar=2:3,https://www.incredibleitinerary.com/blog/bhubaneswar-3-days,"Plan your Bhubaneswar trip with real prices. 3-day itinerary with budget, mid-range & luxury plans — hotel picks, Google Maps routes & insider tips. Free guide!  Odisha's capital has over 500 ancient temples within 5km² — Lingaraj, Mukteshvara, Rajarani — plus the best Odissi dance and Pattachitra art in the world.  #BhubaneswarTravel #Bhubaneswar #IncredibleIndia #TravelGuide #TravelItinerary #IndiaTravel #TripPlanning #TravelBlog #BudgetTravel #TravelGuide",Spiritual India
3 Things to Know Before Visiting Bhubaneswar (2026),https://images.unsplash.com/photo-1558431382-27e303142255?w=1000&q=85&fit=crop&ar=2:3,https://www.incredibleitinerary.com/blog/bhubaneswar-3-days,"Don't make these mistakes on your Bhubaneswar trip. Best time to visit, where to stay, what to eat & the tourist traps to avoid. Real traveller tips from our free guide.  #BhubaneswarTravel #Bhubaneswar #IncredibleIndia #TravelGuide #TravelItinerary #IndiaTravel #TripPlanning #TravelBlog #TravelTips #TravelHacks",Spiritual India
The Perfect 3-Day Bhubaneswar Itinerary (2026),https://images.unsplash.com/photo-1558431382-27e303142255?w=1000&q=85&fit=crop&ar=2:3,https://www.incredibleitinerary.com/blog/bhubaneswar-3-days,"Day-by-day Bhubaneswar plan with 4 travel styles — budget, couple, adventure & family. Real costs, real routes, real tips from IncredibleItinerary. Plan smarter, travel better!  Odisha's capital has over 500 ancient temples within 5km² — Lingaraj, Mukteshvara, Rajarani — plus the best Odissi dance and Pattachitra art in the world.  #BhubaneswarTravel #Bhubaneswar #IncredibleIndia #TravelGuide #TravelItinerary #IndiaTravel #TripPlanning #TravelBlog #BhubaneswarItinerary #TripPlanning",Spiritual India
Chopta & Tungnath in 3 Days — Complete Guide from ₹800/day,https://images.unsplash.com/photo-1570804485046-b5b8d795dc5d?w=1000&q=85&fit=crop&ar=2:3,https://www.incredibleitinerary.com/blog/chopta-tungnath-3-days,"Plan your Chopta & Tungnath trip with real prices. 3-day itinerary with budget, mid-range & luxury plans — hotel picks, Google Maps routes & insider tips. Free guide!  The highest Shiva temple in the world at 3,680m, a 3.5km trek through rhododendron forest, and panoramic views of Nanda Devi, Trishul, and Chaukhamba.  #Chopta&TungnathTravel #Chopta&Tungnath #IncredibleIndia #TravelGuide #TravelItinerary #IndiaTravel #TripPlanning #TravelBlog #BudgetTravel #TravelGuide",Himalayan Adventures
3 Things to Know Before Visiting Chopta & Tungnath (2026),https://images.unsplash.com/photo-1570804485046-b5b8d795dc5d?w=1000&q=85&fit=crop&ar=2:3,https://www.incredibleitinerary.com/blog/chopta-tungnath-3-days,"Don't make these mistakes on your Chopta & Tungnath trip. Best time to visit, where to stay, what to eat & the tourist traps to avoid. Real traveller tips from our free guide.  #Chopta&TungnathTravel #Chopta&Tungnath #IncredibleIndia #TravelGuide #TravelItinerary #IndiaTravel #TripPlanning #TravelBlog #TravelTips #TravelHacks",Himalayan Adventures
The Perfect 3-Day Chopta & Tungnath Itinerary (2026),https://images.unsplash.com/photo-1570804485046-b5b8d795dc5d?w=1000&q=85&fit=crop&ar=2:3,https://www.incredibleitinerary.com/blog/chopta-tungnath-3-days,"Day-by-day Chopta & Tungnath plan with 4 travel styles — budget, couple, adventure & family. Real costs, real routes, real tips from IncredibleItinerary. Plan smarter, travel better!  The highest Shiva temple in the world at 3,680m, a 3.5km trek through rhododendron forest, and panoramic views of Nanda Devi, Trishul, and Chaukhamba.  #Chopta&TungnathTravel #Chopta&Tungnath #IncredibleIndia #TravelGuide #TravelItinerary #IndiaTravel #TripPlanning #TravelBlog #Chopta&TungnathItinerary…",Himalayan Adventures
Mukteshwar in 2 Days — Complete Guide from ₹800/day,https://images.unsplash.com/photo-1626621341517-bbf3d9990a23?w=1000&q=85&fit=crop&ar=2:3,https://www.incredibleitinerary.com/blog/mukteshwar-2-days,"Plan your Mukteshwar trip with real prices. 2-day itinerary with budget, mid-range & luxury plans — hotel picks, Google Maps routes & insider tips. Free guide!  A small Shiva temple at 2,286m, apple orchards, unobstructed Himalayan views and almost no crowds — the Nainital escape most people don't know about.  #MukteshwarTravel #Mukteshwar #IncredibleIndia #TravelGuide #TravelItinerary #IndiaTravel #TripPlanning #TravelBlog #BudgetTravel #TravelGuide",Himalayan Adventures
2 Things to Know Before Visiting Mukteshwar (2026),https://images.unsplash.com/photo-1626621341517-bbf3d9990a23?w=1000&q=85&fit=crop&ar=2:3,https://www.incredibleitinerary.com/blog/mukteshwar-2-days,"Don't make these mistakes on your Mukteshwar trip. Best time to visit, where to stay, what to eat & the tourist traps to avoid. Real traveller tips from our free guide.  #MukteshwarTravel #Mukteshwar #IncredibleIndia #TravelGuide #TravelItinerary #IndiaTravel #TripPlanning #TravelBlog #TravelTips #TravelHacks",Himalayan Adventures
The Perfect 2-Day Mukteshwar Itinerary (2026),https://images.unsplash.com/photo-1626621341517-bbf3d9990a23?w=1000&q=85&fit=crop&ar=2:3,https://www.incredibleitinerary.com/blog/mukteshwar-2-days,"Day-by-day Mukteshwar plan with 4 travel styles — budget, couple, adventure & family. Real costs, real routes, real tips from IncredibleItinerary. Plan smarter, travel better!  A small Shiva temple at 2,286m, apple orchards, unobstructed Himalayan views and almost no crowds — the Nainital escape most people don't know about.  #MukteshwarTravel #Mukteshwar #IncredibleIndia #TravelGuide #TravelItinerary #IndiaTravel #TripPlanning #TravelBlog #MukteshwarItinerary #TripPlanning",Himalayan Adventures
Gangtok in 3 Days — Complete Guide from ₹800/day,https://images.unsplash.com/photo-1627119703136-3964f14b7325?w=1000&q=85&fit=crop&ar=2:3,https://www.incredibleitinerary.com/blog/gangtok-3-days,"Plan your Gangtok trip with real prices. 3-day itinerary with budget, mid-range & luxury plans — hotel picks, Google Maps routes & insider tips. Free guide!  MG Road buzz, Rumtek Monastery, Tsomgo Lake in the clouds, and unobstructed views of Kanchenjunga — Sikkim's capital in 3 perfectly paced days.  #GangtokTravel #Gangtok #IncredibleIndia #TravelGuide #TravelItinerary #IndiaTravel #TripPlanning #TravelBlog #BudgetTravel #TravelGuide",Northeast India
3 Things to Know Before Visiting Gangtok (2026),https://images.unsplash.com/photo-1627119703136-3964f14b7325?w=1000&q=85&fit=crop&ar=2:3,https://www.incredibleitinerary.com/blog/gangtok-3-days,"Don't make these mistakes on your Gangtok trip. Best time to visit, where to stay, what to eat & the tourist traps to avoid. Real traveller tips from our free guide.  #GangtokTravel #Gangtok #IncredibleIndia #TravelGuide #TravelItinerary #IndiaTravel #TripPlanning #TravelBlog #TravelTips #TravelHacks",Northeast India
The Perfect 3-Day Gangtok Itinerary (2026),https://images.unsplash.com/photo-1627119703136-3964f14b7325?w=1000&q=85&fit=crop&ar=2:3,https://www.incredibleitinerary.com/blog/gangtok-3-days,"Day-by-day Gangtok plan with 4 travel styles — budget, couple, adventure & family. Real costs, real routes, real tips from IncredibleItinerary. Plan smarter, travel better!  MG Road buzz, Rumtek Monastery, Tsomgo Lake in the clouds, and unobstructed views of Kanchenjunga — Sikkim's capital in 3 perfectly paced days.  #GangtokTravel #Gangtok #IncredibleIndia #TravelGuide #TravelItinerary #IndiaTravel #TripPlanning #TravelBlog #GangtokItinerary #TripPlanning",Northeast India
Bir Billing in 3 Days — Complete Guide from ₹800/day,https://images.unsplash.com/photo-1506905925346-21bda4d32df4?w=1000&q=85&fit=crop&ar=2:3,https://www.incredibleitinerary.com/blog/bir-billing-3-days,"Plan your Bir Billing trip with real prices. 3-day itinerary with budget, mid-range & luxury plans — hotel picks, Google Maps routes & insider tips. Free guide!  The Billing launch site at 2,400m, 60km paragliding flights over pine valleys, Tibetan monasteries, and the world paragliding championship venue.  #BirBillingTravel #BirBilling #IncredibleIndia #TravelGuide #TravelItinerary #IndiaTravel #TripPlanning #TravelBlog #BudgetTravel #TravelGuide",Himalayan Adventures
3 Things to Know Before Visiting Bir Billing (2026),https://images.unsplash.com/photo-1506905925346-21bda4d32df4?w=1000&q=85&fit=crop&ar=2:3,https://www.incredibleitinerary.com/blog/bir-billing-3-days,"Don't make these mistakes on your Bir Billing trip. Best time to visit, where to stay, what to eat & the tourist traps to avoid. Real traveller tips from our free guide.  #BirBillingTravel #BirBilling #IncredibleIndia #TravelGuide #TravelItinerary #IndiaTravel #TripPlanning #TravelBlog #TravelTips #TravelHacks",Himalayan Adventures
The Perfect 3-Day Bir Billing Itinerary (2026),https://images.unsplash.com/photo-1506905925346-21bda4d32df4?w=1000&q=85&fit=crop&ar=2:3,https://www.incredibleitinerary.com/blog/bir-billing-3-days,"Day-by-day Bir Billing plan with 4 travel styles — budget, couple, adventure & family. Real costs, real routes, real tips from IncredibleItinerary. Plan smarter, travel better!  The Billing launch site at 2,400m, 60km paragliding flights over pine valleys, Tibetan monasteries, and the world paragliding championship venue.  #BirBillingTravel #BirBilling #IncredibleIndia #TravelGuide #TravelItinerary #IndiaTravel #TripPlanning #TravelBlog #BirBillingItinerary #TripPlanning",Himalayan Adventures
Kutch in 3 Days — Complete Guide from ₹800/day,https://images.unsplash.com/photo-1621996659490-3275b4d0d951?w=1000&q=85&fit=crop&ar=2:3,https://www.incredibleitinerary.com/blog/kutch-3-days,"Plan your Kutch trip with real prices. 3-day itinerary with budget, mid-range & luxury plans — hotel picks, Google Maps routes & insider tips. Free guide!  The Great White Rann at full moon — 7,500km² of salt flat glowing silver. The Rann Utsav, Banni grasslands, and the world's finest embroidered textiles.  #KutchTravel #Kutch #IncredibleIndia #TravelGuide #TravelItinerary #IndiaTravel #TripPlanning #TravelBlog #BudgetTravel #TravelGuide",India Travel Guides
3 Things to Know Before Visiting Kutch (2026),https://images.unsplash.com/photo-1621996659490-3275b4d0d951?w=1000&q=85&fit=crop&ar=2:3,https://www.incredibleitinerary.com/blog/kutch-3-days,"Don't make these mistakes on your Kutch trip. Best time to visit, where to stay, what to eat & the tourist traps to avoid. Real traveller tips from our free guide.  #KutchTravel #Kutch #IncredibleIndia #TravelGuide #TravelItinerary #IndiaTravel #TripPlanning #TravelBlog #TravelTips #TravelHacks",India Travel Guides
The Perfect 3-Day Kutch Itinerary (2026),https://images.unsplash.com/photo-1621996659490-3275b4d0d951?w=1000&q=85&fit=crop&ar=2:3,https://www.incredibleitinerary.com/blog/kutch-3-days,"Day-by-day Kutch plan with 4 travel styles — budget, couple, adventure & family. Real costs, real routes, real tips from IncredibleItinerary. Plan smarter, travel better!  The Great White Rann at full moon — 7,500km² of salt flat glowing silver. The Rann Utsav, Banni grasslands, and the world's finest embroidered textiles.  #KutchTravel #Kutch #IncredibleIndia #TravelGuide #TravelItinerary #IndiaTravel #TripPlanning #TravelBlog #KutchItinerary #TripPlanning",India Travel Guides
Mangalore in 2 Days — Complete Guide from ₹800/day,https://images.unsplash.com/photo-1602216056096-3b40cc0c9944?w=1000&q=85&fit=crop&ar=2:3,https://www.incredibleitinerary.com/blog/mangalore-2-days,"Plan your Mangalore trip with real prices. 2-day itinerary with budget, mid-range & luxury plans — hotel picks, Google Maps routes & insider tips. Free guide!  Sulthan Bathery temples, Malpe Beach, Kudla cuisine, Udupi restaurants' birthplace, and the surf at Someshwara — the underrated Karnataka coast.  #MangaloreTravel #Mangalore #IncredibleIndia #TravelGuide #TravelItinerary #IndiaTravel #TripPlanning #TravelBlog #BudgetTravel #TravelGuide",India Beach Getaways
2 Things to Know Before Visiting Mangalore (2026),https://images.unsplash.com/photo-1602216056096-3b40cc0c9944?w=1000&q=85&fit=crop&ar=2:3,https://www.incredibleitinerary.com/blog/mangalore-2-days,"Don't make these mistakes on your Mangalore trip. Best time to visit, where to stay, what to eat & the tourist traps to avoid. Real traveller tips from our free guide.  #MangaloreTravel #Mangalore #IncredibleIndia #TravelGuide #TravelItinerary #IndiaTravel #TripPlanning #TravelBlog #TravelTips #TravelHacks",India Beach Getaways
The Perfect 2-Day Mangalore Itinerary (2026),https://images.unsplash.com/photo-1602216056096-3b40cc0c9944?w=1000&q=85&fit=crop&ar=2:3,https://www.incredibleitinerary.com/blog/mangalore-2-days,"Day-by-day Mangalore plan with 4 travel styles — budget, couple, adventure & family. Real costs, real routes, real tips from IncredibleItinerary. Plan smarter, travel better!  Sulthan Bathery temples, Malpe Beach, Kudla cuisine, Udupi restaurants' birthplace, and the surf at Someshwara — the underrated Karnataka coast.  #MangaloreTravel #Mangalore #IncredibleIndia #TravelGuide #TravelItinerary #IndiaTravel #TripPlanning #TravelBlog #MangaloreItinerary #TripPlanning",India Beach Getaways
Pachmarhi in 3 Days — Complete Guide from ₹800/day,https://images.unsplash.com/photo-1581974944026-5d6ed762f617?w=1000&q=85&fit=crop&ar=2:3,https://www.incredibleitinerary.com/blog/pachmarhi-3-days,"Plan your Pachmarhi trip with real prices. 3-day itinerary with budget, mid-range & luxury plans — hotel picks, Google Maps routes & insider tips. Free guide!  The Satpura plateau at 1,067m — Bee Falls, Pandava Caves, Priyadarshini viewpoint at sunset, and colonial bungalows from the British era.  #PachmarhiTravel #Pachmarhi #IncredibleIndia #TravelGuide #TravelItinerary #IndiaTravel #TripPlanning #TravelBlog #BudgetTravel #TravelGuide",Himalayan Adventures
3 Things to Know Before Visiting Pachmarhi (2026),https://images.unsplash.com/photo-1581974944026-5d6ed762f617?w=1000&q=85&fit=crop&ar=2:3,https://www.incredibleitinerary.com/blog/pachmarhi-3-days,"Don't make these mistakes on your Pachmarhi trip. Best time to visit, where to stay, what to eat & the tourist traps to avoid. Real traveller tips from our free guide.  #PachmarhiTravel #Pachmarhi #IncredibleIndia #TravelGuide #TravelItinerary #IndiaTravel #TripPlanning #TravelBlog #TravelTips #TravelHacks",Himalayan Adventures
The Perfect 3-Day Pachmarhi Itinerary (2026),https://images.unsplash.com/photo-1581974944026-5d6ed762f617?w=1000&q=85&fit=crop&ar=2:3,https://www.incredibleitinerary.com/blog/pachmarhi-3-days,"Day-by-day Pachmarhi plan with 4 travel styles — budget, couple, adventure & family. Real costs, real routes, real tips from IncredibleItinerary. Plan smarter, travel better!  The Satpura plateau at 1,067m — Bee Falls, Pandava Caves, Priyadarshini viewpoint at sunset, and colonial bungalows from the British era.  #PachmarhiTravel #Pachmarhi #IncredibleIndia #TravelGuide #TravelItinerary #IndiaTravel #TripPlanning #TravelBlog #PachmarhiItinerary #TripPlanning",Himalayan Adventures
